ID,SHORTCODE,LIKES,NUM_COMMENTS,DATE,WEEKDAY,CAPTION,IS_VIDEO,VIDEO_VIEW_COUNT,USERS_LIKED,TAGS,MENTIONS,HAS_COMMENTS
1600620233324046487,BY2i58rlSiX,101,0,2017-09-10 07:33:42,Sunday,We got a sweet tooth tonight 🍦🍭🎂🍡 cc: @shaun.baluyot • • • • #PRYSM #FAMEsaturdays #TonyMartinez,False,N/A,stavatron djkaossd hizzyofficial shaun.baluyot rrricoo22 care_x0 kat1egotbandz rigomora3 stephaniestud hishamgadelrab ,PRYSM FAMEsaturdays TonyMartinez ,shaun.baluyot ,false
1579203603994073367,BXqdU-UFVkX,31,0,2017-08-11 18:22:41,Friday,He's back!! @crespothedj is gonna turn the club up tomorrow night for our #FAMEsaturdays! Are you ready?! 🔥🔥 • • • • #PRYSM #DJCrespo #FAMEsaturdays #chicagonightlife #letsgetit,True,329,oliviapura ms_yasia frankwalker.br care_x0 crespothedj dymendcut evandorosheff dj_scinta _mylesworld wearerichgroup ,FAMEsaturdays PRYSM DJCrespo FAMEsaturdays chicagonightlife letsgetit ,crespothedj ,false
1503855079673267084,BTexDopl4OM,34,1,2017-04-29 19:18:37,Saturday,F.A.M.E Saturdays. Grab tickets now for the after party with @shaunfrank! Limited RSVP available at link in bio! . . . . . #FAMEsaturdays #shaunfrank #thechainsmokers #tour #afterparty #theweekend #saturdays,True,384,natalka2felker djwzrd officialwilld d_meech_ djteffler _kirstenashley cwkcarson5 zanzibar_club hytydmusic 312photochronicles ,FAMEsaturdays shaunfrank thechainsmokers tour afterparty theweekend saturdays ,shaunfrank! ,true
1565109814346267384,BW4YxV2ljr4,106,0,2017-07-23 07:40:50,Sunday,First annual White Party with @erickmorillo is better than we could've imagined!!! The nights still going  come join us!! Photos: @gjbeckphotography,False,N/A,lunar.gales m.jane.v feeddeleted134 care_x0 bmate karinagonz _jennyescobar mhprice42 djgordo23 chappie ,,erickmorillo come gjbeckphotography ,false
1414771978388908993,BOiR55aDCvB,61,1,2016-12-27 21:26:24,Tuesday,Today might be your last chance to celebrate New Years Eve with us. Purchase your tickets today #newyearseve #2017 #prysm #gems,False,N/A,lngenji emorycartier srbardales ryaninthecity thetailoredmadelife amylo_05 goykphoto sam6678 brunozoo ,newyearseve 2017 prysm gems ,,true
1608871222787277041,BZT29pblYDx,55,0,2017-09-21 16:46:57,Thursday,TOMORROW NIGHT!! @djmartinjensen will be at PRYSM Nightclub for #DETOURfridays -- head to our FB and Twitter for ticket info 🍾 • • • • #PRYSM #DETOURfridays #martinjensen #chicagonightlife,False,N/A,ryanparadise_ care_x0 rahul_pd dutchantilleanleague evelina_bryja brittanyconigs nightlife_concierge ysqu2red nungaray711 jocii_navarrete ,DETOURfridays PRYSM DETOURfridays martinjensen chicagonightlife ,djmartinjensen ,false
1490786838046571977,BSwVrsNl_3J,69,0,2017-04-11 18:34:21,Tuesday,ON SALE NOW! @feddelegrand at @PRYSMnightclub on May 27th! #MemorialDayWeekend . . . #FeddeLeGrand #MDW2017 #summertimechi #nightlife #prysmnightclub #FAMEsaturdays,False,N/A,djtomfleming nissaspassion elleu2djeliana margarita__mar aspelta_music rosalamere_ djdouglarson theycallmelipss cocktailwaitresses ddayana143 ,MemorialDayWeekend FeddeLeGrand MDW2017 summertimechi nightlife prysmnightclub FAMEsaturdays ,feddelegrand PRYSMnightclub ,false
1485774260249389845,BSeh9FWlWsV,64,1,2017-04-04 20:35:15,Tuesday,Saturday's sneak peek 😉 . . . . #saturdays #sneakpeek #artwork #party #music #prysmnightclub #chicagonightlife #entertainment #fashion,False,N/A,captain_america589 simplyjacks therealmikkeripper vivianmerza lifting_e bmate cristoper_navarro moncayoliz djsimone roberto1517 ,saturdays sneakpeek artwork party music prysmnightclub chicagonightlife entertainment fashion ,,true
1521197271584579655,BUcYNveF6BH,38,0,2017-05-23 17:34:27,Tuesday,@cedricgervais kicks off MDW in Chicago with us! Ticket link in bio. . . . . . . #chicago #cedricgervais #mdw #memorialdayweekend,False,N/A,talon.music who_is_ashley mashka88b fourteen0 moni_caam cierra___w mariefiorito25 kevramirez_13 linaserevan bmate ,chicago cedricgervais mdw memorialdayweekend ,cedricgervais ,false
1496706781732503679,BTFXuNaFYB_,47,0,2017-04-19 22:36:13,Wednesday,F.A.M.E Saturdays are where its at! Catch @perrydontae and @1688lbs this weekend! They are bringing a show that's not to miss! Doors open at 10pm! . . . . #FAMEsaturdays #prysmnightclub #theweekend #1688lbs #drummer #thepack #letsgo #fashion #art #music #entertainment #chicagonightlife,False,N/A,jamesfchapman mashka88b carrie_carlton stsr86 djdamiondagostino omar___krz jamiepickettmma jay10malik ryanparadise_ linatorres15 ,FAMEsaturdays prysmnightclub theweekend 1688lbs drummer thepack letsgo fashion art music entertainment chicagonightlife ,perrydontae 1688lbs ,false
1314071353427365830,BI8hO8Gjg_G,107,3,2016-08-10 22:52:14,Wednesday,Check out the full photo album from Saturday  July 23rd feat. @ErickMorillo on our Facebook.  #ErickMorillo @gemsofprysm #PRYSMnightclub #BottleService #Nightclub #Chicago #ElevateYourNightlife,False,N/A,montanamtl joze_cruz ryanparadise_ eia8585 paulyounan1 smellanie1 agnieszka_szkodzinska monikadixon 1mikesantzysb acmalki ,ErickMorillo PRYSMnightclub BottleService Nightclub Chicago ElevateYourNightlife ,July ErickMorillo gemsofprysm ,true
1406060044705818038,BODVCk5j2W2,81,2,2016-12-15 20:57:20,Thursday,Rising star @daya performs at @prysmnightclub on Friday January 13th. Dont let her down  make your plans today.  #daya #dontletmedown #thechainsmokers #singer #prysmfridays,False,N/A,xylo aserialtraveler airia twofriendsmusic mashka88b benelliottmusic shaun132 khaleesi_lala_ __nesssaah__ justiinmitchell ,daya dontletmedown thechainsmokers singer prysmfridays ,daya prysmnightclub make ,true
1613345238185106168,BZjwPI-F1r4,187,38,2017-09-27 20:56:01,Wednesday,👕ITS T-SHIRT TIME 👕This Saturday!!! @djpaulyd will be joining us At PRYSM! Who's excited?! Tag a friend 💃🏽• • • • #PRYSM #PaulyD #FAMEsaturdays #shoutout #chicagonightlife,True,2807,jacobwallzer __nesssaah__ britt_nicholef iamgracielita stephgirjikian webjenna mashka88b charlitos_whey kingsaucin85 rachellungren123 ,PRYSM PaulyD FAMEsaturdays shoutout chicagonightlife ,djpaulyd ,true
1638629527432477231,Ba9lN-VFDov,122,1,2017-11-01 18:11:23,Wednesday,Halloween recap 🎃👻 #SuperSmashBaM #BamCreates • • • • • • #PRYSM #party #champagne #bottles #bottleservice #nightlife #champagneshowers #TheDEN #drinks #chicagoparty #lifestyle #booze #shots #girls #upscale #domperignon #chitown #aceofspades #veuve #chicago #chicagonightlife #nightout #cocktail #pregame #scene #chicagogram #VIP,False,N/A,foundationroomchicago jasmin_ortizz alexlopez10299 lvl44sj wearerichgroup jola7 inaagashi carrieleighfish rahul_pd lykims ,SuperSmashBaM BamCreates PRYSM party champagne bottles bottleservice nightlife champagneshowers TheDEN drinks chicagoparty lifestyle booze shots girls upscale domperignon chitown aceofspades veuve chicago chicagonightlife nightout cocktail pregame scene chicagogram VIP ,,true
1532022349452741407,BVC1jW3Fwsf,48,2,2017-06-07 16:01:57,Wednesday,Enter to win a 4-pack ticket bundle for #DETOURfridays with @martinsolveig!!! Link in bio and comments! . . . . . #prysm #prysmnightclub #martinsolveig #contest,False,N/A,chi_lane invyme1 andreajohnson_lasvegas clau.cac femme_noir_9784 frankkgonzales mirrr_andaa edenruthz darian__james lux.global ,DETOURfridays prysm prysmnightclub martinsolveig contest ,martinsolveig!!! ,true
1464742534354172220,BRTz5MPlfk8,55,0,2017-03-06 20:08:58,Monday,Where will you be this Friday?? #mcm . . . . #DETOURfridays #chicagonightlife #prysmnightclub #mondaymood #chicity #elephante #rivernorth #michiganave #lincolnpark,False,N/A,mattdeiland1979 freeskatechi bmate polishandpour smashproperties papadoobio 9roundwickerpark goykphoto riziko_int brandnives ,mcm DETOURfridays chicagonightlife prysmnightclub mondaymood chicity elephante rivernorth michiganave lincolnpark ,,false
1367184218480659052,BL5Ns2VD0ps,113,0,2016-10-23 05:38:01,Sunday,Congratulations @Cubs! We're going to the #WorldSeries! #FlyTheW,False,N/A,jimlovg fearmyroar aye_em5 jessthewayilike vanessa_barbieri_p nicolebeataa 773_lala prcii_srcii makedarealestate _mayrajimena ,WorldSeries FlyTheW ,Cubs! ,false
1696221988899785455,BeKMOl0lArv,266,9,2018-01-20 05:17:19,Saturday,It’s a bird.. it’s a plane.. no  it’s the @gemsofprysm !! Let them save you from those other boring Friday night parties by coming to PRYSM tonight,False,N/A,hn390 blonderthanyouu hello_kitten_love_popcake_ sky2.16 braulioleon djspeedy_eddie krker8 maria_butnaru_13 d_meech_ taaatttiii ,,it’s gemsofprysm ,true
1550952794181375280,BWGF1lYlJUw,54,0,2017-07-03 18:53:22,Monday,This Friday @cazzette will be at PRYSM with @domdolla for #DETOURfridays!! Get tix now 😎,False,N/A,vinnyvibe juliya0514 ms_yasia lubsofficial delaneyfiorito djjessicawho dutchantilleanleague mirrr_andaa cousinjaytee urbankisscase ,DETOURfridays ,cazzette domdolla ,false
1513956167378164203,BUCpxzqFlnr,65,0,2017-05-13 17:47:40,Saturday,Last night was lit with @vinaiofficial 🔥🔥🔥 Let's keep the weekend going!! Come out to PRYSM tonight for #FAMEsaturdays with @chachiofficial!! RSVP for FREE entry! Link in bio. . . . . . #prysmnightclub #prysm #chicago #chicagonightlife #chachi #saturday #saturdaynight #summertimechi,False,N/A,sirgilliam cocktailwaitresses laurlaurd bridgetbowes justiinmitchell worthgirl78 demetruest emaralbaby theycallmelipss msxkarlita ,FAMEsaturdays prysmnightclub prysm chicago chicagonightlife chachi saturday saturdaynight summertimechi ,vinaiofficial chachiofficial!! ,false
1495841009397180840,BTCS3kFlKmo,84,7,2017-04-18 17:56:05,Tuesday,#DETOURfridays are the place to be! Ticket link in bio! Guess who's visiting us on 6.2?? . . . . #summertimechi #prysmnightclub #fridays #chitown #chicagonightlife #edm #music #DETOURfridays #tritonal #cashcash #garethemery #vinai #lostkings #cedricgervais #mdw2017,False,N/A,danykanadeau justinstorandt eatme_mickey guitarchicago amreen1212 ryanparadise_ fm_hairstudio djphoenix9 vinai_fanpage_ djsimone ,DETOURfridays summertimechi prysmnightclub fridays chitown chicagonightlife edm music DETOURfridays tritonal cashcash garethemery vinai lostkings cedricgervais mdw2017 ,,true
1343793973622121333,BKmHX_RDqN1,40,0,2016-09-20 23:05:46,Tuesday,Elevate your nightlife experience with Dynamix [@Dynamixif2] this Friday! #PRYSMnightclub #Nightlife #Nightclub #VIP #BottleService #Chicago,False,N/A,dianadancelife minimalhour dills37 martinez_promotes cdiddy51 paulyounan1 dean.athanasios lole.fontalvo x_k0ukla ,PRYSMnightclub Nightlife Nightclub VIP BottleService Chicago ,,false
1290830255066250005,BHp80cijPsV,61,4,2016-07-09 21:16:19,Saturday,Less than a week away from our Grand Opening! #‎ElevateYourNightlife #NightClub #Girls #Models @GemsOfPRYSM #BottleService #PRYSMchi #PRYSMnightclub,False,N/A,angielaamarie deanna.callahan 13erto13eatz biancamarie423 romana_limitededition mjrottmann d_meech_ sammybonit jeffreact dills37 ,NightClub Girls Models BottleService PRYSMchi PRYSMnightclub ,GemsOfPRYSM ,true
1439344870493666001,BP5lIijDjrR,263,8,2017-01-30 19:08:21,Monday,What are your plans for Valentine's Day weekend? I know what we will be doing... ❤️🔥💃🏽 Book your tables ASAP! . . . . . #PRYSMsaturdays #vday #vip #elevateyournightlife #nightlife #chicagonightlife #specialguest #celebrate #bottles #ladiesnight #experience,False,N/A,rathtje bleona_225 raaaachel29 tyss.e nany_bluss itsfernemi angela_deliguori xoapplejaxxo ,PRYSMsaturdays vday vip elevateyournightlife nightlife chicagonightlife specialguest celebrate bottles ladiesnight experience ,,true
1429980535531118219,BPYT7iADh6L,56,5,2017-01-17 21:03:05,Tuesday,JUST ANNOUNCED! @iamtjr at @PRYSMnightclub on Friday  February 10th! #PRYSMnightclub #PRYSMfridays #experience #chicagonightlife #tjr,False,N/A,ryaninthecity andreajohnson_lasvegas eia8585 djmrshaw dafxklife imar_87 bmate layylow25 luegle ,PRYSMnightclub PRYSMfridays experience chicagonightlife tjr ,iamtjr PRYSMnightclub February ,true
1547248547082314366,BV47lscFKJ-,71,1,2017-06-28 16:13:41,Wednesday,Our #WCW goes out to @nervomusic 😍😍😍 we can't wait to have you on Friday!!! . . . . . #nervo #nervomusic #prysm #chicago #friday #DETOURfridays,False,N/A,xaaldin jesabeldj mirrr_andaa amandabagby laceyxnelson_ bmate arubio13 thelegz vanessa.megann darian__james ,WCW nervo nervomusic prysm chicago friday DETOURfridays ,nervomusic ,true
