ID,SHORTCODE,LIKES,NUM_COMMENTS,DATE,WEEKDAY,CAPTION,IS_VIDEO,VIDEO_VIEW_COUNT,USERS_LIKED,TAGS,MENTIONS,HAS_COMMENTS
1388628259315156182,BNFZgtpjITW,119,4,2016-11-21 19:43:29,Monday,Start your holiday weekend off right on #BlackWednesday at @TheDENatPRYSM! #PRYSMnightclub #Chicago #Nightlife #ClubLife #BottleService #TheDEN,True,642,djnayyz redmanmiami1 mandssbarbie connorf_falls jcarlos0291 smnthlyss_ mattmolewyk parkst_cantina tailoredtalk ,BlackWednesday PRYSMnightclub Chicago Nightlife ClubLife BottleService TheDEN ,TheDENatPRYSM! ,true
1544832252437206599,BVwWL-sFhZH,155,5,2017-06-25 08:12:57,Sunday,@zedd thank you for an amazing #FAMEsaturdays!!! Great to have you 😜 📸: @shaun.baluyot,False,N/A,willyynillyy katrina_mariel sirgilliam cathygbelle a_johnson30 elsondivinagracia carrie_carlton meeukee1 zelseydd edenruthz ,FAMEsaturdays ,zedd shaun.baluyot ,true
1569904204038137134,BXJa45NFeUu,32,1,2017-07-29 22:26:26,Saturday,gettin ready for tonight like.. 👠 • • • • #PRYSM #JoeMaz #FAMEsaturdays #champagne #chicago,False,N/A,iamsarahclarkk alben_3 oscar123mendoza yosifdimitrov delaneyfiorito jocii_navarrete ms_yasia naspistul cierra___w amylo_05 ,PRYSM JoeMaz FAMEsaturdays champagne chicago ,,true
1580250331136495318,BXuLU27lY7W,85,1,2017-08-13 05:02:21,Sunday,it's gonna be a crazy night!! come play 😈 • • • • #PRYSM #FAMEsaturdays #itslit #champagne #chicagonightlife,False,N/A,michelllenavarro lord_edward_davenport rahul_pd stavatron jorge0912 twizzite livkultgen benrichards joyce_negron vivianmerza ,PRYSM FAMEsaturdays itslit champagne chicagonightlife ,,true
1320561068976530779,BJTk0usjmVb,60,6,2016-08-19 21:46:08,Friday,The weekend is here  let's have some fun! For reservations call 312.546.4141 @GemsOfPRYSM #ElevateYourNightlife #BottleService #PRYSMnightclub #PRYSMchi,False,N/A,mad.ma.sen smoulder_1 kellyg614 christos_liagridonis bobbyzohar djdrex_official dills37 mtkmatt eclayton1 mjrottmann ,ElevateYourNightlife BottleService PRYSMnightclub PRYSMchi ,let's GemsOfPRYSM ,true
1575631405035477636,BXdxGoyFtqE,89,1,2017-08-06 20:05:22,Sunday,If you weren't here last night  you def missed out!! @kaskade killed it 💥 • cc: @swggrbck • • • #PRYSM #Lollapalooza2017 #Afterparty  #kaskade #chicago #summertimechi,False,N/A,b1inc swggrbck care_x0 johnmjoyce12 sammybonit _demetris1682 danny_dwyer miss.kriztina deanna.callahan nissaspassion ,PRYSM Lollapalooza2017 Afterparty kaskade chicago summertimechi ,you kaskade swggrbck ,true
1506868718520948966,BTpeR2iltjm,63,1,2017-05-03 23:06:11,Wednesday,Second tier tickets are now sold out! Grab your tickets for DETOUR fridays with @garethemery link in bio! . . . . . #DETOURfridays #chicagonightlife #trancefamily #trancemusic #nightlife #trance #theweekend,True,369,alexandrebergheau x_k0ukla khomha insali3008 bmate omar___krz itisbillly djsimone marcelalaciak anna_.rdk ,DETOURfridays chicagonightlife trancefamily trancemusic nightlife trance theweekend ,garethemery ,true
1342934733999065116,BKjEAaAjEgc,59,3,2016-09-19 18:38:37,Monday,Thank you to everyone who joined us for @DukeDumont​! If you weren’t able to make it  we hope to see you soon! #DukeDumont #MemorialDayWeekend #LDW2016,True,442,angielaamarie awesome_adri gtgyk leodmg fresca_8 cocktailwaitresses djpjmusic divisuals tanecare michael_stephen_ ,DukeDumont MemorialDayWeekend LDW2016 ,DukeDumont​! we ,true
1523763286944173911,BUlfqLgFs9X,270,4,2017-05-27 06:32:40,Saturday,Memorial Day Weekend begins! Cedric Gervais and the ladies of the DEN at PRYSM! Call 312.546.4141 for more info. Snapchat: prysm_nightclub #PRYSMnightclub #Chicago #CedricGervais #DETOURfridays #TheDENatPRYSM,False,N/A,deejayy_biz sammybonit justinstorandt kevintorrez1 djdouglarson cierra___w primnproprofficial aserialtraveler dashiel_raynes 10xxmusic ,PRYSMnightclub Chicago CedricGervais DETOURfridays TheDENatPRYSM ,,true
1659057103934064519,BcGJ6VeFAeH,327,8,2017-11-29 22:37:20,Wednesday,🙃🙃🙃 • • • • • • #PRYSM #party #champagne #bottles #bottleservice #nightlife #champagneshowers #TheDEN #drinks #chicagoparty #lifestyle #booze #shots #girls #upscale #domperignon #chitown #aceofspades #veuve #chicago #chicagonightlife #nightout #cocktail #pregame #birthday #chicagobirthday #chicagogram #VIP,False,N/A,herhippiespirit sarahbeth196 pokeiman1994 manny__stylez the_daily_dost_chicago alexxissuzanne shadayharilela haneensharhan kussshhh21 backstagebrat ,PRYSM party champagne bottles bottleservice nightlife champagneshowers TheDEN drinks chicagoparty lifestyle booze shots girls upscale domperignon chitown aceofspades veuve chicago chicagonightlife nightout cocktail pregame birthday chicagobirthday chicagogram VIP ,,true
1547975706109472723,BV7g7QDlu_T,77,1,2017-06-29 16:18:25,Thursday,#TBT to @mambybeach afters with @klingandemusic !! What a boring Sunday 😜 cc: @lens2lawrence . . . . #mamby #mambyonthebeach #klingande #prysm #recap,True,558,sameyer40 darian__james rpbrown812 amymhelmuth rachellungren123 bmate justiinmitchell karynahulaha raquelynn bellafilippi ,TBT mamby mambyonthebeach klingande prysm recap ,mambybeach klingandemusic lens2lawrence ,true
1430637618333116370,BPapVWDDmfS,69,1,2017-01-18 18:48:35,Wednesday,Let the countdown to Friday begin! Only two more days till @dashberlin purchase your tickets today! #PRYSMfridays #nightlife #elevate,False,N/A,durso_official joe_zd natalka2felker tannerchap13 jadexedvj bmate toshleigh __lkolo marianadava originald.c ,PRYSMfridays nightlife elevate ,dashberlin ,true
1613274752721786133,BZjgNcRFpUV,59,0,2017-09-27 18:35:58,Wednesday,#humpdayvibes,False,N/A,rflanagan11 djphoenix9 thelegz jamesfchapman wearerichgroup mjrottmann itslyndrum nat.orious___ jocii_navarrete cocktailwaitresses ,humpdayvibes ,,false
1724961483480381523,BfwS1R6FDhT,184,11,2018-02-28 20:57:34,Wednesday,THANK YOU!!! We hit 10k followers! 🥂 Congrats @earley.bird for being our 10 000th follower ~ your party is on us! 🎉🍾,False,N/A,djagentforte djsimone djsupreme01 ryanparadise_ matt.thompson66 dillchicago yaritzaornelas_ str8lexin djboom_chi mashka88b ,,earley.bird ,true
1390852438336977253,BNNTOxyD7ll,195,2,2016-11-24 21:22:32,Thursday,Happy #Thanksgiving from the @PRYSMnightclub family! Dance off all those extra calories with @marshmellomusic tomorrow night! #Marshmello #BlackFriday #Chicago,False,N/A,maii.life jennnn_4 anthonywade_808 mcneelydc prysmnightclub rjmelman wisewordsmgmt 312photochronicles boyle39 ,Thanksgiving Marshmello BlackFriday Chicago ,PRYSMnightclub marshmellomusic ,true
1603985836806159987,BZCgJ7Llr5z,81,1,2017-09-14 23:00:33,Thursday,PRYSM is the place to be this weekend! 💎 • • • • #PRYSM #DETOURfridays #FAMEsaturdays #chicagonightlife,False,N/A,cre8ive_critter vinnyvibe djrogerp maryfuka alaura_hernandez hn390 mjrottmann delaneyfiorito hsunshine777 shaytalbe ,PRYSM DETOURfridays FAMEsaturdays chicagonightlife ,,true
1390194582583364440,BNK9pt3jctY,67,4,2016-11-23 23:35:30,Wednesday,Kick off the holiday weekend tonight in @TheDENatPRYSM!  #BlackWednesday #Chicago #Nightlife #ClubLife #BottleService #PRYSMnightclub,True,554,knighteamon thebestdrinkever bondiaofficial marcelalaciak ally0katt undead_lion13 un_titled___ djsimone angielaamarie ,BlackWednesday Chicago Nightlife ClubLife BottleService PRYSMnightclub ,TheDENatPRYSM! ,true
1503041437973276592,BTb4DlxFuew,33,0,2017-04-28 16:22:03,Friday,Tonight's gunna be 🔥🔥🔥 @otgenasis &amp; @cashcash in the building for #DETOURfridays Grab tickets now! Link in bio. . . . . #cutit #rolex #otgenasis #cashcash #weekendvibes #letsgo #prysmnightclub #chicago #nightlife,True,316,alex__a3 connorf_falls eku818 justiinmitchell goldclubua rachellungren123 wearerichgroup caquis._ bmate vegasurbanevents ,DETOURfridays cutit rolex otgenasis cashcash weekendvibes letsgo prysmnightclub chicago nightlife ,otgenasis cashcash ,false
1555338651172706916,BWVrENAlZpk,52,0,2017-07-09 20:07:17,Sunday,Last night was on a new level 🍾🍾🍾 📸: @shaun.baluyot . . . . #kyle #superduperkyle #virgilabloh #prysm,False,N/A,zgubidan_bd_ shaun.baluyot who_is_ashley 1djsix brittanyconigs undead_lion13 delaneyfiorito djjessicawho mashka88b bmate ,kyle superduperkyle virgilabloh prysm ,shaun.baluyot ,false
1739373545875376407,BgjfwY9nQkX,206,10,2018-03-20 18:11:46,Tuesday,#tbt to this past Friday with @bassjackers! Meet &amp; Greet was lit!🍕🔥,False,N/A,mishafedornyak kathryngessert carlos_sanchez383 jusliz928 tsoaps tonymartinezofficial mollybellx eva_510 myfavoritedj scandeezy31 ,tbt ,bassjackers! ,true
1438275616063111358,BP1yA1wjEC-,115,4,2017-01-29 07:43:56,Sunday,Direct from PRYSM Nightclub where Politik just went on! Plus our very own Yolie Carrera's Gatsby-themed Birthday Party in The DEN at PRYSM! Call 312.546.4141 for more info! #chicago #prysmnightclub #prysmsaturdays #politik #thedenatprysm,False,N/A,balog_alex jamesgrilltechno andbibi free_vip_guestlist_vegas__ gtgyk djsubzero shutterrunner itsvegasbound prysmnightclub ,chicago prysmnightclub prysmsaturdays politik thedenatprysm ,,true
1430770009768836960,BPbHb5Ljb9g,59,1,2017-01-18 23:11:38,Wednesday,*NEW ANNOUNCEMENT*  We are very excited to introduce our new Saturday resident Dj @primadante! Going to make for some epic weekend nights ahead!! Welcome to the family! #PRYSMsaturdays #nightlife #newresident #dantethedon,False,N/A,originald.c mel_kns mashka88b felipee11_99 meldebarge webjenna gtgyk djsimone meli.musica lynettepesina ,PRYSMsaturdays nightlife newresident dantethedon ,We primadante! ,true
1541459070368032010,BVkXNuFFyUK,98,0,2017-06-20 16:31:02,Tuesday,We are so stoked to have @zedd for #FAMEsaturdays this Saturday!! It's gonna be a big one  so get your tickets soon! . . . . . #zedd #stay #saturday #chicago #prysm,False,N/A,mariefiorito25 jessikjcs vibbiani smaasarani pkorin_7 romana_limitededition pina_michela5 briannamayee toutl_official mikeywaxisawesome ,FAMEsaturdays zedd stay saturday chicago prysm ,zedd so ,false
1519929713908621771,BUX4AWZFaHL,38,1,2017-05-21 23:36:03,Sunday,Another Industry Mondays in full effect tomorrow!! RSVP with link in bio! . . . . #chicagonightlife #sundayscaries #theweekend #neverends #prysm,False,N/A,djdouglarson bmate djgordo23 seanwinke djbossanova brettpicarazzi justinnyce nissaspassion ryanparadise_ djzel26 ,chicagonightlife sundayscaries theweekend neverends prysm ,,true
1465511806248497169,BRWizkhlTAR,43,0,2017-03-07 21:37:22,Tuesday,JUST ANNOUNCED! @wearelostkings at @PRYSMnightclub on May 19th! Tickets on sale Thursday at 3pm! #LostKings #DETOURfridays #chicagonightlife #prysmnightclub,False,N/A,gtgyk justinnyce te_veo_nyc madelaineendres laurlaurd e1even.twe1ve bmate pirate_from_berlin djsimone brandnives ,LostKings DETOURfridays chicagonightlife prysmnightclub ,wearelostkings PRYSMnightclub ,false
1516122000930097280,BUKWO1Vl8iA,48,0,2017-05-16 17:30:48,Tuesday,Cheers to you! Come celebrate your birthdays and bachelorette parties at PRYSM this summer!! For more info call 312.546.4141 . . . . #champagne #chicagonightlife #summertimechi #summer #prysm #prysmnightclub,False,N/A,billypissios ddayana143 bmate ryanparadise_ mcneelydc tiffanypohl eyeheartandsoul eslamaestra jamesfchapman ms_yasia ,champagne chicagonightlife summertimechi summer prysm prysmnightclub ,,false
1573373380488829776,BXVvsDjF5tQ,159,1,2017-08-03 17:19:04,Thursday,Last night was insane!! @tiesto killed it 🔥🔥🔥 • • • • #PRYSM #Tiesto #Lollapalooza2017 #Chicago #summertimechi,False,N/A,voynikov88 harmlesshippy amandabagby kellyg614 vanessers d_meech_ shelbybradenn djdiox nilserodriguez jj__wl ,PRYSM Tiesto Lollapalooza2017 Chicago summertimechi ,tiesto ,true
1648899723720250668,BbiEY_-ldUs,143,4,2017-11-15 22:16:26,Wednesday,Hump day is almost over... you know what that means 😏🍾🥂 • • • • • • #PRYSM #party #champagne #bottles #bottleservice #nightlife #champagneshowers #TheDEN #drinks #chicagoparty #lifestyle #booze #shots #girls #upscale #domperignon #chitown #aceofspades #veuve #chicago #chicagonightlife #nightout #cocktail #pregame #scene #chicagogram #VIP,False,N/A,brunoabreu71 210ceviche thewallmauer danicaliforna mikewwong djdearo givenchy.blanco_ arias.george 773_lala colusto_wein ,PRYSM party champagne bottles bottleservice nightlife champagneshowers TheDEN drinks chicagoparty lifestyle booze shots girls upscale domperignon chitown aceofspades veuve chicago chicagonightlife nightout cocktail pregame scene chicagogram VIP ,,true
1528835991708092314,BU3hDv9l8ea,164,4,2017-06-03 06:31:14,Saturday,DETOUR Fridays with Future  Dzeko  and The DEN at PRYSM! Call 312.546.4141 for more info. Snapchat: prysm_nightclub #PRYSMnightclub #Chicago #Future #Dzeko #DETOURfridays #TheDENatPRYSM @future @prysmnightclub @dzeko @thedenprysm,False,N/A,darian__james xavierrvxx _finite_infinity_ talklaunch el_don_nothing xhibition_ sloshy24 mattmolewyk themexicanhulk ms.anhell ,PRYSMnightclub Chicago Future Dzeko DETOURfridays TheDENatPRYSM ,Dzeko and future prysmnightclub dzeko thedenprysm ,true
1356799999115988296,BLUUmkajw1I,39,1,2016-10-08 21:46:25,Saturday,The weekend isn't over yet  @LaidbackLuke makes his #PRYSM debut tonight! For Reservations call 312-546-4141 #ElevateYourNightlife #VIP #BottleService #Nightclub #Chicago #PRYSMnightclub,False,N/A,djbadboybill who_is_ashley kdavick angielaamarie zachtron jeffreact minyarmusic fresca_8 christos_liagridonis ,PRYSM ElevateYourNightlife VIP BottleService Nightclub Chicago PRYSMnightclub ,@LaidbackLuke ,true
1461192799693314237,BRHMxwOFBi9,74,6,2017-03-01 22:36:17,Wednesday,JUST ADDED! @djalexpeace &amp; Redux join @thomasjack at @PRYSMnightclub this Friday! #DETOURfridays #thomasjack #prysmnightclub #vip #music #bottles #chicagonightlife #nightlife #tropicalhouse #party #epic #fridayfeels,False,N/A,djwzrd connorf_falls socadennis ryandwanemusic mus_32 mashka88b brekkmusic gghardrok proper_looks brandnives ,DETOURfridays thomasjack prysmnightclub vip music bottles chicagonightlife nightlife tropicalhouse party epic fridayfeels ,djalexpeace thomasjack PRYSMnightclub ,true
1620005729863107443,BZ7aqDOloNz,104,1,2017-10-07 01:29:13,Saturday,Start with straight shots and then pop bottles 😈🍾 #comeplay #sunneryjames #ryannarciano • • • • • #PRYSM #DETOURfridays #chitown #chicagonightlife #bottleservice #partytime,False,N/A,itslyndrum ashleyk1025 evelina_bryja rajin_nina djwreck nanis_25 goykphoto d_meech_ kevramirez_13 david_c_at_themid ,comeplay sunneryjames ryannarciano PRYSM DETOURfridays chitown chicagonightlife bottleservice partytime ,,true
1533783289667992863,BVJF8aPFz0f,102,2,2017-06-10 02:20:38,Saturday,@springawakefest weekend has begun!! Join us for the official after party with @afrojack tonight! . . . . #festival #afrojack #springawakening #springawakeningmusicfestival #DETOURfridays #theweekend,False,N/A,djguskaras lux.global brettpicarazzi artisticraw thaiharempants vassy __lkolo djmrshaw gachavc lastnitelife ,festival afrojack springawakening springawakeningmusicfestival DETOURfridays theweekend ,springawakefest afrojack ,true
1719935506610352822,BfecDsMF3K2,71,1,2018-02-21 22:31:51,Wednesday,Who’s ready to make pour decisions ??? 😉🥂✨ #anythinggoes . . . . . Tix: https://www.ticketfly.com/purchase/event/1626406,False,N/A,amberlyncollins alexschenberg kortophoto bcraycray94 mkim31 dexman23 _anatb_ djsimone lov3_sosa mikelala_ ,anythinggoes ,,true
1365504680746921337,BLzP0W7Da15,76,7,2016-10-20 22:01:04,Thursday,JUST ANNOUNCED! @OliverHeldens at @PRYSMnightclub on Saturday  November 26th! Tickets on sale now! For reservations call 312-546-4141 #OliverHeldens #ElevateYourNightlife #Nightclub #Chicago #PRYSMnightclub,False,N/A,fd905 msomtravel 1svo aaber91 michael_stephen_ henripfr dean.athanasios nova_summers stephanie_evarria mikekphotos ,OliverHeldens ElevateYourNightlife Nightclub Chicago PRYSMnightclub ,OliverHeldens PRYSMnightclub November ,true
1326366207213688712,BJoMwm_DdeI,30,0,2016-08-27 21:59:54,Saturday,The weekend continues! Come elevate your nightlife experience! For Reservation call 312.546.4141 #PRYSMsaturdays #BottleService #PRYSMnightclub #PRYSMchi,False,N/A,jsolaye chipellina x_k0ukla aaber91 djsimone kjaymarquis brian_techno justinleonard__ monikadixon ,PRYSMsaturdays BottleService PRYSMnightclub PRYSMchi ,,false
1345245081968121792,BKrRUZOjRfA,39,1,2016-09-22 23:08:52,Thursday,The weekend is almost here! #ElevateYourNightlife experience with DJ Dynamix [@Dynamixif2] ​tomorrow night! #DJDynamix,False,N/A,janos.lehmann nancyandreaaa _kirstenashley monikadixon damn_dani_from_the_south who_is_ashley djgordo23 iamdonaldtharpe eia8585 jacklynk1 ,ElevateYourNightlife DJDynamix ,,true
1650230641332362138,BbmzAZmFJua,118,5,2017-11-17 18:20:44,Friday,Just announced! New Years Eve at PRYSM is one party you don’t want to miss! Come count down with us 🍾🥂🌟 Link in bio • • • • • • #NYE #PRYSM #party #champagne #bottles #bottleservice #nightlife #champagneshowers #TheDEN #drinks #chicagoparty #lifestyle #booze #shots #girls #upscale #domperignon #chitown #aceofspades #veuve #chicago #chicagonightlife #nightout #cocktail #pregame #scene #chicagogram #VIP,False,N/A,djdearo samdabarber_88 justinnyce djphoenix9 lundibleu eia8585 jocii_navarrete lubsofficial rezeptschatulle.de rawleyofficial ,NYE PRYSM party champagne bottles bottleservice nightlife champagneshowers TheDEN drinks chicagoparty lifestyle booze shots girls upscale domperignon chitown aceofspades veuve chicago chicagonightlife nightout cocktail pregame scene chicagogram VIP ,,true
1558168837647816944,BWfuk1kFNjw,62,0,2017-07-13 17:50:21,Thursday,beach don't kill my vibe 🌴🏄🏽 #TBT to last year at #volleywood • • • • • #PRYSM #northavebeach #summertimechi #lifesabeach #grandtheft #FAMEsaturdays,False,N/A,adriennemalaya ordep458 _finite_infinity_ jessikjcs jocelynndorado ashleysiech tumi_786 callmemandoo stinaa25 bmate ,TBT volleywood PRYSM northavebeach summertimechi lifesabeach grandtheft FAMEsaturdays ,,false
1337402235898589895,BKPaD9ojHLH,29,1,2016-09-12 03:26:32,Monday,Friday  September 16th! @CedricGervais ​returns to #Chicago on his #DelectaSessions tour! For Reservations call 312-546-4141 #Chicago #Nightlife #BottleService #ElevateYourNightlife #PRYSMnightclub,True,231,oscar123mendoza michael_stephen_ smaasarani angielaamarie deanna.callahan jonathan199442 djsimone cedricgervais briannaplouffe lifestyleconnect ,Chicago DelectaSessions Chicago Nightlife BottleService ElevateYourNightlife PRYSMnightclub ,September CedricGervais ,true
1757650711422972599,BhkbgJ1lDK3,138,11,2018-04-14 23:25:14,Saturday,Who’s ready for F.A.M.E Saturday’s?!? Beats provided by @joemaz 💥,False,N/A,myfavoritedj mikefeltonfelton doctor.yisrael joemaz rogelio_coronado94 mikeysmols justkarlin moe1st queen_beefit missaliciabales ,,joemaz ,true
1576236486134895825,BXf6rueFJTR,44,0,2017-08-07 16:07:33,Monday,Less Monday  more summer please. ☀️ • • • • #PRYSM #Mondaze #summertimechi,False,N/A,martinalsmith_ ejmls113 beefyyfeeb djdearo evandorosheff misshennyv j.t._pics itzell_rg care_x0 konstantina.gianni ,PRYSM Mondaze summertimechi ,more ,false
1452741411955023485,BQpLJ4CFB59,173,3,2017-02-18 06:44:53,Saturday,Right now at the debut of DETOUR Fridays with Marc Stout and The DEN at PRYSM upstairs! Call 312.546.4141 for more info! #chicago #prysmnightclub #thedenatprysm #detourfridays,False,N/A,djsimone pprofficial juicerx tmore1188 sdesai22 fresca_8 tim_celebrity kevinbabb jmendez1992 ,chicago prysmnightclub thedenatprysm detourfridays ,,true
1536380080926184318,BVSUYsjl1N-,73,3,2017-06-13 16:19:59,Tuesday,Head to our Facebook or Twitter to enter to win a 4-pack of tickets plus a table for @martinsolveig this Friday at PRYSM! . . . . . #prysm #chicago #friday #contest #martinsolveig,False,N/A,joe_zd lollipopcandysho rjmelman femme_noir_9784 cierra___w evelynruby11 bbleiman_27 _finite_infinity_ botktb sean_feng88 ,prysm chicago friday contest martinsolveig ,martinsolveig ,true
1523320409369869484,BUj69dnl_ys,28,0,2017-05-26 15:52:45,Friday,Come spend Memorial Day weekend with us at PRYSM! . . . . . #memorialdayweekend #DETOURfridays #FAMEsaturdays #chicago #summertimechi,True,173,nordjs justkarlin bellatasha84 shitinmycereal goatcrew linaserevan ms_yasia brettpicarazzi bmate omnipopmag ,memorialdayweekend DETOURfridays FAMEsaturdays chicago summertimechi ,,false
1536594114589975876,BVTFDS8F2VE,121,5,2017-06-13 23:25:14,Tuesday,PRYSM offers the leading bottle service experience for any occasion. Call 312.546.4141 for more info about our tables and birthday packages! . . . . #bottleservice #bottles #prysm #chicago #chicagonightlife,False,N/A,djmrshaw djrogerp meowza94 brettpicarazzi twizzite justiinmitchell linatorres15 gabby_adrian arubio13 ethan_chicago ,bottleservice bottles prysm chicago chicagonightlife ,,true
1709716374950317263,Be6IfwLlQzP,69,1,2018-02-07 20:09:51,Wednesday,This Friday !  @3lau 🔻 . . . #detourfridays,True,481,demidoff007 mmmiabella dexman23 faysaliin olgalipiszko justinnyce katerynafl johnny_romer.jromemusic brandnives ,detourfridays ,@3lau ,true
1528497188816327120,BU2UBhLlJHQ,60,3,2017-06-02 19:18:05,Friday,Not only do we have @brodyjenner for FAME Saturdays but get ready for some moves &amp; entertainment from these gentlemen right here! Use RSVP code PRYSMBROD603 for free entry w/ link in bio! . . . . . #FAMEsaturdays #vixen #entertainment #chicagonightlife #summertimechi #theweekend #saturdays,False,N/A,oscar123mendoza seldinabahic keeping_up_with_kellz jmitchellmgmt eia8585 ms_yasia vixen_chicago miss.eleneous lux.global legendarylenaloso ,FAMEsaturdays vixen entertainment chicagonightlife summertimechi theweekend saturdays ,brodyjenner ,true
1384418071863498129,BM2cObCDhWR,143,9,2016-11-16 00:18:36,Wednesday,@DJmustard returns to @PRYSMnightclub on Friday  December 16th! Get tickets today! #DJMustard #PRYSM #Chicago #ElevateYourNightlife,False,N/A,dmdstarks djmrshaw ya_lo_music carley_fries_ cocktailwaitresses brianadibenne marcelalaciak frankkgonzales ,DJMustard PRYSM Chicago ElevateYourNightlife ,DJmustard PRYSMnightclub December ,true
1422298015322651569,BO9BIJgDLux,183,6,2017-01-07 06:39:17,Saturday,Currently at PRYSM Fridays! Call 312.546.4141 for more info. #chicago #prysmnightclub #prysmfridays #rightnow,False,N/A,djdamiondagostino leeleelanea einarassax milanamay andrii_baran bassic_dj srbardales mimoedm baron_inc salon1800 ,chicago prysmnightclub prysmfridays rightnow ,,true
1570182792452916929,BXKaO44lkbB,51,0,2017-07-30 07:39:56,Sunday,#FAMEsaturdays poppin off with @joemaz !! Cc: @shaun.baluyot,False,N/A,kussshhh21 djryanvandal eia8585 yeezus_khrist delaneyfiorito thedenprysm darian__james jalenrollins_ djgordo23 care_x0 ,FAMEsaturdays ,joemaz shaun.baluyot ,false
1296081232270870536,BH8mwOJjkgI,100,1,2016-07-17 03:09:04,Sunday,Day Two! Grand Opening Weekend! Doors are now open! Early arrival is highly suggested. Tickets available at the door. For reservations call 312.546.4141 #PRYSMnightclub #BottleService #Models @GemsofPRYSM,False,N/A,_stefigram damn_dani_from_the_south djsuavae iamkatiegwen 7jimmyt7 its_me_biggs cocktailwaitresses dean.athanasios thabirdman ,PRYSMnightclub BottleService Models ,GemsofPRYSM ,true
1499072226137607751,BTNxj9Llg5H,41,1,2017-04-23 04:55:56,Sunday,Almost time!!! Direct from Miami @crespothedj @perrydontae killing it! Donut time! 🍩 #FAMEsaturdays,False,N/A,chillinlikeafridge crespothedj alaynarickard djbossanova gtgyk wearerichgroup p_ayden mattxmateo jusliz928 effykizito21 ,FAMEsaturdays ,crespothedj perrydontae ,true
1572662265496555422,BXTN_-GlU-e,358,9,2017-08-02 17:46:13,Wednesday,Look who's on their way to Chicago! We're ready for you @tiesto!! 🙌🏽😈 we are SOLD OUT tonight!! • • • • #PRYSM #Tiesto #ChicagoNightlife #letsparty #summertimechi #lollapalooza2017,False,N/A,arisingphenoix scubastacy_ theitbarbie therealmaryclaire issaa.krysstal wearerichgroup kim_homie_quan ospinaa_isabella4 rebeccaaisabell brigyteb ,PRYSM Tiesto ChicagoNightlife letsparty summertimechi lollapalooza2017 ,tiesto!! ,true
1396959377634456539,BNi_ycNjXPb,145,6,2016-12-03 07:35:56,Saturday,Direct from PRYSM Fridays! Seven Lions' Journey Tour After Party! He goes on at 2am! TEXT 630.688.4179 for tables &amp; guest list! #chicago #prysmnightclub #prysmfridays #sevenlions @sevenlionsmusic,False,N/A,originalcuriosity burgandech nielsvoorbach music4listen skyarrowmedia rawtalentchi jvstsayyes beyondthebeatuk familytattoo seantracy ,chicago prysmnightclub prysmfridays sevenlions ,sevenlionsmusic ,true
1547365329801837125,BV5WJG0l_pF,72,1,2017-06-28 20:05:43,Wednesday,It's all about keeping a well balanced diet 🍸 . . . . #prysm #martini #drinks #wednesday #chicago #diet,False,N/A,zeofit lunar.gales amaklotz plzdontpanek cohighvodka jorge0912 djsimone bmate jasmynnive _finite_infinity_ ,prysm martini drinks wednesday chicago diet ,,true
1513608674803050232,BUBaxH-leb4,144,4,2017-05-13 06:17:16,Saturday,Direct from DETOUR Fridays along with The DEN at PRYSM! VINAI just went on  then it's Marc Stout's last Chicago set before he moves to Vegas! Best of luck to you from the PRYSM family!  Call 312.546.4141 for more info. Snapchat: prysm_nightclub #chicago #prysmnightclub #thedenatprysm #vinai #detourfridays @thedenprysm @vinaiofficial,False,N/A,eatinggoodchicago ninadollhouse getoutla youngliomusic lovestylerecords justinnyce paridemusic jkueltzo djezg88 sergiotofficial ,chicago prysmnightclub thedenatprysm vinai detourfridays ,then Call thedenprysm vinaiofficial ,true
1554230337781111048,BWRvEHulBkI,73,0,2017-07-08 07:25:16,Saturday,@cazzette is throwin down right now at #DETOURfridays 🔥🔥🔥 pics: @supreet_muppa,False,N/A,1995_tiffany alannammaza carla_younan twizzite breeezymarie alexxisjudge _finite_infinity_ jdgarcia1109 alaynarickard adeelsoha ,DETOURfridays ,cazzette supreet_muppa ,false
