ID,SHORTCODE,LIKES,NUM_COMMENTS,DATE,WEEKDAY,CAPTION,IS_VIDEO,VIDEO_VIEW_COUNT,USERS_LIKED,TAGS,MENTIONS,HAS_COMMENTS
1084986543250395860,8OpYM4hNLU,94,3,2015-09-29 21:01:36,Tuesday,Save the date ! SPECIAL CLOSING PARTY ! Saturday 3rd OCTOBER !!!... #lescavesduroy #sttropez #party #djjacke #igers #picoftheday #instagood photo: @tillyfleming99,False,N/A,sergiofracchia alexpomeroy kakoperroy oceanelourot juliettesorrente byblossttropez camguillec marion_lacaze cavesduroy ,lescavesduroy sttropez party djjacke igers picoftheday instagood ,tillyfleming99 ,true
1458191360472674183,BQ8iVEHhG-H,143,1,2017-02-25 19:12:57,Saturday,PURPLE HAZE.  #lescavesduroy #sainttropez #club #frenchtouch #purple #love Photo: @moutty,False,N/A,la.guepe.mobile vivocars stellapastirik thomaneck nicolosr luciacamposfaria laita_paris mattdecb jpmcir f_s_member ,lescavesduroy sainttropez club frenchtouch purple love ,moutty ,true
1458972318746644244,BQ_T5gMBY8U,169,3,2017-02-26 21:04:35,Sunday,Blinded by the light... #cavesduroy #party #club #sainttropez #love #igers #photo : @geoffroybrs,False,N/A,bruneddr manon_salce tiphanie_vcrs nicolodega saintjeronimo excellence.saint_tropez borisway allikcarter lesimperatrices etiennevignal ,cavesduroy party club sainttropez love igers photo ,geoffroybrs ,true
1565432574310821431,BW5iKHfny43,213,5,2017-07-23 18:22:06,Sunday,Weekend is not over yet ! "Sunday Funday Party" See you later... . #lescavesduroy #sunday #club #sainttropez #nightlife #video : @ralph_chatelle,True,1210,fabricedoyen thomaneck maxlonner champagnetanguy christopher_b_v_p vallberg gillesiacones boutique_lp_roma thibaultpepino fernandobau ,lescavesduroy sunday club sainttropez nightlife video ,ralph_chatelle ,true
1564747509050324986,BW3GZGwHzf6,211,1,2017-07-22 19:41:00,Saturday,SaTuRdAy360 ! See you at Midnight... . #lescavesduroy #club #goodlife #sainttropez #frenchriviera #video: @natashilva,True,1156,renan_brun abdallahchatila djeebee94 lucasmrt1 janeaudedeville adolph_j.a alexandre201200 verseus micha1micha lorena_finck ,lescavesduroy club goodlife sainttropez frenchriviera video ,natashilva ,true
1605300311555971952,BZHLCDMHhtw,245,2,2017-09-16 18:32:11,Saturday,Summer is not over ! Saturday Party Tonight ! . #midnight #sainttropez #cavesduroy50 #party #frenchriviera . Photo: @cerisesurle752,False,N/A,elena_di_borbone juste_lea19 _marcld_ bardote paulinfornieles stevestrange252 caronig luiscedillo anneruizlamaud alice_briet ,midnight sainttropez cavesduroy50 party frenchriviera ,cerisesurle752 ,true
1306112070055732563,BIgPgH0haVT,109,1,2016-07-30 23:18:33,Saturday,The night started... #sainttropez #lescavesduroy #party #frenchriviera #club #summer2016,False,N/A,tiagoescher1 lourxusselot jonas_2684__bennett klowai rickybossi elodieromby julehannoi raoul_ed justinsillaman cavesduroy ,sainttropez lescavesduroy party frenchriviera club summer2016 ,,true
1737227884130689912,Bgb345vg2N4,333,1,2018-03-17 19:08:43,Saturday,the best things happen when you're dancing #lescavesgirls #soon,False,N/A,jaspermventer galette13 juli.barth bentleydriversclubmonaco juliette_als83 nickguider yohan_pilar benoit_tintane bloomsartfrance margotdft ,lescavesgirls soon ,,true
1614696098387896838,BZojYvknqoG,211,4,2017-09-29 17:39:56,Friday,Till the music is gone  let's party on...! Tonight + Saturday at Midnight... Join us ! . #cavesduroy50 #party #club #sainttropez #frenchriviera,False,N/A,thierrykremper maxilopez28 meierequestrian nastyaraakova camille.vgx eevd_8 theo_brthlt thomaneck sebastienmoulet julia_516 ,cavesduroy50 party club sainttropez frenchriviera ,let's ,true
1430638210123682089,BPapd9MhdEp,149,0,2017-01-18 18:49:46,Wednesday,Blinded by the blue light 💙🔵🔷🔹 #cavesduroy50 #sainttropez #club #party #france #igers Photo: @jaredschuyler,False,N/A,maeva.laligant migbra brooklynsjc alice_briet lareservestjeandeluz arthurjehanno alexfrancia arthur_mrc qsblraww hugoteillet ,cavesduroy50 sainttropez club party france igers ,jaredschuyler ,false
1316903946132315721,BJGlSloht5J,94,2,2016-08-14 20:40:05,Sunday,Awesome season at Les Caves du Roy ! Party time tonight !  #sainttropez #lescavesduroy #party #frenchriviera #club #summer Video: @fabrizio_coscione,True,466,timotheegvn bennibensen85 joaoscatamburlo winecabj lareservestjeandeluz cassialorenateixeira baguur cavesduroy carsinsttropez ,sainttropez lescavesduroy party frenchriviera club summer ,fabrizio_coscione ,true
1453068712562522801,BQqVkuehfqx,181,3,2017-02-18 17:35:10,Saturday,LES CAVES GIRLS... #cavesduroy50 #sainttropez #frenchriviera #girl #party #club Photo: @riahisarah,False,N/A,jeanne_crm celian.fauveau bennibensen85 nickchampagne alessio_cursi jeremydebrez chicco_bergamini rees_reisen vladimir_htblr palo_rps ,cavesduroy50 sainttropez frenchriviera girl party club ,riahisarah ,true
1738680241439824655,BghCHe5AtsP,339,21,2018-03-19 19:15:15,Monday,SAVE THE DATE! 🔜 #EasterWeekend,True,1584,emilyminchella marin_le_roux agneslapeche yassirhani alexis_4730 math_pol jamymutter_dibenedetto laghina peggytessjin 77doubled ,EasterWeekend ,,true
1440184688542348955,BP8kFgDhfab,141,6,2017-01-31 22:56:55,Tuesday,LES CAVES GIRLS !  #lescavesduroy #sainttropez #party #club #girl #love Photo: @fl.prn,False,N/A,bardaukevin ivanvoria villeferraduracorale manuelafarruggia architettosamuelearrighi matvey_bilunov loicpompee jesson_cht yoannboghossian hayron.michelet ,lescavesduroy sainttropez party club girl love ,fl.prn ,true
1311102256904809278,BIx-I5fBis-,118,0,2016-08-06 20:33:10,Saturday,Big party tonight at Les Caves du Roy ! Are you ready ?! #sainttropez #lescavesduroy #party #frenchriviera #club #summer2016,False,N/A,katianamtk bennibensen85 louiseennequin tom__cas lucasmrt1 kirstythefitnesschick nicolasjurczyk romain.f83 leoinnocenti cavesduroy ,sainttropez lescavesduroy party frenchriviera club summer2016 ,,false
1106721011250024902,9b3OVlBNHG,87,5,2015-10-29 20:44:07,Thursday,Souvenirs at Les Caves du Roy St. Tropez : DJ Jack.e and Avril Lavigne... #cavesduroy #hotel #mythical #party #france #bestplace #igers #placetobe #groupefloirat #avrillavigne,False,N/A,_bbrando_ kleiderschrank_men thisissttropez nicojamet byblossttropez camguillec cyfly08 iamarimaxell cavesduroy ,cavesduroy hotel mythical party france bestplace igers placetobe groupefloirat avrillavigne ,,true
1158721747143675909,BAUm0o0BNAF,110,0,2016-01-09 14:40:17,Saturday,,False,N/A,ninolam82 haydeelozada ivan.roncevic lorenzong18 lrd_sf _colinemartin florianauv bennibensen85 lareservestjeandeluz cavesduroy ,,,false
1316221148765446253,BJEKClCBWBt,90,1,2016-08-13 22:03:29,Saturday,Saturday Night Dance Party at Les Caves du Roy !  #sainttropez #lescavesduroy #party #frenchriviera #club #summer Photo: @exclusiveinsttropez,False,N/A,lisabenson1 nikkicosmetics maliboooopete anselmesegond elbee_oldaacount 4fangerfranky mrs_njjj _____jhonathan______ cavesduroy unlimitedfrenchriviera ,sainttropez lescavesduroy party frenchriviera club summer ,exclusiveinsttropez ,true
1753142705285598270,BhUagB9HYw-,617,6,2018-04-08 18:08:38,Sunday,Use #LesCavesGirls to be featured on our Instagram account ! 🔜 #april27,False,N/A,jacobhalabi hilaire_clr emma__hexis marcdedelley kaja_mlakar metamorfosi01 sssshhtellliston flor_ri81 bayram_84 yuliamoatti_shopperstylist ,LesCavesGirls april27 ,,true
1669117539094701091,Bcp5Y72HSQj,1059,48,2017-12-13 19:45:37,Wednesday,Save the date &gt; "Easter Week-End / 2018 Opening": Friday March 30th  Saturday 31st &amp; Sunday April 1st !! ✨ #canwait #lescavesduroy #party #sainttropez,False,N/A,manza9 mikaelpawlo flx2day vero_laplage vagrantaim victoire_t20 sir_henri_13 miljanastoiljkovic bjbrey pablo__voyageur ,canwait lescavesduroy party sainttropez ,Saturday ,true
1524246376283059565,BUnNgDghzVt,252,7,2017-05-27 22:32:29,Saturday,Les Caves du Roy / 50th Anniversary / Birthday Party Tonight / Join us ! . #cavesduroy50 #50thanniversary #party #video : @elsa2a,True,1648,jpmcir sabloo2 jbsainttropez hugoteillet refkolot vivic1997 apolline.brn charlesmartinet davidred83 adeliaroncetti ,cavesduroy50 50thanniversary party video ,elsa2a ,true
1574774779856870679,BXauVGanN0X,253,7,2017-08-05 15:43:24,Saturday,About last night... Mathusalem "Les Caves du Roy 50th anniversary" special edition by @domperignonofficial . PARTY IS HERE !,True,1757,jordanm_83 lucasmrt1 jpmcir carl_edouard sttropez83 emiliencdb juliette_als83 goldschmiede_joerg_scheffel queenpopslove youcharterdirect ,,domperignonofficial ,true
1245176240613413514,BFHwTGQhNKK,119,2,2016-05-07 21:29:56,Saturday,Join us !🎉 #cavesduroy #sainttropez #frenchriviera photo: @pierrebronzetti,False,N/A,personenisainttropez jldellanoce renan_brun ingridmtrn dan_laheyne_ pierrot83420 juniorsainttropez azad.dubois guipereirajlle cavesduroy ,cavesduroy sainttropez frenchriviera ,pierrebronzetti ,true
1476379168957819397,BR9JwgvhGoF,147,2,2017-03-22 21:28:53,Wednesday,ARE YOU CAVES DU ROY ? Share your best photos &amp; memories over the past 50 years at Les Caves du Roy with tag: #cavesduroy50 Photo: @maurymaura,False,N/A,star1179 edimilsonlopesf laura_hnrz stephanelafaye lrd_sf milantoth007 kshc_cattery tutusartori joannes.violot cecileponcet ,cavesduroy50 ,maurymaura ,true
1524275693385769229,BUnUKrMBWEN,182,2,2017-05-27 23:30:44,Saturday,BLURRY ORGASMIC . #cavesduroy50 #50thanniversary #sainttropez #party,True,1174,blumjenalee davidred83 virginie_h_m_l ombri.c jesson_cht rogermonteiroa david_shilan stellapastirik ricardobuenobariri damien_fsl ,cavesduroy50 50thanniversary sainttropez party ,,true
1580045818132384027,BXtc0zWn0kb,253,8,2017-08-12 22:16:01,Saturday,SATURDAY NIGHT WRIST ! . #cavesduroy50 #50thanniversary #club #party#sainttropez #djjacke #video: @petrusmachado,True,1547,_paulinedpt_ tofmartini jesson_cht luvienz cinthiapazin djeebee94 michelepivetta86 johanna.k.official muagunay ,cavesduroy50 50thanniversary club party djjacke video ,petrusmachado ,true
1581515820920352454,BXyrEKIni7G,186,2,2017-08-14 22:56:39,Monday,Reach out and touch faith... . #cavesduroy50 #50thanniversary #party #club #sainttropez . #video: @damien_lvn_,True,1220,manon_mtn plyswan suemwyatt champagne.lady rentikhrentik eevd_8 jackyjackym marcelo_martins_oliveira eddycallmusic adamianaraik ,cavesduroy50 50thanniversary party club sainttropez video ,damien_lvn_ ,true
1339417661188436659,BKWkUQtBXKz,122,0,2016-09-14 22:10:49,Wednesday,Season is not over yet ! Friday + Saturday = "BIG PARTY" at Les Caves du Roy... Are you ready ?!! #sainttropez #lescavesduroy #party #frenchriviera #club #summer Photo: @ameliecdx,False,N/A,reinaolga_beachwear __kaishi__ oscarmikail_interiores rickybossi djillmouche elbee_oldaacount sparklingchuvi cavesduroy stellapastirik distinct.online ,sainttropez lescavesduroy party frenchriviera club summer ,ameliecdx ,false
1746001300113243802,Bg7Cu6Gnr6a,583,8,2018-03-29 21:39:56,Thursday,Tomorrow Doors Open At Midnight ! #friday #saturday #sunday #3daysofhappiness,False,N/A,morgane_rgo manu_roche deniseschitz celian.fauveau carla___bc julianadeoliveira17 lea.tumminelli sebvals camille.vchl alexstrazzeri ,friday saturday sunday 3daysofhappiness ,,true
1325482804381137658,BJlD5Z_Brr6,79,1,2016-08-26 16:44:45,Friday,"Friday I'm In Love !" TONIGHT at Les Caves du Roy !  #friday #sainttropez #lescavesduroy #party #frenchriviera #club #summer Photo: @philippcaesar,False,N/A,cristianoacerbi matvey_bilunov frenchrivieraconnect bennibensen85 cavesduroy etiennevignal nicolodega jdn_gall _____doublet_____ sparklingchuvi ,friday sainttropez lescavesduroy party frenchriviera club summer ,philippcaesar ,true
1005793007699808484,31S2ldhNDk,51,1,2015-06-12 14:38:11,Friday,One more special night!✨ #party #sttropez #lescavesduroy #instamood #friends #summer #picoftheday #athinaonassishorseshow #clubbing #byblos #palace#Repost 👏🏻 @lesliecabanes 👏🏻,False,N/A,juliaduhamel ludimins annemonwenpin serenity_the1 allandelplanque83 lesmanoirstourgeville vanoanna 78_alex camilla.bcn regeil68 ,party sttropez lescavesduroy instamood friends summer picoftheday athinaonassishorseshow clubbing byblos palace ,lesliecabanes ,true
1398830390630119183,BNppNQ2h3cP,176,3,2016-12-05 21:33:18,Monday,PrincessParis!  #lescavesduroy #sainttropez #frenchriviera #party #parishilton Photo: @notyourbasictrip,False,N/A,styleinbelgradee lbcdl sof_vp domainemontaigne aanais_m83 juliettesorrente eva_patrone and_malortigue melvinb_83 ,lescavesduroy sainttropez frenchriviera party parishilton ,notyourbasictrip ,true
1533671409738273506,BVIsgV7n1Li,380,2,2017-06-09 22:38:20,Friday,The Night Is Just Beginning !... JOIN US ! . #lescavesduroy #sainttropez #club #party #frenchriviera #50thanniversary,False,N/A,marielinnap sandrozaman stephanelafaye djeebee94 demeusephil xavierberujon julieetlestropeziennes calu1965 irouven lisevdtogt ,lescavesduroy sainttropez club party frenchriviera 50thanniversary ,,true
1576392161234860425,BXgeFGNHTmJ,312,4,2017-08-07 21:16:51,Monday,Cool Girls Never Sleep . #doorsopenatmidnight #lescavesduroy #club #sainttropez #summer . Photo: @missdash3,False,N/A,dessykov jimmy.de.almeida joshwoitas123 stclairpinede the_situa tofmartini fixro8 alicebr10 angelomatias83 chippepper ,doorsopenatmidnight lescavesduroy club sainttropez summer ,missdash3 ,true
1661959838925529303,BcQd6sGHyDX,224,4,2017-12-03 22:44:33,Sunday,Feeling A Little Blue ! 🔵 🔷 🔹 #lescavesduroy #sainttropez #club #frenchriviera,False,N/A,capucinesassier manasainttropez corentinvrg thomaneck 63timmi olivier.gatti tofmartini _julie72 francinegssns antonykoning ,lescavesduroy sainttropez club frenchriviera ,,true
1030972951950053606,5OwG_-BNDm,64,5,2015-07-17 08:26:14,Friday,About last Night! ...amazing Night!  #djjacke #georgebenson #theavener #aftershow #mythical #amazing #sttropez #lescavesduroy #love #clubbing #byblos #palace #love,True,0,florianauv ingridbistacoa clubadventures choutey sir_henri_13 deco.neuse tokerlevent annemonwenpin lesmanoirstourgeville ___clemclem___ ,djjacke georgebenson theavener aftershow mythical amazing sttropez lescavesduroy love clubbing byblos palace love ,,true
1434333096735817017,BPnxloghj05,158,2,2017-01-23 21:10:51,Monday,"LES CAVES GIRLS"  #lescavesduroy #sainttropez #club #party #girl Photo: @cristinasignoroni,False,N/A,roberttchenguiz montresprestigeprovence cengizguel 8alan4 stephanelafaye marionhuuet manon.pivetta lareservestjeandeluz meierequestrian beps01 ,lescavesduroy sainttropez club party girl ,cristinasignoroni ,true
1560485123862822474,BWn9PPNH_5K,180,5,2017-07-16 22:32:24,Sunday,Psychedelic/Blue/Sunday . #lescavesduroy #sainttropez #party #summer,True,1060,jenniii_filipponi brunosauter thierry_novella eryl.srx nicolas.c98000 benoit_tintane yoannboghossian djorkaeffdenis rentikhrentik julia_516 ,lescavesduroy sainttropez party summer ,,true
1458192253163389261,BQ8iiDgB8FN,97,6,2017-02-25 19:14:44,Saturday,ARE YOU CAVES DU ROY ? Share your best photos &amp; memories over the past 50 years at Les Caves du Roy with tag: #cavesduroy50 #gracejones,False,N/A,stephanelafaye siennachauderac eva_patrone fernandobau cyrilkara scollado_ marcolugli1186 berlan308 cavesduroy isauez ,cavesduroy50 gracejones ,,true
1288571047389714996,BHh7IpbhFo0,154,0,2016-07-06 18:27:40,Wednesday,TONIGHT !... direction : Les Caves du Roy !  #sainttropez #lescavesduroy #party #frenchriviera #clubber #summer2016 Photo: @lamodista,False,N/A,mannino_just jc.murray 8alan4 haydeelozada thisissttropez marcohanna fancyjancyx emma_gonzalezz marcolugli1186 personenisainttropez ,sainttropez lescavesduroy party frenchriviera clubber summer2016 ,lamodista ,false
1553218240079884782,BWOI8KSnnHu,178,3,2017-07-06 21:54:24,Thursday,"The dance most of all" . #lescavesduroy #50thanniversary #sainttropez #video: @ulrichlaine,True,1419,scollado_ angella7777 pvm16 harry2tennant muse_hotel andreah_ry _marcld_ iakral ombri.c alicia_das ,lescavesduroy 50thanniversary sainttropez video ,ulrichlaine ,true
1492954053368791653,BS4Cc0xBsJl,248,4,2017-04-14 18:20:13,Friday,ONE NIGHT IN 1997 - #cavesduroy50,False,N/A,jc.murray paulteker andreas_djorkaeff sophieferreiradupuy83 michelepivetta86 fabulousag boutique_lp_roma sixtineginon djorkaeff_misha vanessagr83 ,cavesduroy50 ,,true
1336433933155694371,BKL95Tbhfcj,104,3,2016-09-10 19:22:41,Saturday,Saturday Night Fever... TONIGHT at Les Caves du Roy Saint-Tropez ! Join us... #sainttropez #lescavesduroy #party #frenchriviera #club #summer #france Photo: @bazziusa,False,N/A,17_sn finleywhw vanina.b2a romain.f83 _____doublet_____ jdn_gall eziopoldi alytie03 cavesduroy mrnexm ,sainttropez lescavesduroy party frenchriviera club summer france ,bazziusa ,true
1473440205137845642,BRytg9ZBR2K,120,2,2017-03-18 20:09:41,Saturday,Good music for good people !  #lescavesduroy #sainttropez #travel #party #club #girl Photo: @9michou6,False,N/A,adriaticseafish lutzau9 margauxdrs angella7777 lou_leclair djkeidy montanamtl jl.999 cavesduroy ,lescavesduroy sainttropez travel party club girl ,9michou6 ,true
1529290624480953529,BU5IbhuhcS5,227,5,2017-06-03 21:34:30,Saturday,"ADDICTED TO PARTY" &gt; Doors open at midnight till late ! . #lescavesduroy #sainttropez #party #club #50thanniversary #frenchriviera,False,N/A,cinqmaastricht 78_alex jocelynalmeyda rentikhrentik bastienbil njosepha la_ly_lux fvmdc julia_516 errejotaporai ,lescavesduroy sainttropez party club 50thanniversary frenchriviera ,,true
1526275493560006461,BUua3mPBzc9,315,13,2017-05-30 17:43:58,Tuesday,Five decades of artistic creation. Five limited edition Methuselahs. Designed to celebrate the 50th anniversary of Byblos &amp; Les Caves du Roy Saint-Tropez. . This material is not intended to be seen by persons under the legal purchasing / drinking age in their country of residence or residing in a country restricting the advertising of alcoholic beverages. Enjoy Responsibly. . @domperignonofficial @cavesduroy @byblossttropez . . #domperignon #byblos50 #cavesduroy50,True,1407,mike_aco alizemachet mirceasg joshwoitas123 alexxperrin demeusephil pauline04860 hoteldoncesar carl_kngjns chloemartenat ,domperignon byblos50 cavesduroy50 ,domperignonofficial cavesduroy byblossttropez ,true
1595194975289411342,BYjRWDZnQcO,292,9,2017-09-02 19:54:41,Saturday,Life is a Party ! Doors open at midnight ! Come enjoy... . . #lescavesduroy #club #sainttropez #enjoy #video: @nadegelaurens,True,1775,patsbydj therealdavidrounick pancho_zoch alicia.graphiste ccuervo.la pedromottaarquiteto max_bzk jaynefx sky_dacosta sacha_lm ,lescavesduroy club sainttropez enjoy video ,nadegelaurens ,true
1705347888006825740,BeqnN5rHAcM,565,13,2018-02-01 19:28:51,Thursday,Summer's in the air &amp; baby  heaven's in your eyes ! 💙 #opening #march30 #lescavesduroy #club #sainttropez #frenchriviera,False,N/A,__petitprince__ mpum_mpum sepiparsi jeremydebrez marcelonunespereira elena_di_borbone giovannirichard98 wolfordcannes goldengus86 calista_cartier ,opening march30 lescavesduroy club sainttropez frenchriviera ,heaven's ,true
1511812111583864134,BT7CRsGFuVG,203,6,2017-05-10 18:47:49,Wednesday,#OpEnInGsOoN,False,N/A,carlacavalli299 ninolam82 fabricedoyen davidred83 romain_pelletti giovanni_swich007 sophie_pp enzo_csrd tristan_amd pier_31_sttropez ,OpEnInGsOoN ,,true
1748772396059239668,BhE4zqUHqT0,556,3,2018-04-02 17:25:36,Monday,What an incredible weekend ! Thanks a lot clubbers ! &gt; See you on Fridays + Saturdays from April 27 to October 6. &gt; Every night from June 28 to September 1.,False,N/A,chpiconnet d_lfine bmcleod33333 ma.moret ricoudu06 osi4102 mariannee__m arthur83120 fmoreno003 drrafaeltimbo ,,,true
1326323493889344270,BJoDDDGh4MO,89,1,2016-08-27 20:35:03,Saturday,Saturday Night Fever... Tonight !  #sainttropez #lescavesduroy #party #frenchriviera #club #summer Photo: @lauramay_22,False,N/A,camille.vgx jdn_gall dan_laheyne_ louismartineau elbee_oldaacount sparklingchuvi rickybossi bennibensen85 cavesduroy manumogi ,sainttropez lescavesduroy party frenchriviera club summer ,lauramay_22 ,true
1361054311920335170,BLjb69-BnlC,191,2,2016-10-14 18:38:59,Friday,Currently scheming few surprises for you ! Remember this outlook... #nolonger #lescavesduroy #sainttropez #club photo © Christian Voigt,False,N/A,etiennevignal selinella quttuman kirstythefitnesschick ann_sogms ___clemclem___ johanna.k.official alicja_h marionhuuet dfeing ,nolonger lescavesduroy sainttropez club ,,true
1316742762552792946,BJGApDuhpdy,89,2,2016-08-14 15:19:50,Sunday,Party Girls  don't get hurt !  #sainttropez #lescavesduroy #party #frenchriviera #club #summer #france #girl Photo: @carlasaintm,False,N/A,clubvivanova vottomatteo ecastroaguirre byblossttropez djillmouche ms_morenuk lilougr pilondemediterrane la_illi lucasmrt1 ,sainttropez lescavesduroy party frenchriviera club summer france girl ,don't carlasaintm ,true
1274754983405081045,BGw1udJhNHV,95,1,2016-06-17 16:57:37,Friday,Are you ready for TONIGHT ?... Welcome back to Saint-Tropez !  #lescavesduroy #weekend #sainttropez #nightclub #summer2016 #party,True,714,boriskharlamoff michelepivetta86 mattdecb johanjansen040777 karstenfaerber bennibensen85 irusyap cavesduroy silvanoimperial ,lescavesduroy weekend sainttropez nightclub summer2016 party ,,true
1574302514296117406,BXZC8u1n9ie,199,9,2017-08-05 00:05:05,Saturday,Come on  the night's young ! . #lescavesduroy #club #nightlife #sainttropez #frenchriviera #video : @so_zit,True,1309,alexandre201200 lounaperso83 laghina insta_philou67 iammavrix _marcant_ julienmachet totified vicliot noebasone ,lescavesduroy club nightlife sainttropez frenchriviera video ,the so_zit ,true
1550320637793222103,BWD2Gf3nz3X,562,6,2017-07-02 21:57:23,Sunday,DOORS OPEN AT MIDNIGHT ! . #sainttropez #lescavesduroy #sundayparty,False,N/A,sebswie damientedeschi maeva.laligant julieetlestropeziennes unjourapeyrassolsttropez claraeliot peresseflorent loicpodogorska1 lucytremel willems_steven_ ,sainttropez lescavesduroy sundayparty ,,true
1678606121824113145,BdLm1_JH1H5,274,18,2017-12-26 22:03:44,Tuesday,In the midst of winter i found within me an invincible summer… ✨ #cantwait #march30 #lescavesduroy #sainttropez #2018season 🙌 #video: @andrew.tupper,True,1997,mscrbn thomas_muller1105 tofmartini elomelo ben.tourrette bressonetienne ludismart roberttchenguiz jennytham1 bmcleod33333 ,cantwait march30 lescavesduroy sainttropez 2018season video ,andrew.tupper ,true
1690851511487092254,Bd3HH2-HtYe,581,17,2018-01-12 19:27:09,Friday,JUNIOR : "L’homme de la situation / Man of the hour". 🎶 #junior #directeur #opening30mars,False,N/A,jaspermventer monialunini rentparadise baby.blue9 caseneuvemaxicatamaran blaiseantoine itchysticky fernandobau nico06610_ _chloebrunet ,junior directeur opening30mars ,,true
1398050639728417646,BNm36ZPBRtu,161,3,2016-12-04 19:44:05,Sunday,Tropezian Night Party !  #lescavesduroy #sainttropez #party #dj #frenchriviera #video : @ineeescm,True,776,e.introz victoriavesignie jesson_cht arthurjehanno frederikabas hayron.michelet nikkicosmetics mickaelfranzoni caledonien98 karstenfaerber ,lescavesduroy sainttropez party dj frenchriviera video ,ineeescm ,true
1465532805374389456,BRWnlJfBazQ,161,7,2017-03-07 22:19:06,Tuesday,Crazy nights make the best memories !... #lescavesduroy #sainttropez #party #club #cotedazur #igers #groupefloirat #video : @simonepiacenza,True,821,carolinedg _ocean_drive___ iamarimaxell quentinmarchica sacha_lm benoit_boitard bettinabadalian krasolya rickybossi boutique_lp_roma ,lescavesduroy sainttropez party club cotedazur igers groupefloirat video ,simonepiacenza ,true
1461094659295361584,BRG2dn2hTow,175,6,2017-03-01 19:21:18,Wednesday,Keep calm ´cause Party is coming... #lescavesduroy #sainttropez #club #party #happy #cotedazur #frenchtouch,False,N/A,kbaybarza alessio_cursi mat_16b lareservestjeandeluz nicolosr rodmouche fancyjancyx bouedi djjack.e louismartineau ,lescavesduroy sainttropez club party happy cotedazur frenchtouch ,,true
1319124891337196850,BJOeRmCh4Uy,87,4,2016-08-17 22:12:42,Wednesday,SO................! #sainttropez #lescavesduroy #party #frenchriviera #club #summer #video by @anna_hig,True,734,ulquiorra_cuatro marg_ritaa russo_gnni arnebatenburg aklawer louisedepardieu sarahleneve 88fil cavesduroy rickybossi ,sainttropez lescavesduroy party frenchriviera club summer video ,anna_hig ,true
1315421412835760595,BJBUM46BJnT,120,4,2016-08-12 19:34:33,Friday,Summer 2016 at Les Caves du Roy !  #sainttropez #lescavesduroy #party #frenchriviera #club #summer Video: @toonybitchy,True,871,carsinsttropez benjaminthomasphillips emma_gonzalezz helopaysage lucasmrt1 tiphanie_vcrs silvanoimperial stellapastirik cavesduroy s9_oaa ,sainttropez lescavesduroy party frenchriviera club summer ,toonybitchy ,true
1432873296105763140,BPilqvOhvFE,157,5,2017-01-21 20:50:29,Saturday,Can't wait to PARTY !  #lescavesduroy #sainttropez #party #clubbing #video: @carolinaclo86,True,964,marcelo_martins_oliveira michelepivetta86 marionhuuet milantoth007 thomaneck flockyouu midalmina michaelcanitrot torquenstein nevy_roussange ,lescavesduroy sainttropez party clubbing video ,carolinaclo86 ,true
1301409346391250339,BIPiOfHBhWj,123,7,2016-07-24 11:35:05,Sunday,Awesome Party yesterday... ! See you tonight !  #openeveryday #sainttropez #lescavesduroy #party #frenchriviera #clubbing #summer2016 @djjack.e,True,920,djillmouche lucasmrt1 carsinsttropez bennibensen85 marionlico gwyntbalolong joao_freitas rickybossi charlesmartinet dudubrandao ,openeveryday sainttropez lescavesduroy party frenchriviera clubbing summer2016 ,djjack.e ,true
1323470970857953053,BJd6dYAh5cd,95,0,2016-08-23 22:07:35,Tuesday,It's a party all the time !!! #sainttropez #lescavesduroy #party #frenchriviera #club #summer #Video: @perini.natali,True,769,paloma_beach jordan_drf filo1893 raoul_ed ninolam82 houda.zy torquenstein jkyl3 carsinsttropez cavesduroy ,sainttropez lescavesduroy party frenchriviera club summer Video ,perini.natali ,false
