ID,SHORTCODE,LIKES,NUM_COMMENTS,DATE,WEEKDAY,CAPTION,IS_VIDEO,VIDEO_VIEW_COUNT,USERS_LIKED,TAGS,MENTIONS,HAS_COMMENTS
991338073369661465,3B8LmzhNAZ,36,3,2015-05-23 15:58:49,Saturday,#FF About last Crazy Night! ✨✨✨ @o.h.s.u.s.a.n.n.a.h 👍🏻 #sttropez #clubbing #thisissttropez #night #friends #amazingplace #mythical #djjacke #dj #palace #byblos #france,False,N/A,cu_488 mlambs vania_sanchezd juliaduhamel kimkfh mariecano3 charlotte_lemonrock imjordanjoseph ,FF sttropez clubbing thisissttropez night friends amazingplace mythical djjacke dj palace byblos france ,o.h.s.u.s.a.n.n.a.h ,true
999478583875653766,3e3HoAhNCG,31,5,2015-06-03 21:32:33,Wednesday,#FF ✨ About that Crazy last Night ✨ See you next week-end! #Repost @feeeibe 🙌🏻 ・・・ #iminlovewiththecoco #cavesduroy #sttrop #sttropez #france #cotedazur #clubbing #alittelpartyneverkillednobody #byblos #crazynight #mythical #love,True,0,marcelo_martins_oliveira jayclothing jack_tribeca bodvarrose pierluigificarra teod stef_710 annemonwenpin petiteg_bags julienalbertini ,FF Repost iminlovewiththecoco cavesduroy sttrop sttropez france cotedazur clubbing alittelpartyneverkillednobody byblos crazynight mythical love ,feeeibe ,true
999483774578512156,3e4TKOhNEc,49,3,2015-06-03 21:42:52,Wednesday,Amazing people makes amazing place!#amazingpic #cavesduroy #sainttropez #night #party #clubbing #love #byblos #mythical #bestplace #amazing  #Repost ✨ @duttysow 👌🏻,False,N/A,annemonwenpin charliethecookie fracarlomagno elisa_palieri mathioutrt marieeuher cu_488 nastadls ,cavesduroy sainttropez night party clubbing love byblos mythical bestplace amazing Repost ,duttysow ,true
1005793007699808484,31S2ldhNDk,51,1,2015-06-12 14:38:11,Friday,One more special night!✨ #party #sttropez #lescavesduroy #instamood #friends #summer #picoftheday #athinaonassishorseshow #clubbing #byblos #palace#Repost 👏🏻 @lesliecabanes 👏🏻,False,N/A,juliaduhamel ludimins annemonwenpin serenity_the1 allandelplanque83 lesmanoirstourgeville vanoanna 78_alex camilla.bcn regeil68 ,party sttropez lescavesduroy instamood friends summer picoftheday athinaonassishorseshow clubbing byblos palace ,lesliecabanes ,true
1019748541100511442,4m3-UwhNDS,74,10,2015-07-01 20:45:20,Wednesday,Welcome to Saint-Tropez! Every day during summer!! Meooooooooow !!!!! #southoffrance #sainttropez #instagood #instachatte #cavesduroy #paladium #converse #clubbing #lescavesduroy #summer #mythical #byblos #bestplace #partytime #repost from ✨@loulouberloue✨ 👈🏻👍🏻,True,0,kellame alexis_forgeas garance.wery pierluigificarra feeeibe fernandaparodi djkeza thisissttropez ,southoffrance sainttropez instagood instachatte cavesduroy paladium converse clubbing lescavesduroy summer mythical byblos bestplace partytime repost ,,true
1025397709999493217,468cjSBNBh,31,1,2015-07-09 15:49:14,Thursday,Last week-end  JoeyStarr came to visit us!  #joeystarr #clubbing #night #lescavesduroy #bestplace #amazing #byblos #sttrop #sttropez #yolo #djjacke #allnightlong,True,0,alexis_forgeas charlotte_lemonrock frenchotels cavesduroy kimkfh alexlonz marcelo_martins_oliveira annemonwenpin lesmanoirstourgeville ,joeystarr clubbing night lescavesduroy bestplace amazing byblos sttrop sttropez yolo djjacke allnightlong ,JoeyStarr ,true
1030972951950053606,5OwG_-BNDm,64,5,2015-07-17 08:26:14,Friday,About last Night! ...amazing Night!  #djjacke #georgebenson #theavener #aftershow #mythical #amazing #sttropez #lescavesduroy #love #clubbing #byblos #palace #love,True,0,florianauv ingridbistacoa clubadventures choutey sir_henri_13 deco.neuse tokerlevent annemonwenpin lesmanoirstourgeville ___clemclem___ ,djjacke georgebenson theavener aftershow mythical amazing sttropez lescavesduroy love clubbing byblos palace love ,,true
1034157731654980384,5aEPpNBNMg,101,2,2015-07-21 17:53:50,Tuesday,About Yesterday night... Mythical Summer 2015!  #надоподкачаться 😂 #Repost @timatiofficial #lescavesduroy #stallone #night #clubbing #summer #sttropez #byblos #amazingplace #bestplace #djjacke #thisissttropez,False,N/A,_marcld_ ivan_sharpilov alicja_h bendr_app lucasmrt1 saint_tropez83 bottlebooking sir_henri_13 julienalbertini ,надоподкачаться Repost lescavesduroy stallone night clubbing summer sttropez byblos amazingplace bestplace djjacke thisissttropez ,timatiofficial ,true
1043711163927679297,58AcYWBNFB,48,2,2015-08-03 22:14:48,Monday,✨Welcome back to St-Tropez!✨ #lescavesduroy #djjacke #sttropez #welcometosttropez #love #clubbing #mythical #bestplace #summer #amazingplace,False,N/A,farah_peter clara.hg annignacaprez thisissttropez ninolam82 kmjal99 timotheedebeaumont joao_freitas vicmern elisa_palieri ,lescavesduroy djjacke sttropez welcometosttropez love clubbing mythical bestplace summer amazingplace ,,true
1044343154876404449,5-QJDyBNLh,87,8,2015-08-04 19:10:27,Tuesday,✨100!✨ amazing night! 💯 #cristalroederer #champagne #amazingnight #sttropez #clubbing #bestplace #byblos #palace #summer #summer2015,True,0,annemonwenpin anastasia_chst ttamayojr sacart15 florianauv alexpomeroy nicolodega marcelo_martins_oliveira ,cristalroederer champagne amazingnight sttropez clubbing bestplace byblos palace summer summer2015 ,,true
1050921093776593743,6VnyqxhNNP,60,10,2015-08-13 20:59:38,Thursday,Magic! @cavesduroy 🔥🔥🔥 #party #friends #trip #holidays #nightout #amazing #Repost @noemieskr #byblos #sttropez #palace #clubbing #holidays #love #night,True,0,la_pippy77 ombri.c laureannevilain noemiskr romankenii fancyjancyx gervasiyakhelik4p harmoniejeanvoine leonorshka ,party friends trip holidays nightout amazing Repost byblos sttropez palace clubbing holidays love night ,cavesduroy noemieskr ,true
1054522221009359737,6ial93BNN5,49,5,2015-08-18 20:14:26,Tuesday,goin down for real! #cavesduroy #sttropez #clubbing #night #mythical #florida #dj #amazingnight #summer2015 #yolo #lescavesduroy,True,0,kleiderschrank_men bespokeyyc thisissttropez margauxdrs lilamarienoiret noreason83 hybris_b djorkaeffdenis stefaniefusi oceanelourot ,cavesduroy sttropez clubbing night mythical florida dj amazingnight summer2015 yolo lescavesduroy ,,true
1055086137926013027,6ka0CahNBj,109,5,2015-08-19 14:54:50,Wednesday,A little party never killed nobody 💫 ✨🙌🏻✨ #sttropez #lescavesduroy #Repost @stefaniefusi #cavesduroy #clubbing #mythical #night #besttime #summer2015 #yolo #dj #amazingnight #sainttropez #party,False,N/A,vincentwolff lesliecabanes emojimajeur oceanelourot salometringali romdff jordonwarez joao_freitas shutyourtrapworld durso_official ,sttropez lescavesduroy Repost cavesduroy clubbing mythical night besttime summer2015 yolo dj amazingnight sainttropez party ,stefaniefusi ,true
1056738443763438041,6qSgQJBNHZ,92,2,2015-08-21 21:37:40,Friday,Up in da Caves #cavesduroy #club #indaclub #sttropez #mythical #byblos #nightlife #summer #Repost @marcolugli1186,False,N/A,morris2012 lety_ferrero annemonwenpin stefaniefusi wazpi cyfly08 margauxdrs mariacarolinafc thisissttropez juliaduhamel ,cavesduroy club indaclub sttropez mythical byblos nightlife summer Repost ,marcolugli1186 ,true
1066844001086525492,7OMPdzhNA0,80,0,2015-09-04 20:15:37,Friday,Still #onfire Open Fridays &amp; Saturdays #summer #cavesduroy #clubbing #night #sttropez #byblos #palace #mythical #bestplace #besttime #love #djjacke  #Repost @djjack.e,False,N/A,bodvarrose marine.mcr clara.hg jennypeps21 fancyjancyx wazpi brigidgazzo tiphanie_vcrs domciulka ,onfire summer cavesduroy clubbing night sttropez byblos palace mythical bestplace besttime love djjacke Repost ,djjack.e ,false
1076862392425829157,7xyKP0hNMl,98,4,2015-09-18 16:00:22,Friday,Keep it colored!! Waiting for you Tonight! #cavesduroy #beautifulpeople #sttropez #thisissttropez #clubbing #yolo #byblos #bestplace #love #keepitcolored #Repost @stef.renault WELCOME TO ST-TROPEZ,False,N/A,elisa_palieri personenisainttropez 78_alex angiimartin oceanelourot camguillec feelingsndquotes florianauv corrylyndsay ,cavesduroy beautifulpeople sttropez thisissttropez clubbing yolo byblos bestplace love keepitcolored Repost ,stef.renault ,true
1081050850664960281,8AqgViBNEZ,67,9,2015-09-24 10:42:05,Thursday,Party at Les Caves du Roy! Waiting for You this week-end!  #ThisIsStTropez #VIP #champagne #party #lescavesduroy #sttropez #thisisthelife #luxury #cotedazur #club #clubbing ✨#Repost @chezemily93✨,True,0,all_access_soflo fedeshanty tiphanie_vcrs vivocars michelle_ccolin charliethecookie marcelo_martins_oliveira thomas_vilaceca mamba1986 bennibensen85 ,ThisIsStTropez VIP champagne party lescavesduroy sttropez thisisthelife luxury cotedazur club clubbing ,chezemily93✨ ,true
1084986543250395860,8OpYM4hNLU,94,3,2015-09-29 21:01:36,Tuesday,Save the date ! SPECIAL CLOSING PARTY ! Saturday 3rd OCTOBER !!!... #lescavesduroy #sttropez #party #djjacke #igers #picoftheday #instagood photo: @tillyfleming99,False,N/A,sergiofracchia alexpomeroy kakoperroy oceanelourot juliettesorrente byblossttropez camguillec marion_lacaze cavesduroy ,lescavesduroy sttropez party djjacke igers picoftheday instagood ,tillyfleming99 ,true
1103058365539733756,9O2b08hND8,137,2,2015-10-24 19:27:05,Saturday,Souvenirs... at Les Caves du Roy St. Tropez with DJ Jack.e  Mike Tyson and Bruce Willis. --------------- #lescavesduroy #sttropez #club #mythical #miketyson #brucewillis #party #igers,False,N/A,florralubrano ombri.c stella_gth chrissmith888 1tomanderson quentinbommier mamba1986 paulabernieri cotillonjunior haydeelozada ,lescavesduroy sttropez club mythical miketyson brucewillis party igers ,Mike ,true
1106721011250024902,9b3OVlBNHG,87,5,2015-10-29 20:44:07,Thursday,Souvenirs at Les Caves du Roy St. Tropez : DJ Jack.e and Avril Lavigne... #cavesduroy #hotel #mythical #party #france #bestplace #igers #placetobe #groupefloirat #avrillavigne,False,N/A,_bbrando_ kleiderschrank_men thisissttropez nicojamet byblossttropez camguillec cyfly08 iamarimaxell cavesduroy ,cavesduroy hotel mythical party france bestplace igers placetobe groupefloirat avrillavigne ,,true
1158721747143675909,BAUm0o0BNAF,110,0,2016-01-09 14:40:17,Saturday,,False,N/A,ninolam82 haydeelozada ivan.roncevic lorenzong18 lrd_sf dewitt_850__darwin florianauv bennibensen85 lareservestjeandeluz cavesduroy ,,,false
1163793167829749792,BAmn7hYhNAg,136,13,2016-01-16 14:36:18,Saturday,Save the date ! Les Caves du Roy Saint-Tropez Opening party 2016 : MARCH 25th ! 💜  #party #partying #fun #instaparty #instafun #instagood #bestoftheday #crazy #friend,False,N/A,___clemclem___ eileenak farah_peter marinellacucciardi alicia.be coraliessn_ franceschinilola dupuy_elisa eniram1994 lisa_carer ,party partying fun instaparty instafun instagood bestoftheday crazy friend ,,true
1174787872847614103,BBNr1iXhNCX,92,5,2016-01-31 18:40:49,Sunday,Opening party : 25th March 2016 !! Get the party started !  #openingseason #sttropez #france #frenchriviera #cotedazur #byblos #lescavesduroy #party #club,False,N/A,principatodimonaco diogo.cr mlambs manon_salce kakoperroy kirstythefitnesschick dilettadam fouedallik cu_488 cavesduroy ,openingseason sttropez france frenchriviera cotedazur byblos lescavesduroy party club ,,true
1187205491051516487,BB5zRqhhNJH,125,9,2016-02-17 21:52:24,Wednesday,Save the date ! OPENING PARTY... March 25th to 27th !  #cavesduroy #sttropez #party,False,N/A,salome.kriegbaum yleiht_m lucasmrt1 martin_cdo marcolugli1186 lrd_sf hugobayle leonorshka colomas_chris clara.hg ,cavesduroy sttropez party ,,true
1203838336188600527,BC05JarhNDP,132,5,2016-03-11 20:38:54,Friday,Kate and our Jack.e in the mix !  #openingsoon #katemoss #club #party #sainttropez #france #frenchriviera #cotedazur #hotel #byblos #instagram #icon,False,N/A,sir_henri_13 florianauv maxime_chab armyanski_ adavmaria teod michaelawesterlund davidferrua _bbrando_ stonesoflovers ,openingsoon katemoss club party sainttropez france frenchriviera cotedazur hotel byblos instagram icon ,,true
1206110515320115911,BC89x-ZhNLH,113,7,2016-03-14 23:53:19,Monday,Coming soon !!! ✨  #grandopening25thmarch #sainttropez #frenchriviera #cotedazur #party #club #byblos #lescavesduroy photo: @ferrosapy,False,N/A,salometringali djskyewalker bobbymisner die6ofernandes julo_chira_effacer oliviamaecunningham anthonylommere 1ord_arta suprimer_0510_ ,grandopening25thmarch sainttropez frenchriviera cotedazur party club byblos lescavesduroy ,ferrosapy ,true
1214816081513075583,BDb5MouBNN_,188,6,2016-03-27 00:09:43,Sunday,Welcome back to Saint-Tropez !  #sainttropez #frenchriviera #cotedazur #cavesduroy #party #welcomebacktosainttropez,False,N/A,anyssabd natahoegen karstenfaerber phil_monsour coraliessn_ wodasalome deschesne_d lisa_carer vincentwolff acoolman_navy ,sainttropez frenchriviera cotedazur cavesduroy party welcomebacktosainttropez ,,true
1234984757310575150,BEjjBfyhNIu,104,1,2016-04-23 20:01:17,Saturday,Join us TONIGHT !  #sainttropez #cavesduroy #party #club frenchriviera #cotedazur #byblos photo: @ivan.roncevic,False,N/A,julicosimoes lilougr die6ofernandes rgcoimbra joao_freitas alexgrause silvanoimperial neil__debarre yassirhani fernandobau ,sainttropez cavesduroy party club cotedazur byblos ,ivan.roncevic ,true
1235645221887594596,BEl5MhXBNBk,118,3,2016-04-24 17:53:30,Sunday,Come say Hi tonight... Party weekend !  #sainttropez #hotel #rivea #frenchriviera #cotedazur #byblos #palace #luxury #france #room photo: @alessandradifeo,False,N/A,pixclem elena_r9 emmadescours lrd_sf ingridmtrn lucasdcmps alexfleche83 virginiacalissano cavesduroy thibautvanden ,sainttropez hotel rivea frenchriviera cotedazur byblos palace luxury france room ,alessandradifeo ,true
1244318967582216974,BFEtYIiBNMO,155,3,2016-05-06 17:06:41,Friday,The famous DJ JACK.E "in the mix" all the weekend at Les Caves du Roy ! JOIN US TONIGHT !  #lescavesduroy #sainttropez #frenchriviera #cotedazur #france #weekend #party #club @djjack.e,False,N/A,harmoniejeanvoine williammelussi annignacaprez maelan_domenge alesinha lou_leclair die6ofernandes _bbrando_ romdff ,lescavesduroy sainttropez frenchriviera cotedazur france weekend party club ,djjack.e ,true
1245176240613413514,BFHwTGQhNKK,119,2,2016-05-07 21:29:56,Saturday,Join us !🎉 #cavesduroy #sainttropez #frenchriviera photo: @pierrebronzetti,False,N/A,personenisainttropez jldellanoce renan_brun ingridmtrn dan_laheyne_ pierrot83420 juniorsainttropez azad.dubois guipereirajlle cavesduroy ,cavesduroy sainttropez frenchriviera ,pierrebronzetti ,true
1246497169557737971,BFMcpJNBNHz,111,4,2016-05-09 17:14:23,Monday,About last week-end at Les Caves du Roy...! #welcomebacktosainttropez #lescavesduroy #sainttropez #party Credit photos - danielphotographe.com,False,N/A,cavesduroy bernardsylv1 karstenfaerber lou_leclair franceschinilola lbcdl randomreed pacirob hollybeezy_ ,welcomebacktosainttropez lescavesduroy sainttropez party ,,true
1249354356210586262,BFWmSrohNKW,118,2,2016-05-13 15:51:06,Friday,Les Caves du Roy Marathon &gt; Friday &gt; Saturday &gt; Sunday with DJ Jack.E in the mix !  #caesduroy #sainttropez #club #frenchriviera #cotedazur #france #party photo - @vale.zzz,False,N/A,lbcdl nicolodega bennibensen85 giacomo.d.heldens pierrebronzetti azad.dubois thea.deschps florralubrano hugodarniche jbcoulomb ,caesduroy sainttropez club frenchriviera cotedazur france party ,vale.zzz ,true
1249924310634910701,BFYn4nDhNPt,96,2,2016-05-14 10:43:30,Saturday,What are you doing TONIGHT ?  #lescavesduroy #sainttropez #frenchriviera #cotedazur #france #weekend photo - @aubinjullian,False,N/A,nicolodega camguillec belle.teodora idapryser thisissttropez heddan44 margauxdrs hugob0y a.taylored.life yanakintola ,lescavesduroy sainttropez frenchriviera cotedazur france weekend ,aubinjullian ,true
1250802765605949962,BFbvn0ABNIK,101,0,2016-05-15 15:48:50,Sunday,"The calm before the storm party"... Weekend is not over ! Join us TONIGHT !  #lescavesduroy #sainttropez #frenchriviera #party #club #djjacke #weekend,False,N/A,byblossttropez joao_freitas ombri.c charliethecookie dilettadam sophialou24 cavesduroy robysgambaro alesinha michelepivetta86 ,lescavesduroy sainttropez frenchriviera party club djjacke weekend ,,false
1252181849632199649,BFgpMIFhNPh,85,12,2016-05-17 13:28:50,Tuesday,#Repost @thisissttropez ・・・ LES CAVES DU ROY It's PartyTime!  Tag someone you'd dance with tonight... 🍷🎊😉 ➡️ Follow @cavesduroy @djjack.e @byblossttropez 🎥 Awesome video by @jetsetlifetv #ThisIsStTropez #sainttropez #lescavesduroy #djjacke,True,738,maria.rinaudo olliejchambers brooklynsjc nath26000 nicolodega thisissttropez karene.smith kimmurgatroyd bennibensen85 die6ofernandes ,Repost ThisIsStTropez sainttropez lescavesduroy djjacke ,thisissttropez Tag cavesduroy djjack.e byblossttropez jetsetlifetv ,true
1253863901775581190,BFmnpNOBNAG,115,0,2016-05-19 21:10:46,Thursday,SEE YOU TOMORROW !  #party #weekend #friday #saturday #sunday #lescavesduroy #sainttropez #club,False,N/A,sabrina_pure_allure kbaybarza alexandrenassif ma_tissot cleo_molina lilougr benjaminthomasphillips michelepivetta86 night_legend_ cavesduroy ,party weekend friday saturday sunday lescavesduroy sainttropez club ,,false
1254574820113568357,BFpJSbhBNJl,109,2,2016-05-20 20:43:14,Friday,Are you ready for this ?! #tonight #party #sainttropez #hotel #frenchriviera #cotedazur #lescavesduroy photo: @hudson_v,False,N/A,bennibensen85 mathildesoggiu demarias_ marcelo_martins_oliveira olliejchambers seb.impressiondeluxe orphee_perimony narcissistic_john cavesduroy alesinha ,tonight party sainttropez hotel frenchriviera cotedazur lescavesduroy ,hudson_v ,true
1255959446979662314,BFuEHZxhNHq,132,6,2016-05-22 18:34:14,Sunday,SUNDAY PARTY ! Join us tonight !  #lescavesduroy #sainttropez #frenchriviera #party #cotedazur #club #happylife photo: @alexjurion,False,N/A,sacha_lm ailsacargill margauxdrs alexjurion ninolam82 claraalrd seb.impressiondeluxe pauline_suma antelundin zeynepbenarfa ,lescavesduroy sainttropez frenchriviera party cotedazur club happylife ,alexjurion ,true
1259566422649262470,BF64PzpBNGG,89,4,2016-05-27 18:00:40,Friday,Tonight + Saturday + Sunday ! It's "Marathon Party" at Les Caves du Roy... Joins us !  #sainttropez #club #party #frenchriviera #cotedazur #lovers #summer #sttropez photo: @alicia1592,False,N/A,albertobresci thisissttropez nicolodega hugues_jambon margauxdrs cavesduroy mathilde.jln mark_fiore_dj lucasdcmps mrpriestly ,sainttropez club party frenchriviera cotedazur lovers summer sttropez ,alicia1592 ,true
1260143794767319593,BF87hrVBNIp,112,4,2016-05-28 13:07:48,Saturday,Timeless Les Caves du Roy... July 1993.  #sainttropez #club #frenchriviera #cotedazur #summer #sttropez #party photo: @elodieclarisse,False,N/A,sophialou24 afriartisan vivocars nicolodega patrick__matt boriskharlamoff hugodarniche max_erre cavesduroy thisissttropez ,sainttropez club frenchriviera cotedazur summer sttropez party ,elodieclarisse ,true
1265409317021208688,BGPoxHEhNBw,114,3,2016-06-04 19:29:27,Saturday,Your Saturday night at Saint-Tropez ! Party time tonight... join us !  #party #sainttropez #lescavesduroy #club #positivevibes #happymusic photo: @alicia1592,False,N/A,low_nossalaia boriskharlamoff 151positiveaffirmations bennibensen85 vicliot thai_silva thisissttropez personenisainttropez bobbymisner cavesduroy ,party sainttropez lescavesduroy club positivevibes happymusic ,alicia1592 ,true
1270495384309125959,BGhtNIWhNNH,127,5,2016-06-11 19:54:33,Saturday,Are you ready for this... TONIGHT ?! #partytime #cavesduroy #cotedazur #frenchriviera #france photo: @revmensch,False,N/A,paulinepgrt silvanoimperial anthonysttropez suprimer_0510_ thisissttropez jeanmarietrancher winecabj lilougr nicola_zanellati ,partytime cavesduroy cotedazur frenchriviera france ,revmensch ,true
1271892484959818532,BGmq3nuhNMk,91,3,2016-06-13 18:10:21,Monday,YOU WERE FABULOUS... SEE YOU THIS FRIDAY !  #lescavesduroy #sainttropez #club #cotedazur #frenchriviera #summer #party photo: danielphotographe.com,False,N/A,finleywhw dessislava09 azad.dubois fedeshanty clara.hg bennibensen85 thechampagnemap emma_gonzalezz cavesduroy ,lescavesduroy sainttropez club cotedazur frenchriviera summer party ,,true
1274754983405081045,BGw1udJhNHV,95,1,2016-06-17 16:57:37,Friday,Are you ready for TONIGHT ?... Welcome back to Saint-Tropez !  #lescavesduroy #weekend #sainttropez #nightclub #summer2016 #party,True,715,boriskharlamoff michelepivetta86 mattdecb johanjansen040777 karstenfaerber bennibensen85 irusyap cavesduroy silvanoimperial ,lescavesduroy weekend sainttropez nightclub summer2016 party ,,true
1275565518551830970,BGzuBS1BNG6,134,6,2016-06-18 19:48:00,Saturday,One more special night... See you tonight ?! ;) #letsgoparty #summer2016 #cavesduroy #sainttropez #nightclub #positivevibes Photo: @barbaracapone1,False,N/A,marcolugli1186 immo_mediawerk djillmouche marionhuuet matmoro thisissttropez nicolodega jean_krs carsinsttropez kekecalmeida ,letsgoparty summer2016 cavesduroy sainttropez nightclub positivevibes ,barbaracapone1 ,true
1276331350680720276,BG2cJnlBNOU,108,0,2016-06-19 21:09:35,Sunday,Les Caves du Roy lovers  #lescavesduroy #sainttropez #cotedazur #frenchriviera #club #party Photo: @brandonralph,False,N/A,markuscosta benjaminthomasphillips emilie_emanuel mannino_just antoinevlgh silvanoimperial oraddict_gold_officiel labrousse14 brooklynsjc cavesduroy ,lescavesduroy sainttropez cotedazur frenchriviera club party ,brandonralph ,false
1280565167381801566,BHFezwph-pe,115,2,2016-06-25 17:21:25,Saturday,DANCE DANCE DANCE ! Party time TONIGHT at Les Caves du Roy !,False,N/A,randomreed bennibensen85 benjaminthomasphillips hugodarniche cavesduroy thomaneck chocolateking_chokladkungen aimrub manon.g_ thechampagnemap ,,,true
1280706975650703689,BHF_DV5BmlJ,180,4,2016-06-25 22:03:10,Saturday,The calm before the storm... Let'go PARTY tonight !,False,N/A,djlesiv camguillec _bbrando_ immo_mediawerk ineshomma filipedantas oscarmikail_interiores thiagomattar maxiimw erlendbsaether ,,,true
1285704598002409306,BHXvYUaBR9a,107,0,2016-07-02 19:32:33,Saturday,What are you doing tonight ?... Come and have fun !  #party #saturdaynight #lescavesduroy #sainttropez #fenchriviera #club #cotedazur #summer2196 Photo: @mariegiselelondon,False,N/A,gqelive ale_avcs robertosaporito meierequestrian alesinha cavesduroy maisonbiancabeachclub thisissttropez tytyatm andreagirola ,party saturdaynight lescavesduroy sainttropez fenchriviera club cotedazur summer2196 ,mariegiselelondon ,false
1285761244628001448,BHX8QosBCKo,110,1,2016-07-02 21:25:06,Saturday,More than a Club... a family ! Let's go party !  #sainttropez #lescavesduroy #party #summer2196 #club #fenchriviera #mythical,False,N/A,jesson_cht kirbyguillemin manonquintana florian_billoue carolinetachet julien_elnino cavesduroy kirstythefitnesschick thisissttropez thibaud_borgia ,sainttropez lescavesduroy party summer2196 club fenchriviera mythical ,,true
1285806044995755504,BHYGckSBZ3w,98,2,2016-07-02 22:54:06,Saturday,The party never stops at Les Caves du Roy Saint-Tropez !  #cavesduroy #summer2106 #party #crazysaturday #frenchriviera Photo: @dilettacarutti,False,N/A,olliejchambers vagouv maxherbers cavesduroy immo_mediawerk emiremiremiremir lucasmrt1 djillmouche alexandreschramm oscarmikail_interiores ,cavesduroy summer2106 party crazysaturday frenchriviera ,dilettacarutti ,true
1286455682480389063,BHaaKCVhrvH,116,1,2016-07-03 20:24:49,Sunday,Welcome back to Saint-Tropez... "Sunday party" tonight... Join us !  #sainttropez #party #club #lescavesduroy #frenchriviera #summer2016 Photo: @giorgia_giuggiolini,False,N/A,papillonfromriviera fernandobau michelepivetta86 jpgalindo84 jesson_cht cdamia byblossttropez giorgiagiuggiolini chocolateking_chokladkungen cavesduroy ,sainttropez party club lescavesduroy frenchriviera summer2016 ,giorgia_giuggiolini ,true
1288571047389714996,BHh7IpbhFo0,154,0,2016-07-06 18:27:40,Wednesday,TONIGHT !... direction : Les Caves du Roy !  #sainttropez #lescavesduroy #party #frenchriviera #clubber #summer2016 Photo: @lamodista,False,N/A,mannino_just jc.murray 8alan4 haydeelozada thisissttropez marcohanna fancyjancyx emma_gonzalezz marcolugli1186 personenisainttropez ,sainttropez lescavesduroy party frenchriviera clubber summer2016 ,lamodista ,false
1290793111265934644,BHp0X7rhv00,131,3,2016-07-09 20:02:31,Saturday,Saturday Crazy Party ! See you tonight !  #sainttropez #lescavesduroy #party #frenchriviera #clubber #summer2016 Photo: @marcolugli1186,False,N/A,alicia1592 vmsoares sophialou24 flyme_travelboutique personenisainttropez andre_sada salometringali unmediterraneen zakariamorsli benjaminthomasphillips ,sainttropez lescavesduroy party frenchriviera clubber summer2016 ,marcolugli1186 ,true
1291575016563313460,BHsmKJvBos0,123,4,2016-07-10 21:56:01,Sunday,Are you ready for this ? Let's go party tonight !  #sainttropez #lescavesduroy #party #frenchriviera #clubber #summer2016 Photo: @stephbrag,False,N/A,laurentflohmann kirstythefitnesschick quirlando_des_sources be.britto scarlettalicesmith djillmouche steveblackofficial thisissttropez tanguylstv lucasmrt1 ,sainttropez lescavesduroy party frenchriviera clubber summer2016 ,stephbrag ,true
1292988958351194182,BHxnptpBnhG,138,1,2016-07-12 20:45:16,Tuesday,Join us tonight and dance all night long !! #lescavesduroy #sainttropez #party #frenchriviera #summer2016 Photo: @_megmcc_,False,N/A,scollado_ jo290412 laianza timotheegvn marion.villanova maxence_cebe liefette marieloup.4 jdn_gall marceloleitecunhapiaf ,lescavesduroy sainttropez party frenchriviera summer2016 ,_megmcc_ ,true
1293765607120045683,BH0YPcLAgZz,127,3,2016-07-13 22:28:20,Wednesday,Between girls tonight at Les Caves du Roy... #sainttropez #lescavesduroy #party #frenchriviera #clubbing #summer2016 Photo: @jademengual,False,N/A,winecabj alexreiller marcolugli1186 scollado_ jademengual enzo_csrd cavesduroy edgaarholder olivierbadin romain.f83 ,sainttropez lescavesduroy party frenchriviera clubbing summer2016 ,jademengual ,true
