,ID,SHORTCODE,LIKES,NUM_COMMENTS,DATE,WEEKDAY,CAPTION,IS_VIDEO,VIDEO_VIEW_COUNT,USERS_LIKED,TAGS,MENTIONS,HAS_COMMENTS
791,1384306808722464022,BM2C7VKDp0W,180,9,2016-11-15 20:37:32,Tuesday,Re-live the energy from our #SoldOut night with @dvbbs! #TempleTV #TheNewTemple (full clip is up on our Facebook!),True,731.0,kates_fitjourneyy lukedjolakian jjoy.emeryy adventureawaits37 davidemmedj la_belle_morte eddieecee_ misteroddmusic sittingduck1968 mr.sergiogarcia ,SoldOut TempleTV TheNewTemple ,dvbbs! ,True
792,1383557678521760776,BMzYmDSjbwI,136,13,2016-11-14 19:49:09,Monday,** CONTEST ** Tag a friend to enter for a chance at winning two signed posters of our October lineup featuring Sunnery James &amp; Ryan Marciano  Cedric Gervais  Dubvision  Otto Knows  Will Sparks and Martin Solveig! (Winner selected at random this Wednesday  1 entry per person!) #TheNewTemple,False,,pato_sf unordinary.boy _marioe sionhernamdez tasos_mrg ravelife810 victorioussince97 justoner j.dph.93 ,TheNewTemple ,Cedric Dubvision Otto Will 1 ,True
793,1383115804258496824,BMx0H70DnE4,200,0,2016-11-14 05:11:14,Monday,Thumbs 👍🏼 if you're joining us for the highly anticipated return of @Quintino this Saturday  November 19th! Advanced tickets still available ➡️ bit.ly/quintino_sf • For VIP Bottle Service call/text 415.312.3668! #TheNewTemple,False,,aidanmcmul smileedrinkk jffersplan elvie8107 thanksgooods jp_vital m20b00a indicabonito yofave.naee ,TheNewTemple ,Quintino November ,False
794,1382803173354004469,BMwtCjmDF_1,235,5,2016-11-13 18:50:05,Sunday,Double tap if you were with us for @dannic's birthday last night! 🎉🔊🍾 #TheNewTemple,False,,gilera987654 arvindtandonp exo.wifeu jdoej971 lexi.murray88 jpatlaniii jmolt5 verbatymm shiv_patel0317 ,TheNewTemple ,dannic's ,True
795,1382201009359477280,BMukH6rDtog,320,9,2016-11-12 22:53:42,Saturday,Experience our newest addition  our INFINITY lounge! Featuring the hottest house/deep house  located inside @temple_sf 🔊🔊 Inquire now about our #VIP specials ➡️ 415.312.3668 #TheNewTemple,False,,jaymothegreat djtrius unordinary.boy beejoybee simplysarax c_lahtekilla carbontanium.quantum aaamirrr.rs djkyleflesch wilkiofficial ,VIP TheNewTemple ,our located temple_sf ,True
796,1382119475285821302,BMuRlcJj4d2,202,2,2016-11-12 20:11:42,Saturday,The 🔥was LIT last night!! @firebeatz #TheNewTemple,False,,kierstenahlysecates bubu0879 rasaanvari venezia.fashion saffronmendelson cbay94 flatshoesbigsteps peter_canterino ladythepug lunipuniluni ,TheNewTemple ,firebeatz ,True
797,1381576657614006523,BMsWKZzDej7,219,4,2016-11-12 02:13:13,Saturday,Tonight the 🔥🔥 is back in town! Limited advanced tickets remain for @firebeatz 🙌🏼 Grab yours ➡️ bit.ly/firebeatz_sf! #TheNewTemple,False,,m_a_x_i_m_o_88 milesmedina dj_broke_as_fuck jade.clayton._ lorentzo_dj fitronik suhyll_ brettbussell24 taelhyunq ,TheNewTemple ,firebeatz ,True
798,1380234116042045097,BMnk52hj7ap,225,1,2016-11-10 05:45:50,Thursday,Jump start your weekend with #DJFranzen + @_marioe tomorrow night 🔊🍾! Grab a FREE ticket using this link ➡️ bit.ly/nlt_111016 #TheNewTemple #NextLevelThursday,False,,saucyxhez theluxurytrips raikhan_rkh mokh_150 prodigy.memesv2 aasemalmulla mohammed__moussa reaching_greatness suprianto.damanik ,DJFranzen TheNewTemple NextLevelThursday ,_marioe ,True
799,1380123637042700052,BMnLyK8DN8U,210,1,2016-11-10 02:06:19,Thursday,Make sure your internet connection is strong and you're mouse is at the ready- tickets go on-sale tomorrow for #NYE with @dzekoandtorres at 12pm PST! #TheNewTemple,False,,murah__ loliviab_ bodygamesupps isaac__duran folkill12 cvbfgertyu ashley_all_night shauna_mccloskey crate777 ,NYE TheNewTemple ,dzekoandtorres ,True
800,1379469397559517556,BMk3Bu8DqF0,105,5,2016-11-09 04:26:28,Wednesday,Pass the AUX cord  @firebeatz are bringing the 🔥🔥 to our main stage this Friday night! #TheNewTemple #TempleTV,True,629.0,dustinellison_ neyazzz pratik_cesqeaux danceelectricjc gisela_89 lanaa____c chantellly macefaceinspace charlesbellantoni temple_sf ,TheNewTemple TempleTV ,@firebeatz ,True
801,1379217863848460892,BMj91b6j4Jc,188,0,2016-11-08 20:06:43,Tuesday,Our ears are still buzzing from @fergiedj @staffordbrothers &amp; @brookeevers! Full photo albums are up now on www.templesf.com! #TheNewTemple,False,,queen.ashlyyl jessemarsicano gl0bal_kid kuqezifrance2016 dtx.kammy oursecrethidden shauna_lynn013 lepromo01 stelondono amandakazla ,TheNewTemple ,fergiedj staffordbrothers brookeevers! ,False
802,1378021211032614326,BMftv2IjXW2,169,2,2016-11-07 04:29:11,Monday,GIG REMINDER! Catch the highly anticipated return of @Quintino on Sat. November 19th! Advanced tickets ➡️ bit.ly/quintino_sf • For VIP Bottle Service call/text 415.312.3668! #TheNewTemple,False,,dcovic64 lucasmedeiro danelygc djironlyon omgitsprincessc djloverboi sittingduck1968 dj_markg ,TheNewTemple ,Quintino ,True
803,1377764757570809547,BMezb9PD27L,181,1,2016-11-06 19:59:39,Sunday,We got DOWN with the land down under last night!! @staffordbrothers @brookeevers @saintclairmusic 🇦🇺🇦🇺 #TheNewTemple,False,,gogoprotracy avionmusicdj scrumptious_serim jiaranchen elwilsonok sokuntheamuth coryjameshicks kdog_stackin vancastle917 lucasmedeiro ,TheNewTemple ,staffordbrothers brookeevers saintclairmusic ,True
804,1377231414697506625,BMc6Ky-jbdB,154,2,2016-11-06 02:20:00,Sunday,The AUSSIE's are back TONIGHT! @staffordbrothers @brookeevers 🇦🇺🇦🇺 #TheNewTemple,False,,cloudysystem_ garon.yamashita sf_bee jake_tate_ alexufc1313 _dance_party_ sleepinggiantmusic aggin015 sokuntheamuth eric_j_chef ,TheNewTemple ,staffordbrothers brookeevers ,True
805,1377041406963361977,BMcO90fDii5,196,3,2016-11-05 20:02:29,Saturday,Hands🙌🏼 if you were with us for the return of @fergiedj last night! #TheNewTemple,False,,jollygr33nsouth norcalafterdark unordinary.boy barepromotionz jasonbowen82 sionhernamdez itssamrolo heyyojoe blackmore__gh fermentdrinkrepeat ,TheNewTemple ,fergiedj ,True
806,1376546809493513648,BMaegesjuWw,173,3,2016-11-05 03:39:48,Saturday,Our boy @fergiedj is bringing the energy back to our Temple TONIGHT! For VIP Bottle Service call/text 415.312.3668! #TheNewTemple,False,,_jaydakris_ burgerrock stevesmooth djmatt_miller syahrilamir98 xtaminophen davide.sanvito.97 pepperspop this1guybryan katkamegy ,TheNewTemple ,fergiedj ,True
807,1376319989837779505,BMZq70bjNIx,150,0,2016-11-04 20:09:09,Friday,Thanks for the open bar last night  @absolutvodka!! Now it's time re-charge for the return of @fergiedj TONIGHT! #TheNewTemple,False,,kingkaikollect magicmyyyke l.m.n.t christyxstyle josh_fakhri rraquelgandrap amir_e3x djmarsgambino speedytalks_ elwilsonok ,TheNewTemple ,@absolutvodka!! fergiedj ,False
808,1375747053590565967,BMXoqf-DlRP,247,1,2016-11-04 01:10:50,Friday,Tag your +1 and let them know they have plans tonight! Join us for another  #NextLevelThursday with @shabazzo &amp; @_marioe! Enjoy comp'd entry with this link ➡️ bit.ly/nlt_1103 #TheNewTemple,False,,theofficialballin_wallace11 vibewesttv todypaixao kenezo yprastyo_ promethopablo adoniskingupdates petty_quenn ,NextLevelThursday TheNewTemple ,shabazzo _marioe! ,True
809,1375046393052145917,BMVJWi_jij9,148,5,2016-11-03 01:58:45,Thursday,Our #WCW @brookeevers is joining the @staffordbrothers this Saturday for one MASSIVE #AUSSIE TAKEOVER! Advanced tickets strongly encouraged! Grab yours ➡️ bit.ly/stafford_sf #TheNewTemple 🇦🇺🇦🇺,False,,yosselinpenzo dasianacole djkickz ellement_ edwin415 tini.cactus live4thedrop honkiemusic julian.etw ,WCW AUSSIE TheNewTemple ,brookeevers staffordbrothers ,True
810,1374396017084806139,BMS1eVLDTP7,170,1,2016-11-02 04:26:34,Wednesday,This Thursday we are 🔙 at it again with @shabazzo!! Support by @_marioe 🔊 Enjoy FREE admission using this link ➡️ bit.ly/nlt_1103! For VIP Bottle Service call/text 415.312.3668! #TheNewTemple,False,,malfelchwii _shonidoee bayernfocus d3alers2018 thecoolestjj cyberlisthb to_my_future_wife av.dilara ,TheNewTemple ,shabazzo!! _marioe ,True
811,1374367854178919228,BMSvEgbDOM8,226,3,2016-11-02 03:30:37,Wednesday,Re-live the treat this past weekend was  photo albums from @andycaldwell and @martinsolveig are up now on www.templesf.com! #TheNewTemple,False,,thizzardofoz usmcvet jtown_jessie juan_ton_soup buhbray azhen_style tokyo_gp will_aye nikkiicottrell djisak_ ,TheNewTemple ,photo andycaldwell martinsolveig ,True
812,1374143621100282143,BMR8FfGDSEf,147,0,2016-11-01 20:05:06,Tuesday,Who's ready for our #AUSSIE TAKEOVER this Saturday night with the @staffordbrothers!? Here's a taste of what's in-store! Advanced tickets ➡️ bit.ly/stafford_sf #TheNewTemple #TempleTV,True,394.0,stevesmooth v.man96 hella_nette wdro91 corinamarlene rashad_hassouna xtaminophen anyasf415 naeon1 pedro_belm ,AUSSIE TheNewTemple TempleTV ,staffordbrothers!? ,False
813,1373667545945237931,BMQP1rjjGmr,177,0,2016-11-01 04:19:13,Tuesday,GIG REMINDER! @dannic is making his way back to our Temple on Saturday November 12th! Early bird tickets are up for grabs here ➡️ bit.ly/dannic_sf 💨🙌🏼 For VIP Bottle Service call/text 415.312.3668! #TheNewTemple,False,,cuevasmaria1 misteroddmusic rocketvodka dannicsquad djkickz clubcannon fzshad ricoavila stevesmooth conorcounihan1 ,TheNewTemple ,dannic ,False
814,1373431019621746591,BMPaDxQDoef,113,0,2016-10-31 20:29:17,Monday,Our boy @fergiedj is bringing the energy back to our Temple this Friday night! Advanced tickets encouraged ➡️ bit.ly/fergiedj_sf • For VIP Bottle Service call/text 415.312.3668! #TheNewTemple,False,,tee.k.ohh utoo.sf yeah_its_mikey gixxer1910 jessebarbaryrougesf _tsikis sixxsix lulu4597 johnny_briones_salas temple_sf ,TheNewTemple ,fergiedj ,False
815,1372977903801485074,BMNzCEQjEcS,169,1,2016-10-31 05:29:02,Monday,The STAFFORDS are coming back! Catch the return of the @staffordbrothers next Saturday  Nov 5! Tickets ➡️ bit.ly/stafford_sf • For VIP Bottle Service call/text 415.312.3668! #TheNewTemple,False,,djjoozsc djnickymiles lukasfelt djpeetiv elldoepiero3 dj.brooklyn timgia95 elwilsonok est.__92 thedjred ,TheNewTemple ,staffordbrothers Nov ,True
816,1372674374729828389,BMMuBIyDYgl,228,2,2016-10-30 19:25:58,Sunday,Thats a wrap! The Bay Area was on 🔥 last night! Thank you @martinsolveig #TheNewTemple,False,,audreybottolfson karinakperez froso_coveos fadednightsnyc stacylizano cfemoney jufloresc alyssa.thomas18 _kyle_ovo_faded_ ,TheNewTemple ,martinsolveig ,True
817,1371997775118287016,BMKULUSjUCo,190,1,2016-10-29 21:01:41,Saturday,Our #Halloweekend keeps getting better and better! Thank you for the 🔥🔊 last night @andycaldwell! Now it's time for a #SoldOut Saturday with @martinsolveig  TONIGHT! #TheNewTemple,False,,gurhekim biancaa7th charlesbellantoni sionhernamdez carlosemoraless diamond.eyes25 itssjosan miss_mason143 ,Halloweekend SoldOut TheNewTemple ,andycaldwell! martinsolveig TONIGHT! ,True
818,1371370950629401083,BMIFp0fjiH7,111,0,2016-10-29 00:16:18,Saturday,What the face of a champion looks like 🙌🏼🙌🏼 the costumes last night were 👍🏼👍🏼 see you tonight for round 2! #TheNewTemple,False,,wilglass perezaidan lepace khromata magicmyyyke justcz5 805_ranger lolinck juicylilphilly temple_sf ,TheNewTemple ,,False
819,1370631881591088709,BMFdm80D-ZF,144,1,2016-10-27 23:47:54,Thursday,We do it for the fans! Additional tickets have been added for @martinsolveig's #SOLDOUT event this Saturday! Grab yours ➡️ bit.ly/MartinSolveigTemple #TheNewTemple,False,,shhhhsp lavelledupree elwilsonok juan_ton_soup ladyjester_ djtriplexl angel_g0n amados998 ceci_barros ,SOLDOUT TheNewTemple ,martinsolveig's ,True
820,1370002540452418487,BMDOg1NDJO3,194,0,2016-10-27 02:57:31,Thursday,Who wants $2 GRAND IN THEIR HAND? Join us tomorrow night as we kick off our #Halloweekend with a massive ca$h prize costume contest! Comp'd entry all night with sounds by our very own resident DJs! #TheNewTemple,False,,the_chosen_one_04 jacob._.esquivel monsta_slim best_baller.clips tiffany_miranda1 _emgalindo babesinbabylon scottward_jenkins iceeyy.n arman40500 ,Halloweekend TheNewTemple ,,False
821,1369251369261572316,BMAjt2hDaDc,129,0,2016-10-26 02:05:04,Wednesday,We hope you enjoyed your time on the #BallerExpress! Re-live this weekend with @ottoknows + @will_sparks -- complete photo albums are up now on www.templesf.com! #TheNewTemple,False,,unordinary.boy lulu4597 juan_ton_soup rloe95 elwilsonok djkickz scandeezy31 royohhboy richard_del_razo freshprincebadnewz ,BallerExpress TheNewTemple ,ottoknows will_sparks ,False
822,1369018946804431691,BL_u3qPDrtL,82,2,2016-10-25 18:23:17,Tuesday,Who remembers last #Halloween? We're gearing up for another year of top tier talent  costume contests + more! Ticket link in bio! #TheNewTemple #TempleTV,True,470.0,erakill peiro_23 kittenhope franky_franky_ djtriplexl tinkin_b ilmadik charlesbellantoni temple_sf _tom_jaykumar_smita_mistry ,Halloween TheNewTemple TempleTV ,costume ,True
823,1368553419812333452,BL-FBWcD2eM,156,1,2016-10-25 02:58:22,Tuesday,This Thursday we're hosting our annual #HalloWeekend costume contest! CA$H PRIZES! Enjoy comp'd entry all night + sounds by our resident DJs! For VIP Bottle Service call/text 415.312.3668! 🙌🏼🔊🎃#TheNewTemple,False,,rebelalliance lomelisvt _jon_a_ton mriuh.wtkins danxindan fatmoneyrecs daneschmid50 wdro91 delaoinvegas the209bnr ,HalloWeekend ,,True
824,1367612072276179140,BL6u-8OjrjE,228,2,2016-10-23 19:48:05,Sunday,@will_sparks's #VoicesTour was 🔥🔥 last night! Head over to our Facebook for the full read on his track 'Voices' with @kshmr! #TheNewTemple,False,,missgabby.xo cianolil stalkerszulia12 tylerfierrofit falcone7_98 xo.jjeniii jackievera28 lupeynsuave lambertnow ,VoicesTour TheNewTemple ,will_sparks's kshmr! ,True
825,1366917152372434938,BL4Q-hojCf6,209,1,2016-10-22 20:47:24,Saturday,If you dont know  now you KNOW. Thank you for last night @ottoknows! #TheNewTemple,False,,launchpadinfinity slim_5_nb diiaana.ri koydek lanax831 rojiittooo sicnorm gogoprotracy 2loversdjs lomelisvt ,TheNewTemple ,now ottoknows! ,True
826,1366407476228738733,BL2dFwvDU6t,290,0,2016-10-22 03:54:46,Saturday,The return of @ottoknows is upon us  TONIGHT! #ArriveEarly #StayLate #TheNewTemple,False,,dark_scoots mvp.tupac kmecastillo v_i_v_i_e_n_ bayernfocus jlockz6ix tsgtravels laka74100 vmb7727_ ,ArriveEarly StayLate TheNewTemple ,ottoknows TONIGHT! ,False
827,1366161723258519623,BL1lNlcj0BH,185,0,2016-10-21 19:46:30,Friday,Who #SQUAD was in the building last night! Who's ready for round 2️⃣ tonight with @ottoknows!? #TheNewTemple,False,,stevesmooth loveshayna erakill unordinary.boy xo_annet_xo oswaldo19_81 shotbytherobot davidemmedj jake_hadden slim_5_nb ,SQUAD TheNewTemple ,ottoknows!? ,False
828,1364923775145913648,BLxLvEbDq0w,201,1,2016-10-20 02:46:55,Thursday,There is no #debate  we know where you'll be tomorrow night... enjoy complimentary admission to the Bay Area's hottest Thursday night party ➡️ bit.ly/nlt1020! Sounds by #FameSquad!  For VIP Bottle Service call/text 415.312.3668!#TheNewTemple,False,,nxxll3 uugi9 jokr_66 xianglongli flithyvlone _curlycam_ luisjoserossetti nahume_ow tr.quote liridonak1 ,debate FameSquad ,we For ,True
829,1364201967614596413,BLunnYxjpU9,180,1,2016-10-19 02:52:49,Wednesday,💡📸🎬 full photo galleries from @cedricgervais &amp; @dubvisionmusic are available now on www.templesf.com! #TheNewTemple,False,,djironlyon stevesmooth mn.apache deathgrabs_music ceci_barros djtajsf k3ar kevinrebeche missgabby.xo oldinsta1891 ,TheNewTemple ,cedricgervais dubvisionmusic ,True
830,1364023219875293108,BLt--Q-DSe0,192,1,2016-10-18 20:57:40,Tuesday,JUST IN! @andycaldwell is making his #TempleReturn on Halloween weekend  Friday October 28th! Advanced tickets are on-sale now! (link in bio!) #TheNewTemple,False,,slim_5_nb stevesmooth elliotfingerote juan_ton_soup djpeetiv oswaldo19_81 lukasfelt djtajsf kraversaurus djkyleflesch ,TempleReturn TheNewTemple ,andycaldwell Friday ,True
831,1363489147386272310,BLsFifNDxo2,170,2,2016-10-18 03:16:34,Tuesday,This Saturday @will_sparks is bringing his #VoicesTour to our Temple! Tickets are still available ➡️ bit.ly/will_sf 🔊🙌🏼 For VIP Bottle Service call/text 415.312.3668! #TheNewTemple,False,,hella_nette cbass_94 djstellar veronicadanna slim_5_nb quarterjack jennr76 truthgame claytonwilliam juan_ton_soup ,VoicesTour TheNewTemple ,will_sparks ,True
832,1362778170780955513,BLpj4apDjN5,138,2,2016-10-17 03:43:59,Monday,GIG REMINDER❗️Join us as we welcome @martinsolveig to our Temple during #Halloween weekend on Sat. October 29th! Advanced tickets ➡️ bit.ly/MartinSolveigTemple 🍾 For VIP Bottle Service call/text 415.312.3668 #TheNewTemple,False,,rc_livfe usmcvet fierce2themaxx charlesbellantoni djsimone djkickz skankinsouls ugottheright1baby mad_maxx2200 nikkiicottrell ,Halloween TheNewTemple ,martinsolveig ,True
833,1362559780074225284,BLoyOacjv6E,117,2,2016-10-16 20:30:05,Sunday,Last night was DUTCH'in crazy! @dubvisionmusic #TheNewTemple,False,,scoope.jo saaye.apparel rogerio.mestrinho waynechan90 marc_secasan danelygc angel_eyes426 youngbloodfilms titaaida temple_sf ,TheNewTemple ,dubvisionmusic ,True
834,1361968488101354815,BLmrx-4jp0_,177,0,2016-10-16 00:55:17,Sunday,Dub the vision. Dub the fun... Tonight we welcome back Dutch duo @DubVisionMusic to our Temple! For VIP Bottle Service call/text 415.312.3668 #TheNewTemple,False,,pizzarollthepug crybaby.king juhifloraldesign karinalillian mtdd21 yazzyyy_ dishumavi dsg_0100 danny_in_14 ,TheNewTemple ,DubVisionMusic ,False
835,1361779950193864367,BLmA6ZRje6v,130,0,2016-10-15 18:40:42,Saturday,We came.  We saw. We Cedric'd! Thank you for the 🔥 night! #TheNewTemple,False,,frankgc7 official_vikilau ___bhavesh.w___ julesd422 dcovic64 werkkka wandering_blaha endzwitdalenz lvl44sj charlesbellantoni ,TheNewTemple ,We ,False
836,1361336624801975224,BLkcHKVDQu4,126,1,2016-10-15 03:59:53,Saturday,Tonight marks the massive return of @cedricgervais! See you on the dance floor 🔊💨 #TheNewTemple,False,,delaoinvegas hesjndnx alvinorteezz ayexnathan_kelleher47 mackontheradio sokuntheamuth skankinsouls 3licarva djcrank ,TheNewTemple ,cedricgervais! ,True
837,1360575210802035086,BLhu_ISDrmO,171,1,2016-10-14 02:47:05,Friday,Cue the 💨💨 TONIGHT @rebelpopradio is taking over our Temple with sounds by @cutso @jeaninedafeen &amp; @_marioe! Come take your Thursday to the #NextLevel 🔊🙌🏼 #TheNewTemple,False,,jackkmcdonnell brook2thea lord.gram the.taylorb koolastj amp_sonram jessicaapavanelli igsr.id okkm5tar emmaroberts.is.bae ,NextLevel TheNewTemple ,rebelpopradio cutso jeaninedafeen _marioe! ,True
838,1360302874844626661,BLgxEHqDn7l,159,1,2016-10-13 17:46:01,Thursday,We sat down with #Grammy award winning @cedricgervais to talk about his music obsessions along with his latest song w/ @davidguetta #WouldILieToYou... head over to our Facebook to see what he had to say! Tickets for tomorrow night are still available ➡️ bit.ly/cedric_sf 🙌🏼 #TheNewTemple,False,,3licarva mn.apache inhouse.radio djnickymiles jcbarragan iamdjsmiith edna_medeiros_08 sozay101 djdacandyofficial ineeedmorespace ,Grammy WouldILieToYou TheNewTemple ,cedricgervais davidguetta ,True
839,1359045887049735292,BLcTQijDhx8,142,4,2016-10-12 00:08:36,Wednesday,All aboard the #BallerExpress! Re-live @chrisgarciacgc &amp; @thisisburns4real -- full photo galleries from this past weekend are up now on www.templesf.com! #TheNewTemple,False,,magicmyyyke _marioe _carlos_munoz_ picturepierson fergiedj salvyboi510 vanillagorilla_withabeard edna_medeiros_08 official_vikilau v2honey ,BallerExpress TheNewTemple ,chrisgarciacgc thisisburns4real ,True
840,1358884539028355929,BLbuknfjjtZ,180,1,2016-10-11 18:48:02,Tuesday,The return of @dubvisionmusic is this Saturday  October 15th! Here is a first hand look at what you can expect 🙌🏼🍾🔊 #TheNewTemple,True,590.0,k.i.v_v.i.k djkickz stevesmooth nico_freeko urzz_truly lolinck lvl44sj ellement_ naeon1 ,TheNewTemple ,dubvisionmusic October ,True
841,1358380696607875309,BLZ8AvrD2Dt,182,2,2016-10-11 02:06:59,Tuesday,GIG REMINDER! @will_sparks is bringing the BOUNCE to our Temple on Saturday  October 22nd! Tickets are still available ➡️ bit.ly/will_sf 🔊🙌🏼 For VIP Bottle Service call/text 415.312.3668! #TheNewTemple,False,,djtriplexl arnelle__ briannanewman sokuntheamuth ariel_gimenez89 slim_5_nb skankinsouls andreainsanfrancisco masikelar ,TheNewTemple ,will_sparks October ,True
842,1357687606486232730,BLXea9Mj-6a,199,1,2016-10-10 03:09:56,Monday,We're gearing up for another PRIME'R weekend next week with @dubvisionmusic on Saturday! Advanced tickets are still up for grabs! (link in bio) 🙌🏼🔊 Call/Text 415.312.3668 for VIP reservations! #TheNewTemple,False,,yt.angeldust pupiloconstante yeezynia bondadavid greeno_fitness nickrobinsonfanz floccavelisav selindigimez ,TheNewTemple ,dubvisionmusic ,True
843,1357402802003785874,BLWdqgWjjiS,181,1,2016-10-09 17:44:05,Sunday,Another wall-to-wall night with @thisisburns4real last night! #TheNewTemple,False,,medicenbombi timfsf oswaldo19_81 monstersballdetroit demetriofonseca shhhhsp slim_5_nb lucasmedeiro kraversaurus frankgc7 ,TheNewTemple ,thisisburns4real ,True
844,1356753264561663450,BLUJ-feDK3a,129,2,2016-10-08 20:13:34,Saturday,Now that's how we throw it down for #FleetWeek! Thank you @chrisgarciacgc 🍾🔊👏🏽 #TheNewTemple,False,,jellybelly_sssj juan_ton_soup lolinck nzepeda93 jc2017 djtriplexl juicylilphilly alex_gough_12 bmonarrez8 mn.apache ,FleetWeek TheNewTemple ,chrisgarciacgc ,True
845,1356174167343275501,BLSGThKDp3t,154,3,2016-10-08 01:03:00,Saturday,Got #VIP?! Enjoy an exclusive #FleetWeek table special TONIGHT! Call/Text 415.312.3668 for more info 🙌🏼🍾 #TheNewTemple,False,,iamcrystalleee mn.apache elwilsonok iamheavynova festfeed lolinck santiagotorresmr mysterion_75 jblaze70 ,VIP FleetWeek TheNewTemple ,,True
846,1356024771033125128,BLRkVhAD1EI,215,3,2016-10-07 20:06:11,Friday,Thank you for taking our Thursday to the #NextLevel last night  @djdynamiq! #TheNewTemple,False,,doloshit_spamm shahbazsaith reallyrahaf kylemcgowan_fitness badgalcuban iamlilkem famed_media starfie81 lithomieloco_ swag__city__savage ,NextLevel TheNewTemple ,@djdynamiq! ,True
847,1355480208673445852,BLPohFyDZfc,111,2,2016-10-07 02:04:14,Friday,From the kick off on the field  to the kick off of our weekend  @djdynamiq is taking the Bay Area by 💨! Join us for the hottest Thursday night party  TONIGHT! #TheNewTemple,False,,vicpresents delaoinvegas jerico415 djisak_ paicuz djcrank pinotalameda jacquelinegomba virlianaaa temple_sf ,TheNewTemple ,to @djdynamiq TONIGHT! ,True
848,1354843673288690701,BLNXySAjswN,219,0,2016-10-06 04:59:33,Thursday,This Saturday night were BURNS'ing up the dance floor with @thisisburns4real! Head over to or Facebook for the #Temple411 on what he has been up to since his last visit! #TheNewTemple,False,,carlrickardandersson ufrmda6 neeyacoblog fadly_lasfriend ewitsyazlinn 2b9j jansbab9647bsns fonkypapy claudiawyley akpinky_xo4u ,Temple411 TheNewTemple ,thisisburns4real! ,False
849,1354563181909663861,BLMYAmDjGB1,221,2,2016-10-05 19:42:16,Wednesday,The return of @cedricgervais is going to be one for the books... would we 'lie to you'?! Grab your advanced tickets for next Friday  October 14th while they last 💨 bit.ly/cedric_sf! For VIP Bottle Service call/text 415.312.3668! #TheNewTemple,False,,carlrickardandersson omgwilliamx ennarlyat no_limitpat mars.sha6i minifresno xojennalane murathalicphoto ronalregan23 baljeet_gupta ,TheNewTemple ,cedricgervais October ,True
850,1353948239783367952,BLKMMAkjZUQ,194,2,2016-10-04 23:20:29,Tuesday,Weekend still a blur?... we've got you 💯 Full photo albums from @sj_rm &amp; @jayhardway are up now on www.templesf.com! #TheNewTemple,False,,galilahi.products davide.sanvito.97 djgomexofficial ncollenette_ davidnuesslein mariajosezapatac slim_5_nb djtrius ,TheNewTemple ,sj_rm jayhardway ,True
851,1353812875013951850,BLJtaMTjpFq,66,1,2016-10-04 18:51:32,Tuesday,#TempleTV: Dive into the world of @lvl55sf with @grandtheft! Full clip is up now on our Facebook 🔊 #TheNewTemple,True,267.0,xvc_5 djbuza teddyyrose cashentertainment vivisquareevu helena_inx lvl44sj charlesbellantoni temple_sf valeriiieeeee ,TempleTV TheNewTemple ,lvl55sf grandtheft! ,True
852,1353130223046989512,BLHSMTHj5bI,706,2,2016-10-03 20:15:14,Monday,@ottoknows is making his #TempleReturn on Friday  October 21st! Early bird tickets are still up grabs ➡️ bit.ly/otto_sf 💨🙌🏼 For VIP Bottle Service call/text 415.312.3668 #TheNewTemple,False,,kxingjoey_ ilajn_a antonio_mungal jhurst__ ahmadmansoor_official ahaughton_ prettylexxyy jazmine_qu33n ,TempleReturn TheNewTemple ,ottoknows October ,True
853,1352330587377980174,BLEcYEXj1MO,134,0,2016-10-02 17:46:30,Sunday,This has been one 'Dutch' weekend 🔊 thank you @jayhardway for another night of quality tunes and pure energy! #TheNewTemple,False,,onebowlinggreen uriel_981 jayhardway curiousgeorge9800 mr.sergiogarcia misteroddmusic slim_5_nb thiagomartinshm ,TheNewTemple ,jayhardway ,False
854,1351790042431836658,BLCheGqD1Hy,126,0,2016-10-01 23:52:32,Saturday,The dutch are in town! Tonight we welcome back rising sensation @jayhardway to our Temple! Limited #VIP tables left 🍾🙌🏼 Book yours ➡️ 415.312.3668! #TheNewTemple,False,,kandigamer tomrodgers916 jello_vibes biancaa7th scandeezy31 honyhairdesign claytonwilliam will_aye thehypeman_ jalfonsocr_23 ,VIP TheNewTemple ,jayhardway ,False
855,1351591272469277962,BLB0RntDK0K,171,1,2016-10-01 17:17:37,Saturday,The floor was 🔥 last night for the return of @sj_rm! #TheNewTemple,False,,denis_playme ceci_barros sandraethell slim_5_nb briannanewman iamcrystalleee juniorthivaios micahwailana annet_kornilova inhouse.radio ,TheNewTemple ,sj_rm! ,True
