,ID,SHORTCODE,LIKES,NUM_COMMENTS,DATE,WEEKDAY,CAPTION,IS_VIDEO,VIDEO_VIEW_COUNT,USERS_LIKED,TAGS,MENTIONS,HAS_COMMENTS
0,1757731506611928484,Bhkt34OHb2k,112,2,2018-04-15 02:05:45,Sunday,Aint no party like a @staffordbrothers party 🔥 Tonight we dance. #TempleTen #TempleSF,False,,manzermusic ignacioreyesdj alonso_093 mbeas04 marticebaylorthenewqueen deltoro987 cxmadarazo charlesbellantoni prettysopary djque ,TempleTen TempleSF ,staffordbrothers ,True
1,1757526344664463332,Bhj_OYRHbfk,163,8,2018-04-14 19:18:08,Saturday,Special thanks to Temple’s very own @lucasmedeiro! 🔥 #TempleTen #TempleSF,False,,melody_ahn lariotsofficial rundeirun needlestylus dj_jordanbass amirhosein.fahim contra_dan312 takeshi92 picturebrooks stayedclassy ,TempleTen TempleSF ,lucasmedeiro! ,True
2,1757036113205114701,BhiPwkpH7dN,112,1,2018-04-14 03:04:08,Saturday,Hands 🙌 for Friday night! @lucasmedeiro #TempleTen #TempleSF,False,,dj_jordanbass mariahlinam hella_nette mike.kerrigan xtinna666 fergiedj marticebaylorthenewqueen djque temple_sf king_alex_benson19 ,TempleTen TempleSF ,lucasmedeiro ,True
3,1756849038866373529,BhhlOSFnduZ,104,0,2018-04-13 20:52:27,Friday,Come down &amp; get down this weekend with @djfabianlv &amp; @djdsharp at @lvl55sf! Tickets available for @lvl55sf at www.templesf.com! #TempleSF #LVL55,False,,nick_patel199 king_alex_benson19 therealdjr420 fergiedj rundeirun marticebaylorthenewqueen charlesbellantoni prettysopary fernandoramirez8238 temple_sf ,TempleSF LVL55 ,djfabianlv djdsharp lvl55sf! lvl55sf ,False
4,1756335385608112816,BhfwbpNnsqw,114,5,2018-04-13 03:51:55,Friday,Flags Out = Hello Weekend 🙌 Jump start yours tonight to the sounds of @djmidnightsf! #TempleTen #TempleSF,False,,lariotsofficial gixxer1910 stoneagechase nsjsbahhaabsjdnxjj king_alex_benson19 marticebaylorthenewqueen fernandesjam wolfgangchristian charlesbellantoni temple_sf ,TempleTen TempleSF ,djmidnightsf! ,True
5,1756067610226569162,Bhezi_9H6_K,64,0,2018-04-12 18:59:53,Thursday,THIS WEEKEND Tonight: @djmidnightsf  Friday: @lucasmedeiro &amp; friends Saturday: @staffordbrothers  Link + Info in bio for last minute discounted tickets and tables • plan ahead and save $$ Bay Area 🙌🏼 VIP Reservations: (415) 312-3668 #TempleTen,False,,unicornking415 michellehahayb charlesbellantoni djque king_alex_benson19 erwinestrabo derekdjflip mayahappydance marticebaylorthenewqueen temple_sf ,TempleTen ,djmidnightsf Friday: lucasmedeiro staffordbrothers Link ,False
6,1755604959654477635,BhdKWjCHn9D,91,1,2018-04-12 03:40:41,Thursday,Swipe to unlock our Weekend Warriors VIP package! Valid until Saturday  April 21 🥂 Call (415)312-3668 to book your VIP experience! #TempleTen #TempleSF,False,,rico_cristian86 catkiss8 pauljgormley2018 fel1fel 991wanderlust marticebaylorthenewqueen nashtapia charlesbellantoni b_dubb240 king_alex_benson19 ,TempleTen TempleSF ,April ,True
7,1755397368584117079,BhcbJsyHJtX,100,3,2018-04-11 20:48:14,Wednesday,We’re blasting off with Temple’s very own @lucasmedeiro &amp; Friends this Friday night 🙌 Link in bio for guaranteed entry! #TempleSF #TempleTen,False,,king_alex_benson19 catkiss8 djodyroc minombreesveronica vascorafael9 scoope.jo erwinestrabo marticebaylorthenewqueen charlesbellantoni temple_sf ,TempleSF TempleTen ,lucasmedeiro ,True
8,1754662078051589515,BhZz90HHR2L,73,0,2018-04-10 20:27:37,Tuesday,Don’t miss the Temple return of the @staffordbrothers this Saturday night 🙌 Tickets: bit.ly/staffordbrosf #TempleTen #TempleSF,True,538.0,vascorafael9 prettysopary bleueyedqueen djque lvrry_gh king_alex_benson19 charlesbellantoni ramoneduassuncao ecjusuf temple_sf ,TempleTen TempleSF ,staffordbrothers ,False
9,1754154304586885159,BhYAgvOH6gn,106,5,2018-04-10 03:38:44,Tuesday,Enjoy a taste of @thomasgold’s journey in 60 seconds 🔥 Catch his Temple SF return on Saturday  April 28 • Link in bio for advanced tickets! #TempleTen #TempleSF,True,751.0,timenightclub king_alex_benson19 vascorafael9 mfcpapaya djque freshprincebadnewz nickwiththecanon charlesbellantoni prettysopary marticebaylorthenewqueen ,TempleTen TempleSF ,thomasgold’s April ,True
10,1753925284733551370,BhXMcD3HoMK,98,22,2018-04-09 20:03:28,Monday,** CONTEST ** Tag your crew for a chance to win a pack of 6 tickets to the @staffordbrothers this Saturday! Swipe for a preview of what’s in store 🎉 Must be 21+ and following @temple_sf to win! #TempleTen #TempleSF,False,,jaluvcuddles charlesbellantoni chelc.blair pif_pafoioioi pauljgormley2018 marticebaylorthenewqueen cutty__72 nashtapia prettysopary temple_sf ,TempleTen TempleSF ,staffordbrothers temple_sf ,True
11,1753392723418459253,BhVTWRfHKx1,464,2,2018-04-09 02:25:22,Monday,#TempleRepost 📸 @carlosoro15  Congrats  you've won a pair of tickets to a show of your choice! Share with us your best Bay Area shots for a chance at being featured on our Instagram 🙌🏼 1 winner will be posted weekly  and will win a pair of tickets to the event of their choice! Use ➡️ #TempleRepost in your caption + tag @temple_sf for a chance to win! #TempleSF,False,,bunny_630 aaroncart ap_onelovee jonjen.christian hyper_kuiper drinnadrinna cindymrrqn juanfri_01 xoelvia e.s.k.o ,TempleRepost TempleRepost TempleSF ,carlosoro15 Congrats you've and temple_sf ,True
12,1753170667250647694,BhUg27kHAKO,101,2,2018-04-08 19:04:11,Sunday,Viva Las Temple 🔥 Thank you @fergiedj #TempleTen #TempleSF,False,,jakewjones mattsamoto danceelectricjc ozzytres scoope.jo luzelenaaaa_ ignacioreyesdj king_alex_benson19 rosebridgettee startupsshowcase ,TempleTen TempleSF ,fergiedj ,True
13,1752468115123318223,BhSBHc6H63P,129,2,2018-04-07 19:48:20,Saturday,Thank you @blasterjaxx! #TempleTen #TempleSF,False,,andcardenas vascorafael9 marticebaylorthenewqueen euphoriawithgloria ronbe411 marccmiller scrumptious_serim ricktiongson pinotalameda daneschmid50 ,TempleTen TempleSF ,blasterjaxx! ,True
14,1752467969622931763,BhSBFVZn_kz,134,0,2018-04-07 19:48:03,Saturday,Thank you @blasterjaxx! #TempleTen #TempleSF,False,,djgeorgemay prettysopary dj_jordanbass nashtapia mohsenzsalehi _fab.91 anthonytm18 marticebaylorthenewqueen vascorafael9 ronbe411 ,TempleTen TempleSF ,blasterjaxx! ,False
15,1751971612642294963,BhQQOY8HLyz,194,2,2018-04-07 03:21:52,Saturday,Get up. Dress up. Show up. Tonight we welcome back @blasterjaxx 🙌 #TempleSF TempleSF #Blasterjaxx,False,,demo.drops sarah_arnett cointoplay _c_r_17 ixela_zenitram77 marrr_oxo bas_van_eijk_1988 sensory_overload_empire mel.green13 height_advantaged ,TempleSF Blasterjaxx ,blasterjaxx ,True
16,1751772352156222778,BhPi6xJn0U6,88,1,2018-04-06 20:45:59,Friday,JUST IN! @itsjulianjordan is headlining our Temple on Friday  April 20! Tickets ➡️ www.templesf.com #TempleTen #TempleSF,False,,kushpops iamdjefx lucasmedeiro temple_sf king_alex_benson19 djque nattekitty aye.ivy.90 joe_jaggedchino831 b_dubb240 ,TempleTen TempleSF ,itsjulianjordan April ,True
17,1751144680577108744,BhNUM8cHQsI,97,1,2018-04-05 23:58:54,Thursday,#NATOMA55 continues this week with BOT tonight 🔥 Visit this link ➡️ bit.ly/botnatoma55 ⬅️ for complimentary entry! #TempleSF,False,,losgatosbarandgrill ignacioreyesdj rundeirun king_alex_benson19 styledliving candycatmini youknowmarc cutty__72 prettysopary alea_wanna_beya ,NATOMA55 TempleSF ,,True
18,1751034160087966246,BhM7EqNniIm,89,3,2018-04-05 20:19:19,Thursday,THIS WEEKEND Tonight: #HellaFresh 90s Party Friday: @blasterjaxx  Saturday: @fergiedj  Link + Info in bio for last minute discounted tickets and tables • plan ahead and save $$ Bay Area 🙌🏼 VIP Reservations: (415) 312-3668 #TempleTen,False,,marccmiller am.i.mina.i.am rundeirun ozzytres charlesbellantoni donnie_wheeler lavelledupree djque temple_sf king_alex_benson19 ,HellaFresh TempleTen ,blasterjaxx Saturday: fergiedj Link ,True
19,1750522445495584518,BhLGuO3HMcG,103,0,2018-04-05 03:22:38,Thursday,Join the party this Saturday night with @fergiedj! Click the link in our bio for guaranteed tickets 🔥 #TempleTen #TempleSF,False,,krissylai chastityashley marticebaylorthenewqueen lvl44sj donnie_wheeler carley_nicole_ rundeirun king_alex_benson19 djque ,TempleTen TempleSF ,fergiedj! ,False
20,1750324916107847624,BhKZzzSH6fI,86,3,2018-04-04 20:50:11,Wednesday,Enhance your Temple experience • book your VIP table for @blasterjaxx this Friday  followed by @fergiedj on Saturday 🍾 (415) 312-3668 #TempleTen #TempleSF,False,,sheerahlynarayata lordsteezuschrist djque marticebaylorthenewqueen king_alex_benson19 og_juulz dj_ibarra andcardenas charlesbellantoni temple_sf ,TempleTen TempleSF ,blasterjaxx followed fergiedj ,True
21,1749787932712947617,BhIftqhns-h,117,4,2018-04-04 03:03:18,Wednesday,Our hella fresh  hella fun DOPE party returns this Thursday night  featuring your favorite 90’s hip hop hits 🔥 #TempleSF #TempleTen,False,,king_alex_benson19 mattsamoto saintclairmusic elliott2018paloalto itsdjwild michoacano_1 startupsshowcase kuohphotography andcardenas charlesbellantoni ,TempleSF TempleTen ,hella featuring ,True
22,1749651602288678664,BhIAty7HBcI,94,1,2018-04-03 22:34:53,Tuesday,Get to know @iamjacknovak before her Temple return on Saturday  April 21! Full clip is up now on our Facebook 🔥 #TempleSF #TempleTV,True,803.0,mattsamoto b_dubb240 moonb_training king_alex_benson19 marticebaylorthenewqueen therealbootyb_ saintclairmusic jetmike28 dj_naavi djque ,TempleSF TempleTV ,iamjacknovak April ,True
23,1749041777850909094,BhF2DrqHwGm,118,1,2018-04-03 02:20:49,Tuesday,We can’t wait to welcome @thomasgold to our Temple on Saturday  April 28! Tickets: www.templesf.com #TempleTen #TempleSF,False,,suppose2bwinnin donnie_wheeler king_alex_benson19 royohhboy dj_naavi rundeirun rico_cristian86 marticebaylorthenewqueen michellehahayb temple_sf ,TempleTen TempleSF ,thomasgold April ,True
24,1748870766102763046,BhFPLIjntYm,142,31,2018-04-02 20:41:03,Monday,CONTEST! Tag your crew for a chance to win a pack of 5 tickets for @blasterjaxx this Friday night! Must be 21+ and following @temple_sf to win! #TempleTen #TempleSF,False,,mlboakland07 euphoriawithgloria garamirez94 johnagi_ bunny_630 jaybling therapon1 fel1fel blasterjaxx 0108manuel ,TempleTen TempleSF ,blasterjaxx temple_sf ,True
25,1748294311731836848,BhDMGnlnLew,661,2,2018-04-02 01:35:44,Monday,Thank you for another epic weekend  Bay Area! Now recharge for @blasterjaxx and @fergiedj next weekend 🔥 #TempleTen #TempleSF,False,,sicnorm cristininharibeiro calebgjohnson nanjessi kari_onelove 3006beauty24 drink.up.beautiful robfarias10 frankgc7 ericasrich ,TempleTen TempleSF ,Bay blasterjaxx fergiedj ,True
26,1748144430409121759,BhCqBjunP_f,107,2,2018-04-01 20:37:57,Sunday,Last night we got our TWRK on 🙌 Thank you @wearetwrk! #TempleSF #TempleTen,False,,merkandkremont prettysopary mohsenzsalehi reeeeyon wearetwrk vascorafael9 abercrombieislit marccmiller marticebaylorthenewqueen king_alex_benson19 ,TempleSF TempleTen ,wearetwrk! ,True
27,1747593579856692225,BhAsxoLHIQB,136,0,2018-04-01 02:23:30,Sunday,Put your hands 🙌 if you’re ready to TWRK tonight! #TempleTen #TempleSF,False,,lariotsofficial cutty__72 og_juulz djamadeus gdwright_art freshprincebadnewz roncarrollbmc rundeirun nickwiththecanon andre.arquiza ,TempleTen TempleSF ,,False
28,1747329759074602448,Bg_wyh7HE3Q,216,5,2018-03-31 17:39:20,Saturday,Nothing but 🖤 THANK YOU @djtigerlily! #TempleSF #TempleTen,False,,alexander.luescher i__am__wonder__woman djscene leeee_15 ozzytres moonb_training robupland dj_ibarra lvl55sf derekdjflip ,TempleSF TempleTen ,djtigerlily! ,True
29,1746869510848997912,Bg-IJCXHWoY,237,2,2018-03-31 02:24:55,Saturday,✌️out  Friday’s here. @djtigerlily #TempleTen #TempleSF,False,,whyatt16 javieralmirez dandeezeee yo_big_ed fkn_bananas edna_medeiros_08 natalie_natural mavericks1985 dwong_94 _douglasribeiro_ ,TempleTen TempleSF ,Friday’s djtigerlily ,True
30,1746692634490896503,Bg9f7JanwB3,93,2,2018-03-30 20:36:17,Friday,Tonight we welcome Australia’s #1 Female DJ back to our Temple! Link in bio for last minute tickets! #TempleSF #TempleTen,True,704.0,djxbuttersx lariotsofficial patriciaisalatenightmermaid889 fergiedj late_night_shenanigans danceelectricjc don_schmidih djque rundeirun temple_sf ,1 TempleSF TempleTen ,,True
31,1746187727799108127,Bg7tHyanMIf,64,4,2018-03-30 03:53:32,Friday,NATOMA55 is taking over tonight 🔥 #Natoma55 @wearethatsound @amprsndmusic @the_schmidt_ @a_fox38,True,490.0,nickwiththecanon b_dubb240 marticebaylorthenewqueen the_schmidt_ charlesbellantoni king_alex_benson19 creatures_art derekdjflip temple_sf theartofvapor ,Natoma55 ,wearethatsound amprsndmusic the_schmidt_ a_fox38 ,True
32,1745968764477688543,Bg67Vc7nsrf,64,1,2018-03-29 20:35:17,Thursday,THIS WEEKEND Tonight: @losrakas + #NATOMA55 Friday: @djtigerlily  Saturday: @wearetwrk  Link + Info in bio for last minute discounted tickets and tables • plan ahead and save $$ Bay Area 🙌🏼 VIP Reservations: (415) 312-3668 #TempleTen,False,,lukebradleyphotog edna_medeiros_08 king_alex_benson19 ozzytres prettysopary saintclairmusic djque marticebaylorthenewqueen juan_ton_soup temple_sf ,NATOMA55 TempleTen ,losrakas djtigerlily Saturday: wearetwrk Link ,True
33,1745531881704409826,Bg5X_-JHEri,153,3,2018-03-29 06:07:17,Thursday,Now let us see you TWRK 🙌 Join the party this Saturday night - visit www.templesf.com for guaranteed tickets! Limited tables left  call (415) 312-3668 to reserve yours! @wearetwrk #TempleTen #TempleSF,False,,djque oskouie56 marccmiller dancefitzii connor.gibbs_ cooldjlboogie darcilene.gomes fernando_cortezz 777core1 moonb_training ,TempleTen TempleSF ,call wearetwrk ,True
34,1744745765082650475,Bg2lQd_Hldr,143,3,2018-03-28 04:05:24,Wednesday,Stand out this Thursday 🙌 party with @losrakas &amp; friends!  Visit www.templesf.com to grab a FREE ticket (limited supply left)! #TempleTen #TempleSF,False,,rascally_goo blazevegas eprlife lauroafons0 andcardenas joeyvegas106 sho_9513 cfjon_jarell gixxer1910 tiffanyagulan ,TempleTen TempleSF ,losrakas Visit ,True
35,1744494044414652208,Bg1sBc2Hq8w,103,2,2018-03-27 19:46:19,Tuesday,Aint no party like a @staffordbrothers party 🙌 Experience their return on Sat. April 14! (link in bio) #TempleTen #TempleSF,True,644.0,charlesbellantoni temple_sf pinotalameda alonso_093 steven.sf8 djque erwinestrabo marticebaylorthenewqueen saintclairmusic goddessofwealth ,TempleTen TempleSF ,staffordbrothers ,True
36,1743909668345801081,BgznJqOHul5,119,1,2018-03-27 00:24:14,Tuesday,Weekend... we see you  we miss you  we’re ready for you (again). #TempleTen #TempleSF,False,,b_dubb240 dirttymartini candycatmini fairydancer_jeanette lucinamaurine timenightclub prettysopary deejayelekt temple_sf djque ,TempleTen TempleSF ,we we’re ,True
37,1743809183148181281,BgzQTaFnIch,80,5,2018-03-26 21:04:35,Monday,** CONTEST ** Tag your crew for a chance to win a pack of 5 tickets to @djtigerlily this Friday night! Must be following @temple_sf &amp; 21+! Good luck! #TempleTen #TempleSF,False,,marticebaylorthenewqueen juan_ton_soup goddessofwealth prettysopary temple_sf quarterjack djque djtigerlily submergedsessions dj_ibarra ,TempleTen TempleSF ,djtigerlily temple_sf ,True
38,1743295723733781070,BgxbjlvnApO,147,2,2018-03-26 04:04:26,Monday,The doors to our Temple are open tonight for an exclusive 18+ party featuring @partythieves! #TempleSF #TempleTen,False,,kettab.205 theenabler00 pif_pafoioioi creatures_art espoir.rsn eprlife baydragoness roncarrollbmc pepp_one76 nickmanacop ,TempleSF TempleTen ,partythieves! ,True
39,1742538524145381888,BguvY4rHnIA,182,6,2018-03-25 03:00:01,Sunday,Who’s ready for another #SoldoutSaturday? 🔥 Sounds by @djtriplexl • VIP Reservations (415) 312-3668 #TempleTen #TempleSF,False,,minombreesveronica b_dubb240 mrkingbandz 1king_h foxtaill acoyaya kid.vincent djerock rundeirun suppose2bwinnin ,SoldoutSaturday TempleTen TempleSF ,djtriplexl ,True
40,1742329422798645217,Bgt_2D3n-fh,152,3,2018-03-24 20:04:34,Saturday,Last night deserved a standing ovation 🙌 @saintclairmusic #TempleTen #TempleSF,False,,marccmiller djdaxonline executivezombie freshprincebadnewz stoneagechase djcaptn20 chereez81 pilgrim1965 moonlightmoods raha_nails ,TempleTen TempleSF ,saintclairmusic ,True
41,1741615773356377580,BgrdlGCH8Xs,133,1,2018-03-23 20:26:40,Friday,Tag your partner in crime if you’re ready for this weekend @lvl55sf 🔥 Sounds by @shabazzo @djplayboi @_marioe @djmjsf1 #LVL55 #TempleSF,False,,wolfgangchristian alonso_093 charlesbellantoni djisak_ timenightclub akillersconfessions johnshermanhoyt prettysopary gixxer1910 wender_campos_ ,LVL55 TempleSF ,lvl55sf shabazzo djplayboi _marioe djmjsf1 ,True
42,1741061823171306921,BgpfoDuHqWp,137,5,2018-03-23 02:06:04,Friday,Our Temple awaits you tonight 🔥 @djamen3000 #TempleTen #TempleSF,False,,bas_van_eijk_1988 ecjusuf imakeitraniel r_padilla24 cooldjlboogie djcolbyb 808snace mayahappydance kev0_88 ozzytres ,TempleTen TempleSF ,djamen3000 ,True
43,1740833823297279857,BgoryOSnpdx,76,1,2018-03-22 18:33:05,Thursday,THIS WEEKEND Tonight: @djamen3000  Friday: @saintclairmusic  Saturday: @djtriplexl  Link + Info in bio for last minute discounted tickets and tables • plan ahead and save $$ Bay Area 🙌🏼 VIP Reservations: (415) 312-3668 #TempleTen,False,,claudinhacrespo gibsonsprovisions marticebaylorthenewqueen djnunez1 jesssicaceleste king_alex_benson19 djque prettysopary temple_sf djamen3000 ,TempleTen ,djamen3000 Friday: saintclairmusic Saturday: djtriplexl Link ,True
44,1740367990053858486,BgnB3dRnuy2,151,10,2018-03-22 03:08:06,Thursday,All roads lead to Temple SF on Friday  April 6 🔥 @blasterjaxx #TempleTen #TempleSF,True,1134.0,oswaldo19_81 _natalielue_ paul_s0uthgate hollywoodairbrushtanningsalon mlboakland07 djduoliveira xo_annet_xo styledliving sprocket.ee rosebridgettee ,TempleTen TempleSF ,April blasterjaxx ,True
45,1740121403589797151,BgmJzJvBiUf,135,1,2018-03-21 18:57:37,Wednesday,Free tickets for @saintclairmusic this Friday are going 💨 Head over to www.templesf.com to grab your! For VIP Reservations (415) 312-3668 #TempleTen #TempleSF,False,,skankinsouls misteroddmusic romeoreyes1 kezzeddine zancosvenezuela brutt3k itineraryclublasvegas norcalafterdark marccmiller erwinshotit ,TempleTen TempleSF ,saintclairmusic ,True
46,1739709799584851678,BgksNhohWbe,117,1,2018-03-21 05:19:50,Wednesday,Our Temple awaits you this Thursday night 🙌 @djamen3000  #TempleTen #TempleSF,False,,picturebrooks itslesleyvang beaautifulbee jesssicaceleste oskouie56 djamen3000 marticebaylorthenewqueen prettysopary candycatmini charlesbellantoni ,TempleTen TempleSF ,djamen3000 ,True
47,1739417789674130577,Bgjp0ONhYyR,98,2,2018-03-20 19:40:04,Tuesday,It’s almost time to welcome back our Aussie bombshell @djtigerlily on Friday  March 30! Tickets available at templesf.com • For VIP 📞 415.312.3668 #TempleTen #Tigerlily,True,796.0,dxrelish b_dubb240 noellaplz king_alex_benson19 fergiedj marticebaylorthenewqueen goddessofwealth prettysopary djque temple_sf ,TempleTen Tigerlily ,djtigerlily March ,True
48,1738918207785723380,Bgh4OWUhuX0,96,5,2018-03-20 03:07:05,Tuesday,JUST IN! @thomasgold is headlining our Temple on Saturday  April 28! Tickets ➡️ www.templesf.com #TempleTen #TempleSF,False,,jenny_batres aryanizadi charlesbellantoni late_night_shenanigans kaishamee djamadeus itsshimsu kae_low.hightimes donnie_wheeler djque ,TempleTen TempleSF ,thomasgold April ,True
49,1738721832712148258,BghLktyBhUi,133,21,2018-03-19 20:36:56,Monday,CONTEST! Tag your crew for a chance to win a pack of 10 complimentary tickets into our Temple this Saturday night! Sounds by @djtriplexl! #TempleSF #TempleTen,False,,marccmiller aryanizadi norcalafterdark erwinestrabo kezzeddine sonny_james99 nick_patel199 b_dubb240 em1_si_19 fel1fel ,TempleSF TempleTen ,djtriplexl! ,True
50,1738238121617119178,BgfdlyuB9fK,448,4,2018-03-19 04:35:53,Monday,#TempleRepost 📸 @dairanxu2112  Congrats  you've won a pair of tickets to a show of your choice! Share with us your best Bay Area shots for a chance at being featured on our Instagram 🙌🏼 1 winner will be posted weekly  and will win a pair of tickets to the event of their choice! Use ➡️ #TempleRepost in your caption + tag @temple_sf for a chance to win! #TempleSF,False,,edna_medeiros_08 ringtaileddavid jifster_ e.s.k.o likeasprainedankleboiii atu_nia chelsea_sfnights johnagi_ the1cep xdee_kayx ,TempleRepost TempleRepost TempleSF ,dairanxu2112 Congrats you've and temple_sf ,True
51,1737967059209731030,Bgef9ULhrvW,170,1,2018-03-18 19:37:20,Sunday,Sparks were LIT last night 🔥 @will_sparks #TempleSF #TempleTen,False,,anthonytm18 mikey_likesit44 being_nelsia enya.angel cooldjlboogie cevauragami djamadeus samgui_ ozzytres thisonesformandela ,TempleSF TempleTen ,will_sparks ,True
52,1737433303700976860,BgcmmJoB7Tc,197,3,2018-03-18 01:56:51,Sunday,Lights. Camera. Action. It’s time to welcome back @will_sparks tonight 🙌 #TempleSF #TempleTen,False,,stefrheart cathycns25 whoabreaux__ zarajevoo solontakespictures theenabler00 jz0n b_dubb240 lariotsofficial inhouse.radio ,TempleSF TempleTen ,will_sparks ,True
53,1737254697989184218,Bgb9_GGBhra,153,2,2018-03-17 20:02:00,Saturday,Thank you for another SOLD OUT night 🔥 @robin__schulz #TempleTen #TempleSF,False,,startupsshowcase prettysopary picturepierson robin_schulz__fan_page sho_9513 ibrm___ john_korrila thegregwasik benjammins.delusions ,TempleTen TempleSF ,robin__schulz ,True
54,1736634269444857076,BgZw6q_B9z0,121,3,2018-03-16 23:29:19,Friday,Advanced tickets for @robin__schulz tonight are SOLD OUT! Limited tickets will be available at the door 🙌 #TempleTen #TempleSF,False,,norcalafterdark king_alex_benson19 joeyvegas106 charlesbellantoni temple_sf preya_bear bas_van_eijk_1988 farbod.elessar iamalaabendahmen saintclairmusic ,TempleTen TempleSF ,robin__schulz ,True
55,1736523096103803028,BgZXo4vh1iU,422,1,2018-03-16 19:48:26,Friday,Happy Birthday @tiannag 🥂 Thanks for celebrating with us! #TempleTen #TempleSF,False,,gusfakhoury likeasprainedankleboiii maria.michellexo crownerssamarinda yanet94 antoniooibarra danyo408 willy031270 kevenzema _c_r_17 ,TempleTen TempleSF ,tiannag ,True
56,1736018493641690170,BgXk59FBYw6,791,11,2018-03-16 03:05:52,Friday,The birthday girl has arrived 🥂 Join @tiannag tonight with sounds by @romeoreyes1 &amp; @_marioe! #TempleTen #TempleSF,False,,0108manuel oscar_roth eliosalinas24 el_marihuano98 nubian_king23 fernandesjam customeartips a_p_o shhhhsp __silviamar__ ,TempleTen TempleSF ,tiannag romeoreyes1 _marioe! ,True
57,1735775401286218594,BgWtofrhrNi,73,3,2018-03-15 19:02:54,Thursday,THIS WEEKEND Tonight: @tiannag Birthday Bash Friday: @robin__schulz  Saturday: @will_sparks  Link + Info in bio for last minute discounted tickets and tables • plan ahead and save $$ Bay Area 🙌🏼 VIP Reservations: (415) 312-3668 #TempleTen,False,,startupsshowcase world_of_rio i__am__wonder__woman ceci_barros ucefadeit kezzeddine marticebaylorthenewqueen b_dubb240 king_alex_benson19 temple_sf ,TempleTen ,tiannag robin__schulz Saturday: will_sparks Link ,True
58,1735280510349229272,BgU9G4lBjzY,129,6,2018-03-15 02:39:38,Thursday,JUST IN! @blasterjaxx are headlining our Temple on Friday  April 6th! Tickets are available @ www.templesf.com • 📞 for VIP reservations (415) 312-3668 #TempleTen #TempleSF,False,,em1_si_19 rundeirun karazyrobbie marticebaylorthenewqueen caseyj__ dj_tr3yface erwinestrabo norcalafterdark djque moi_moi21 ,TempleTen TempleSF ,blasterjaxx April ,True
59,1735133432188881423,BgUbqnXhcoP,126,3,2018-03-14 21:47:25,Wednesday,We’re gearing up for a VIP weekend with @tiannag  @robin__schulz and @will_sparks! Reserve your VIP experience while tables last 📞 (415) 312-3668 #TempleTen #TempleSF,False,,dj_talyshum showtimedjx karazyrobbie norcalafterdark rundeirun charlesbellantoni temple_sf andcardenas hales2theyeah yauyouu ,TempleTen TempleSF ,tiannag @robin__schulz will_sparks! ,True
60,1734524377112052213,BgSRLsoBQH1,679,12,2018-03-14 01:37:20,Wednesday,Super model @tiannag is flying into the Bay Area this Thursday to celebrate her birthday with us 🔥 RSVP for free entry ➡️ www.templesf.com #TempleTen #TempleSF,False,,djgomexofficial itsmimi.mw_13 markkaneofficial moncada.b matiaselebi queenbrise djbenmartinez philip.nikoloff alig8t0r07 goldchampagne24k ,TempleTen TempleSF ,tiannag ,True
61,1734399214324323028,BgR0uVshJLU,200,4,2018-03-13 21:28:39,Tuesday,We can’t wait to welcome back Aussie bombshell @djtigerlily on Friday  March 30! Tickets available at templesf.com • For VIP 📞 415.312.3668 #TempleTen #Tigerlily,False,,sarah_arnett suppose2bwinnin derekdjflip jackyds14 carrerandres djweapon rajns784 startupsshowcase bidround ifeedsf ,TempleTen Tigerlily ,djtigerlily March ,True
62,1733797127295280376,BgPr00dByT4,154,0,2018-03-13 01:32:25,Tuesday,Thank you for another epic weekend ✨ #BringUsBack @dannyavila @kryoman #TempleTen,False,,bolor0115 slowboolin methodwuman thisguyjamessss smoothkingj tiffleeeee gixxer1910 fergiedj _mrwes em1_si_19 ,BringUsBack TempleTen ,dannyavila kryoman ,False
63,1733620128840735420,BgPDlJzBNq8,243,75,2018-03-12 19:40:45,Monday,CONTEST!  Tag 3 friends + follow @Temple_SF for a chance to win a pack of 4 tickets to #RobinSchulz this Friday night! Must be 21+ // Must be following @Temple_SF! #TempleTen,False,,dj_rizz0 fat_phils_world_ edna_medeiros_08 carrerandres shawntaylorsteele mistrysagar abercrombieislit iiireners chuy_95076 alonso_093 ,RobinSchulz TempleTen ,Temple_SF Temple_SF! ,True
