,ID,SHORTCODE,LIKES,NUM_COMMENTS,DATE,WEEKDAY,CAPTION,IS_VIDEO,VIDEO_VIEW_COUNT,USERS_LIKED,TAGS,MENTIONS,HAS_COMMENTS
1267,1150402051300868203,_3DJIQq0Br,89,1,2015-12-29 03:10:32,Tuesday,3 DAYS UNTIL #NYE  @dirtysouth | #TheNewTemple | 2016  Limited advanced tickets are still available -- click the link in our bio to grab yours!,False,,prof.farnsworth arevalo_hannahans temple_sf 2ondre3000 sodapop4loveshennessy francisco415 juan_ton_soup nap_boule_entertainment ,NYE TheNewTemple ,@dirtysouth Limited ,True
1268,1150178014482088692,_2QM9tq0L0,107,0,2015-12-28 19:45:25,Monday,Photo galleries from our Post-Christmas banger with @djtriplexl are up now on our Facebook and website! #READY #SET #TAG  #TheNewTemple,False,,glitz.n.gogo salinasbrenda lm0ney jlntp_ temple_sf christophershay mikeydtico vetty.boo c.o.design_usa charlesbellantoni ,READY SET TAG TheNewTemple ,djtriplexl ,False
1269,1149506253201555525,_z3djRK0BF,91,10,2015-12-27 21:30:45,Sunday,@dirtysouth is transforming San Francisco into the #CityOfDreams in 4 days! Click the link in our bio to grab your advanced #NYE tickets!  #TheNewTemple,True,556.0,nicu_nuta erick_hernandez415 richardbahericz fzshad joshpage_ _stevvvo_ djcrank julianontheradio temple_sf ,CityOfDreams NYE TheNewTemple ,dirtysouth ,True
1270,1149450480383639569,_zqx8yK0AR,94,1,2015-12-27 19:39:56,Sunday,Thank you @djtriplexl for the proper post-holiday throw down last night! #TheNewTemple,False,,djkickz rubioo94_ champagnewarlich sebastianvego ghettobarbie4real manjim2025 rulass_ vxxr109 itz_renebenitez savage_keli4nia ,TheNewTemple ,djtriplexl ,True
1271,1148738761084584211,_xI9EiK0ET,114,7,2015-12-26 20:05:53,Saturday,Time to burn off those holiday calories!  Tonight we welcome back @djtriplexl to our main room  w/ @djerock &amp; @claytonwilliam @lvl55sf!  Early bird tickets are still available -- click the link in our bio to grab yours! #TheNewTemple,False,,eoropeza2623 xoest_muaxo whatz_goin_down_app thqueenbee code_red81 dionizkaimukilwa charlesbellantoni kathygonzales78 temple_sf mikesaintjules ,TheNewTemple ,Tonight djtriplexl w/ djerock claytonwilliam lvl55sf! Early ,True
1272,1146565759534318028,_pa3vIq0HM,179,11,2015-12-23 20:08:31,Wednesday,Our #WCW goes out to @djtigerlily!  Catch her in action at #TheNewTemple on Saturday January 23rd! Click the link in our bio to grab your early bird tickets!,False,,lambiiie sfcitygirl88 efigueroa271 jamesonamish official_afterparty brycesexton lianajernigan whatz_goin_down_app being_nelsia ,WCW TheNewTemple ,djtigerlily! Catch ,True
1273,1146066870972661817,_npb89K0A5,99,3,2015-12-23 03:37:19,Wednesday,Temple TV: Light Year  Our full length #TempleTV clip featuring Light Year is up now on our Facebook!  Get to know your favorite world-renowned DJs every Tuesday! #TheNewTemple,True,651.0,cloudskipper dj_iv_official ian_hays23 mariselaramirez_ mhm.lxngtn charlesbellantoni frits.ong whiskyginge temple_sf nickistall ,TempleTV TheNewTemple ,Our Get ,True
1274,1145114888820703623,_kQ-yfK0GH,97,4,2015-12-21 20:05:54,Monday,Join us this Saturday night for the return of @djtriplexl!  Click the link in our bio to grab your reduced early bird tickets 🙌🏼 #TheNewTemple,False,,mad_maxx2200 ciremusic djtriplexl _winneh rjgaga daniel_booty g4os7ed temple_sf inhouse.radio ,TheNewTemple ,djtriplexl! Click ,True
1275,1144393460345422513,_hs8n3K0Kx,131,1,2015-12-20 20:12:33,Sunday,The aftermath... #TRASHED  #TheNewTemple @djtommytrash,False,,iammichaelbrick raniux_si kush3d ronron2 facundograssi_ kolby_t33 jayi415frommarin keani.rose _miggyyy_r bwilcox22 ,TRASHED TheNewTemple ,djtommytrash ,True
1276,1143861747496207138,_f0DLrq0Mi,152,7,2015-12-20 02:36:07,Sunday,3.5 hours and counting  #TRASHED @djtommytrash #thenewtemple,False,,flip85 raider_gabe whatz_goin_down_app jz0n simplymoe415 hdz_mayte phoenixjagger kgr00_ ,TRASHED thenewtemple ,djtommytrash ,True
1277,1143678216581103895,_fKUdMq0EX,109,3,2015-12-19 20:31:29,Saturday,Rise &amp; recover  San Fran - our weekend is NOT done yet! Tonight we're getting #TRASHED with the one and only @djtommytrash!  Click the link in our bio for last minute tickets!  #TheNewTemple,False,,ankoku510 brighthummingbird floatillahawaii vill_tns djrickgee norcal2slocal kittenhope ikeilyouz amir_e3x ,TRASHED TheNewTemple ,San djtommytrash! Click ,True
1278,1142946150268748791,_cj3fUK0P3,92,1,2015-12-18 20:17:00,Friday,Now THAT'S how you take Thursday to the #NextLevel... Keeping the weekend juices flowing tonight with @sidneysamson!  Click the link in our bio for last minute tix!  #TheNewTemple,False,,erick_hernandez415 erakill _iam.ko8e sidewayz_415 iamdjsmiith juliet2386 jaxpereira temple_sf oct.6.98 djskytechofficial ,NextLevel TheNewTemple ,sidneysamson! Click ,True
1279,1142447190378758301,_ayaqtK0Cd,235,3,2015-12-18 03:45:39,Friday,clouds... the only birds that never sleep  #NoSleepUntilSunday  Our weekend starts  tonight! 🙌🏼🍾,False,,thegoodstufff__ norcal2slocal talisamariegarciaxoxo carlitoswy82 dalcalathereal _iam.ko8e losfelizpunk freddiedeejay webclubbing delaoinvegas ,NoSleepUntilSunday ,Our tonight! ,True
1280,1142327272358494385,_aXJoWK0Cx,73,7,2015-12-17 23:47:24,Thursday,ONLY 2 MORE WEEKS UNTIL 2016!  Ring in the New Year with @dirtysouth!  Tickets and tables are going FAST! Click the link in our bio to grab/reserve yours! #TheNewTemple,True,540.0,cupcakecait ohallyyyyyy italiansf fatmoneyrecs kemy48 nopedontdothat conrado08 djblastnyc temple_sf showerpromotion ,TheNewTemple ,Ring dirtysouth! Tickets ,True
1281,1142195316895466275,_Z5JbPq0Mj,72,0,2015-12-17 19:25:13,Thursday,** JUST ANNOUNCED  @ftampa joins our STACKED January roster on Saturday January 16th!  Click the link in our bio to grab your tickets!  #TheNewTemple,False,,duck.s queenlilypop ohvitto djkickz katcatmiow drazpa deleon_l7 mikeuriarte temple_sf ,TheNewTemple ,@ftampa Click ,False
1282,1141692699018740612,_YG3X3q0OE,102,1,2015-12-17 02:46:37,Thursday,It's time to whip out the ugly sweater!  Tomorrow night we're hosting our #UglySweater Christmas Party @lvl55sf with music by: @djerock @dje20 @djenfo and @djbrianv  Click the link in our bio for more info  and be sure to follow @lvl55sf for all LVL55 event updates and announcements! #TheNewTemple,False,,paulahi gabbylyssa_ ap_arashv hella_nette temple_sf djcrank djmikesincere eprlife loveofmylife_2010 ,UglySweater TheNewTemple ,Tomorrow lvl55sf djerock dje20 djenfo djbrianv Click and lvl55sf ,True
1283,1141567200569279207,_XqVIVK0Ln,89,2,2015-12-16 22:37:16,Wednesday,** JUST ANNOUNCED  @fergiedj is gearing up to kick off his first #FergieForever party of 2016 on Friday January 15th!  Click the link in our bio for tickets + info!  #TheNewTemple,False,,sean_o_sullivan99 hella_nette tyler_b_w dj_alvaronyc this1guybryan djmarsgambino harythehealer temple_sf z3rovirus mooskah ,FergieForever TheNewTemple ,@fergiedj Click ,True
1284,1140705588614480215,_UmbBqq0FX,104,0,2015-12-15 18:05:24,Tuesday,Say Rosè! 📸  Photo albums from this past weekend are up now on Facebook and templesf.com! Download  Tag and Share your favorites! #TheNewTemple,False,,frits.ong freddy.xxv kk.c.kuk ceci_barros stayedclassy michellegibsonphoto 2ondre3000 showerpromotion temple_sf ,TheNewTemple ,Photo Tag ,False
1285,1139548070441861604,_QfO63K0Hk,136,2,2015-12-14 03:45:37,Monday,CANT STOP 🙌🏼 WONT STOP  The party continues next weekend with: Friday 12/18: @sidneysamson Saturday 12/19: @djtommytrash  Click the link in our bio for tickets + info!  #TheNewTemple,False,,sebastianvego _1989_jr mooskah ravethefvckup bsaltx labronpp hitunez.official fatal.attraction mr.mike.b rubyanncook ,TheNewTemple ,The sidneysamson djtommytrash Click ,True
1286,1139426692736696759,_QDopEK0G3,179,11,2015-12-13 23:44:28,Sunday,👆🏼 #Repost @officialdondiablo ・・・ San Francisco ROCKED last night! #DonDiablo #Temple #TourLife 🙏🔥🙏🔥🙏🔥🙏🔥🙏🔥🙏,False,,whatz_goin_down_app kakuberry lucasmedeiro kingdomthecrown patrickstauffacher chelonica anaisroqui officialdjsol diopandah ,Repost DonDiablo Temple TourLife ,officialdondiablo ,True
1287,1138608681796715347,_NJpBAq0NT,131,4,2015-12-12 20:39:13,Saturday,TECHNO IS THE ANSWER  Big thanks to @officialgreenvelvet for delivering a killer set last night 🙌🏼✳️ #TheNewTemple,False,,team201powell papaaulaaaa djdanny_espinal amir_e3x iankuper bsaltx ficklenickel52 norcal2slocal jen_ifer94 ,TheNewTemple ,Big officialgreenvelvet ,True
1288,1137838501499978268,_Kahatq0Ic,91,1,2015-12-11 19:09:01,Friday,Last night was LIT  Our weekend continues tonight with @officialgreenvelvet + the @lisbonasisters  followed by @officialdondiablo tomorrow 🙌🏼 Click the link in our bio to grab your tickets! LIMITED REMAIN!  #TheNewTemple,False,,nopedontdothat deadguapzsf dancetronauts rickyrocksdrums sozay101 julianontheradio temple_sf _stalin nick_matteus pangtanta ,TheNewTemple ,Our officialgreenvelvet lisbonasisters followed officialdondiablo ,True
1289,1137356843508253153,_ItAXwK0Hh,166,1,2015-12-11 03:12:02,Friday,Temple On | World Off  See you tonight! #TheNewTemple,False,,ankoku510 thenickrob whiskyginge chelseystarling mzk1ta kvaromusic altheajeanne z3rovirus slim_5_nb thestylistreeseb ,TheNewTemple ,See ,True
1290,1137257398582067280,_IWZQcq0BQ,98,0,2015-12-10 23:54:28,Thursday,The shirt says it all!  It may not be Friday  but our weekend starts TONIGHT! Join us for our @truthlive #BirthdayBash w/ @milesmedina @djtonytone &amp; @cutso!  Click the link in our bio for last minute tickets and tables -- #TheNewTemple #NextLevelThursdays,False,,knives_d justoner lvl55sf sound_living genny_co_98 temple_sf ansshmssd45 kikin0205 capital4president fit_babydork ,BirthdayBash TheNewTemple NextLevelThursdays ,It but truthlive milesmedina djtonytone cutso! Click ,False
1291,1137133998316405656,_H6Vi_q0OY,89,10,2015-12-10 19:49:17,Thursday,ON-SALE NOW!  DAY 001 | @oliverheldens is kicking off 2016 with us on Friday January 1st!  Advanced tickets + tables are STRONGLY recommended! Click the link in our bio to grab/reserve yours! #TheNewTemple,False,,j.register3 speedytalks_ djblastnyc claudettediaz diopandah rodriguess_oficial salimaraks temple_sf ,TheNewTemple ,DAY oliverheldens Advanced ,True
1292,1136629022586519563,_GHhLsq0AL,119,2,2015-12-10 03:05:59,Thursday,It's almost time to take your Thursday to the next level!  Tomorrow we're hosting our @truthlive #BirthdayBash with @milesmedina @djtonytone and @cutso!  Click the link in our bio for tickets + tables!  #TheNewTemple,False,,dd420fire dannyy_rojas flip85 showerpromotion papaaulaaaa ansshmssd45 temple_sf kellswhits _1989_jr barsh.d ,BirthdayBash TheNewTemple ,Tomorrow truthlive milesmedina djtonytone cutso! Click ,True
1293,1136489859396617148,_Fn4F4K0O8,74,3,2015-12-09 22:29:30,Wednesday,@officialdondiablo  this Saturday  you ready?  Tickets are going quick! Click the link in our bio to grab yours! #TheNewTemple,True,477.0,scrumptious_serim _stevvvo_ kakuberry jaxpereira frisconative4 dj_iv_official _jtran_ djblastnyc showerpromotion temple_sf ,TheNewTemple ,officialdondiablo this you Tickets ,True
1294,1136405931046421276,_FUyxgq0Mc,123,6,2015-12-09 19:42:45,Wednesday,** JUST ANNOUNCED  Aussie bombshell @djtigerlily is joining our January roster on Saturday 1/23!  Advanced tickets + tables are available now at www.templesf.com! #TheNewTemple,False,,being_nelsia whatz_goin_down_app dj_ibarra kittenhope hads_sum_devil kk.c.kuk urbancutz whiskyginge letsdrewthis ,TheNewTemple ,Aussie djtigerlily Advanced ,True
1295,1135910299621867558,_DkGYxq0Am,117,4,2015-12-09 03:18:01,Wednesday,Lets. Get. #TRASHED  Join us for the return of @djtommytrash on Sat 12/19  Click the link in our bio for advanced tickets  table reservations and info! #TheNewTemple,False,,ramoneduassuncao scrumptious_serim sick1manny _rolemodel_ kakuberry trophyrings elevated.angel temple_sf bummrrr ,TRASHED TheNewTemple ,Join djtommytrash Click table ,True
1296,1135781560393089191,_DG0_Bq0Cn,97,1,2015-12-08 23:02:14,Tuesday,@sidneysamson is giving us a dose of his #Netherlands sound next Friday  December 18th!  Click the link in our bio for advanced tickets  table reservations and info! #TheNewTemple,False,,gymtimego101 robgarzamusic euphoricstyles djkmac justlee168 pangtanta this1guybryan ,Netherlands TheNewTemple ,sidneysamson December Click table ,True
1297,1135720752111895201,_C5AG5q0Kh,74,2,2015-12-08 21:01:25,Tuesday,Temple TV: @leefoss  Our full length #TempleTV clip featuring Lee Foss is up now on our Facebook!  Get to know your favorite world-renowned DJs every Tuesday! #TheNewTemple,True,428.0,_megdougherty euphoria_hardstyle charlesbellantoni ____ayebeeeasyy jaxpereira fatmoneyrecs fzshad wassup_internets temple_sf ,TempleTV TheNewTemple ,leefoss Our Get ,True
1298,1135116770356183225,_AvrBDq0C5,124,3,2015-12-08 01:01:25,Tuesday,📸 the best thing about memories... is making them  Photo albums from this weekend are going up now! Head over to our website + Facebook to download  post and tag your favorites!  #TheNewTemple,False,,theartofvapor imagineunity flip85 nai.trebor z3rovirus djnovanyc sp3nd3r joshlanglv simple_dre_ ,TheNewTemple ,Photo post ,True
1299,1134246851917857763,-9p4CYK0Pj,121,0,2015-12-06 20:13:03,Sunday,💨💨🙌🏼🙌🏼 Thank you again to @zenfreeman and @fergiedj for flooding our Temple with wall-to-wall energy!  #TheNewTemple,False,,iankuper kel_magpiong ruskothepug temple_sf hdz_mayte djcrank 415aone benjammins.delusions djskytechofficial ,TheNewTemple ,zenfreeman fergiedj ,False
1300,1133501609677635888,-7AbVdK0Ew,106,2,2015-12-05 19:32:23,Saturday,Thank you @zenfreeman!  Tonight we're diving into a 5 HOUR SET with @fergiedj 🙌🏼 Click the link in our bio to be a part of the action! #TheNewTemple,False,,a.meleo dinomfu candyapplepunch reflecta levelnine.asia dominiquegoose lotsofloveang ohvitto mtsirik ,TheNewTemple ,zenfreeman! Tonight fergiedj ,True
1301,1132989141880619578,-5L58oK0I6,129,2,2015-12-05 02:34:12,Saturday,our weekend &gt; theirs  it's almost go time with @zenfreeman!  limited tickets + tables are left -- click the link in our bio to grab yours #TheNewTemple,False,,jonny_gatsby ameelooooove charlesbellantoni mateoreymoreno corymeowww jaredfinney rulass_ _marioe daisy_serene electrichype ,TheNewTemple ,it's zenfreeman! limited ,True
1302,1132800177739612921,-4g8KDq0L5,138,3,2015-12-04 20:18:46,Friday,Looking back on this work week like... ✌🏼️ Tonight @zenfreeman powers #FutureFactoryFriday  followed by @fergiedj tomorrow!  Click the link in our bio for tickets  tables &amp; info!  #TheNewTemple,False,,ded.af alvinatlight thecaliclausen _dinamedina _stalin jossi_jellies clinkthedrink mandito72 javanmardhamid prissylitttleb ,FutureFactoryFriday TheNewTemple ,zenfreeman followed fergiedj Click tables ,True
1303,1132045933625426884,-11cdfK0PE,100,2,2015-12-03 19:20:13,Thursday,Bottles delivered by a 10ft long dragon?  Why not.  Book your #VIP experience with us today!  More info: templesf.com #TheNewTemple,False,,caseyj__ temple_sf matt_ex kingdomthecrown chantellly ztraina25 ktrangy xo_annet_xo marioguzik socialnightclub ,VIP TheNewTemple ,Why Book More ,True
1304,1131561995878482768,-0HaPVq0NQ,167,3,2015-12-03 03:18:43,Thursday,🔙 to the main room  Tomorrow night we're taking your Thursday to the next level in our main room with @djfellifel!  Click the link in our bio for tickets!  #TheNewTemple,False,,bigcupofjoe fatmoneyrecs charlesbellantoni rickwonder glitz.n.gogo koalakauf catch_l_if_u_can letssdance2night djstellar brettbussell24 ,TheNewTemple ,Tomorrow djfellifel! Click ,True
1305,1131445785975275803,-zs_Kbq0Eb,53,0,2015-12-02 23:27:50,Wednesday,past | PRESENT | future  Get to know @fergiedj before his return to #TheNewTemple this Saturday night!  Click the link in our bio for tickets + info,False,,chrgr_co dj_lyf vetty.boo being_nelsia youngemarley raymondf1984 jakeaverill deadguapzsf elguapo415 temple_sf ,TheNewTemple ,Get fergiedj Click ,False
1306,1131331007973900783,-zS47Fq0Hv,70,2,2015-12-02 19:39:47,Wednesday,@sidneysamson is dropping #Bludfire🔥 on Friday December 18th!  Advanced tickets and tables are available -- click the link in our bio for more info! #TheNewTemple,False,,shivani_00b adrianmcdaniel9 its_ingars david_trap _jtran_ andreszeav nicolas_lunn_ temple_sf fradiquefabi ,Bludfire TheNewTemple ,sidneysamson Advanced ,True
1307,1130839221283274903,-xjEfCq0CX,123,2,2015-12-02 03:22:41,Wednesday,Hands up 🙌🏼 if you're going to join us as we ring in 2016 with @dirtysouth this NYE!  Advanced tickets and tables are available -- click the link in our bio for more info! #TheNewTemple,False,,civicvixen99 chrissygsfsu therealdjaspect pedro_belm oops_its_hayley dannyy_rojas deavonladean rehgz27 flippa_skippa temple_sf ,TheNewTemple ,dirtysouth Advanced ,True
1308,1130684564216955849,-w_57bK0PJ,92,1,2015-12-01 22:15:25,Tuesday,Ready for another dose of @zenfreeman?  Catch him this Friday  December 4th!  Click the link in our bio for tickets + info  #TheNewTemple,False,,zenfreeman jessie120945 mr_swinn djcal1 a_mahdy50 theartofvapor jeffretro yoimshon oct.6.98 tiffanytherocker ,TheNewTemple ,zenfreeman? Catch December Click ,True
1309,1130613965012549715,-wv2kyq0BT,104,7,2015-12-01 19:55:09,Tuesday,Temple TV: @yolandabecooler  Our full length #TempleTV clip featuring Yolanda Be Cool is up now on our Facebook!  Get to know your favorite world-renowned DJs every Tuesday! #TheNewTemple,True,513.0,djmethod415 scrumptious_serim tabatthaa amir_e3x tempestfunk flip85 z3rovirus gnarlyxliz djdavidaaron temple_sf ,TempleTV TheNewTemple ,yolandabecooler Our Get ,True
1310,1129898173967057575,-uNGcbq0Kn,143,3,2015-11-30 20:13:00,Monday,Lights  Camera  #TAG  Our weekend photo galleries are on their way. Be sure to follow us on Facebook/check our website to download and repost your favorites!  #TheNewTemple,False,,michaellucas23 mateodude joey_pelillo ericlmitchell cuttycitydude aly.g_in_da_house lamborghini02 gabbylyssa_ oops_its_hayley ,TAG TheNewTemple ,Camera Our ,True
1311,1128531297697480939,-pWTxtK0Dr,111,14,2015-11-28 22:57:15,Saturday,[Press ▶️] Incase you wanted to know what's on the menu for tonight.  Countdown until @djstellar: 07hrs 03mins 22secs  #TheNewTemple,True,748.0,goldenchyld07 itsdjeli temple_sf djsethlowery z3rovirus anniehime.xo iamdjsmiith itssodope iamannicasvensson amir_e3x ,TheNewTemple ,Countdown djstellar: ,True
1312,1128477342229545452,-pKCnwq0Hs,106,2,2015-11-28 21:10:03,Saturday,No. Sleep. Until. Sunday.  Re-charge those 🔋 - we have another wild night ahead! Click the link in our bio for tickets + tables + more info! #TheNewTemple,False,,z3rovirus amir_e3x ohvitto complicatedmazee clinkthedrink mzprettypaparazzis gabbylyssa_ temple_sf erick_hernandez415 aaa_top10 ,TheNewTemple ,Re-charge ,True
1313,1127916564950762232,-nKiPOK0L4,105,3,2015-11-28 02:35:54,Saturday,Its almost go-time!  Use our #BlackFriday code: TempleBlack to enjoy 10% off all remaining 2015 events!  #TheNewTemple,False,,vetty.boo iamdjsmiith matt_ex efigueroa271 koalakauf djcrank matt.murray96 davidalexander3306 fchiu126 ,BlackFriday TheNewTemple ,Use ,True
1314,1127771263002689600,-mpf0PK0BA,79,2,2015-11-27 21:47:12,Friday,Tonight we have a #FEATUREd set by @djikon down in @lvl55sf!  Advanced tickets and tables are still available -- click the link in our bio to grab/reserve yours! #TheNewTemple #LVL55SF,False,,tarekbiomy00 being_nelsia djstellar jenna_cyde hj5uhruikejsjdhd djikon djjulianpierce baysosa sebastianvego clinkthedrink ,FEATUREd TheNewTemple LVL55SF ,djikon lvl55sf! Advanced ,True
1315,1127656443075052221,-mPY92K0K9,70,3,2015-11-27 17:59:05,Friday,#BLACKFRIDAY || take advantage of 10% OFF tickets for all 2015 shows! Head over to our #Snapchat @templeSF for the special promocode! Valid until 11:59pm PST tonight! #TheNewTemple,False,,yousinthehous rogerio.mestrinho riickardoovaldes laurenashleybee djerock jessie120945 shownuffent ciremusic cezarlsanchez saydisaydi ,BLACKFRIDAY Snapchat TheNewTemple ,templeSF ,True
1316,1125582220487770161,-e3xDhq0Ax,78,5,2015-11-24 21:17:58,Tuesday,Temple TV: @michaelwoods  Our full length #TempleTV clip featuring Michael Woods is up now on our Facebook!  Get to know your favorite world-renowned DJs every Tuesday! #TheNewTemple,True,494.0,hwyfoe bi63z_ed96 muthafxckin_ell julli.borges allycatdreams gabbylyssa_ amir_e3x _tsikis 96martingarrix96 djcrank ,TempleTV TheNewTemple ,michaelwoods Our Get ,True
1317,1124974786811478035,-ctpu1K0AT,142,13,2015-11-24 01:11:06,Tuesday,WHO'S READY TO GET #TRASHED?  The return of @djtommytrash is two weeks away 🙌🏼 Grab your advanced tickets and tables -- click the link in our bio! #TheNewTemple,False,,itsjustnugget hotmessdress nayesk03 pantheawine djmsjackson mrmonroy300 dxrxc claud_oncloud9 ca_clark_ blackoutartists ,TRASHED TheNewTemple ,The djtommytrash ,True
1318,1124744293759271929,-b5Pncq0P5,131,25,2015-11-23 17:33:09,Monday,Ready for another STACKED line-up?  Join us this Wednesday for a special #ThanksgivingEve celebration with @robin__schulz 🙌🏼 Advanced tickets and tables are available! Click the link in our bio to grab yours! #TheNewTemple,False,,webclubbing incrypted javanmardhamid aware.alpha tonyarzadon mrnightlife morphcr pangtanta shomar007 tammyvo ,ThanksgivingEve TheNewTemple ,Join robin__schulz ,True
1319,1124111052085870624,-ZpQvLq0Ag,141,2,2015-11-22 20:35:01,Sunday,last night's madness = epic  Always a wild time when the @staffordbrothers come to town! #TheNewTemple,False,,djdwayneofficial queencc_415 the_nutso amir_e3x lianajernigan the_plur_giant fzshad alee.arr5 nai.trebor insane_athlete4 ,TheNewTemple ,Always staffordbrothers ,True
1320,1123430601583182585,-XOi4RK0L5,147,4,2015-11-21 22:03:05,Saturday,Solid weekend kick-off with @iamdallask last night... Thank you for bringing your hometown Cali vibes to the Golden City!  Tonight we keep the energy flowing with the wild and crazy @staffordbrothers!  Last minute tickets &amp; tables are available. Click the link in our bio for more info! #TheNewTemple,False,,itsmeashp helena_inx robkalimusic k.aylafornia _hotssaus taticanes moz140 dj_zoltane zesar_sanchez ibrahim.rizk.961 ,TheNewTemple ,iamdallask Tonight staffordbrothers! Last ,True
1321,1122644091359412848,-Ubtpiq0Jw,98,1,2015-11-20 20:00:26,Friday,Who's ready for another colossal weekend? Tonight we welcome @iamdallask to #TheNewTemple  followed by Australia's #1 DJ-duo - the @staffordbrothers tomorrow!  Click the link in our bio for advanced tickets +tables!,False,,karleyelaine helena_inx rich_boii_shady rjgaga michellegibsonphoto _stalin _megdougherty jonny_gatsby clinkthedrink muthafxckin_ell ,TheNewTemple 1 ,iamdallask followed staffordbrothers Click ,True
1322,1122125801306407461,-Sl3iUK0Il,116,1,2015-11-20 02:50:41,Friday,Tonight we're jump-starting our weekend to the sounds of @djenfo @lvl55sf!  Take your Thursday to the next level at #TheNewTemple,False,,syahrilamir98 temple_sf lianajernigan _stalin karoluv cobra_jonez _jamalc rubyanncook hwyfoe key_elements_ent ,TheNewTemple ,djenfo lvl55sf! Take ,True
1323,1121923402742579955,-R32P9q0Lz,111,6,2015-11-19 20:08:33,Thursday,#TBT to our #SOLDOUT night with @dirtysouth this Summer!  Who's ready to ring in 2016 with us? Catch him live this New Years Eve when he brings his #FindAWayTour to #TheNewTemple!  Special advanced pricing is available - click the link in our bio for more info!,False,,sound_living speedytalks_ honyhairdesign whitemike707 jakeklassen_ oct.6.98 looie007 temple_sf ,TBT SOLDOUT FindAWayTour TheNewTemple ,dirtysouth Who's Special ,True
1324,1121406037273559243,-QCNl0q0DL,119,1,2015-11-19 03:00:38,Thursday,Our weekend kicks off tomorrow!  Take your Thursday to the next level - click the link in our bio for tickets + tables #TheNewTemple,False,,lunarcy420 malabegood yoadrian_dj chereez81 djenfo inhouse.radio xoest_muaxo moni510 naythan2it scrumptious_serim ,TheNewTemple ,Take ,True
1325,1119891176320352356,-Kpxdnq0Bk,163,6,2015-11-17 00:50:53,Tuesday,champagne is always the answer.  3️⃣2️⃣1️⃣ #TAG! Photo albums from this weekend are on their way. #TheNewTemple,False,,_still0_ karleyelaine yousinthehous xoest_muaxo umitswag_87 sberryy_k jz0n ls_chr1s youngemarley ,TAG TheNewTemple ,3️⃣2️⃣1️⃣ ,True
1326,1119789738571285363,-KStWWq0Nz,212,1,2015-11-16 21:29:20,Monday,It's a new week for new memories  Make your best ones with us #TheNewTemple,False,,miss_mason143 whitemike707 _beecalove _showy_show nelstein andthenjuan ian_hays23 demetriofonseca ,TheNewTemple ,Make ,True
1327,1119238989856588461,-IVe5pK0Kt,89,5,2015-11-16 03:15:06,Monday,#FindAWay to join us as we ring in 2016 with grammy-nominated @dirtysouth on #NewYearsEve!  Click the link in our bio for advanced pricing on tickets and tables #TheNewTemple,True,0.0,rulaz aanerom robertcorvera corinamarlene quarterjack shelbyadele_ ap_arashv shomar007 jas777_ j_cardona ,FindAWay NewYearsEve TheNewTemple ,dirtysouth Click ,True
1328,1119098414587134180,-H1hQuK0Dk,115,3,2015-11-15 22:35:48,Sunday,It was a PACKED house for the return of @sultanshepard last night!  Rest up  we have another massive weekend ahead with @iamdallask and the @staffordbrothers,False,,erakill nickavedesian mscass23 pedro_intotheworld derty__ the_plur_giant mikeeees temple_sf courtsf49 amir_e3x ,,sultanshepard Rest we iamdallask staffordbrothers ,True
1329,1118494223133000416,-FsJHlK0Lg,105,0,2015-11-15 02:35:23,Sunday,@dannyavila cO2'd the roof off last night  LIMITED last minute tickets &amp; tables are available for @sultanshepard tonight -- click the link in our bio!,False,,webclubbing _rick.h_ mindfulmaia lvlvip wolf.s_wrath djbeatthoz temple_sf hotmessdress ,,dannyavila LIMITED sultanshepard ,False
